ID,Fecha_Creacion,Contenido,Calificacion,Valoracion,likes,dislikes,fecha_compra,Numero de Palabras,Palabras_Prohibidas,Imagenes,Reacciones,atributos,Variación_Atributos
MLM1384934170,2022-09-20T23:50:52Z,Espectacular me encanto los colores muy vivos y en la noche se ve divino.,0,5,0,0,2022-09-06T01:56:25Z,14,0,0,,,
MLM1384934170,2022-09-05T20:17:10Z,"Excelente me encantaron tal como se ve en las fotos.
Lo volvería a comprar.",0,5,0,0,2022-08-19T01:53:19Z,14,0,0,,,
MLM1822165394,2023-11-20T00:11:44Z,Práctico para un buen regalo.,0,5,0,0,2023-07-29T20:06:19Z,5,0,0,,,
MLM2254526798,2023-11-09T20:11:18Z,Me gustó fue para un regalo biker es buen tamaño.,0,5,0,0,2023-11-07T01:43:53Z,10,0,0,,,
MLM2254526798,2023-11-07T20:55:13Z,Bonito tal como lo esperaba :).,0,5,0,0,2023-11-06T22:30:29Z,5,0,0,,,
MLM2254526798,2023-10-25T14:16:32Z,"Muy lindo y de buen tamaño pensé que era café por la imagen, pero le da más aun tono rosa.",0,5,0,0,2023-10-18T16:03:43Z,20,0,0,,,
MLM2254526798,2023-09-20T03:24:16Z,Muy lindo y pequeño.,0,5,0,0,2023-08-16T16:53:33Z,4,0,0,,,
MLM2254526798,2023-07-19T02:18:02Z,Hermoso.,0,5,0,0,2023-07-10T05:08:24Z,1,0,0,,,
MLM881807595,2023-03-10T05:10:17Z,Bello aunque lo esperaba mas grande pero aun en su tamaño me encanto.,1,5,1,0,2023-03-03T20:47:25Z,13,0,0,,,
MLM881807595,2023-03-10T01:36:29Z,Muy lindos y agradables. Me encantaron.,1,5,1,0,2023-03-02T23:42:11Z,6,0,0,,,
MLM881807595,2023-02-13T17:14:20Z,Supér lindo.,1,5,1,0,2023-01-24T16:46:49Z,2,0,0,,,
MLM881807595,2023-01-31T22:10:37Z,"Muy hermoso y más de noche con sus luces me encantó ojala hubiera más grandes, pero este esta hermoso 100 por ciento recomendables.",1,5,1,0,2023-01-06T15:20:13Z,23,10,0,,,
MLM881807595,2023-01-31T01:17:28Z,"Bellísimo atrapa sueños, lo compré para regalarlo y mis hermanas quedaron encantadas!! voy a pedir otro más para mi.",1,5,1,0,2023-01-30T14:04:55Z,19,0,0,,,
MLM881807595,2023-01-07T02:48:14Z,Está hermoso y lo que le sigue!! las luces funcionaron a la perfección y hace que de noche se vea wow! fue un regalo pero en definitiva compraré uno para mi.,1,5,1,0,2022-12-08T20:02:11Z,31,0,0,,,
MLM881807595,2022-09-26T22:03:32Z,"Está súper lindo!!, tal cuál cómo en la foto cómo recomendación compren más baterías porque duran muy poco las que trae puestas.",1,5,1,0,2022-09-10T20:30:51Z,22,0,0,,,
MLM881807595,2022-04-30T13:50:43Z,"Muy bonito, se ve padre, el único detalle que rápido se le acaba las baterías de las lucecita.",1,4,1,0,2022-04-14T19:07:49Z,18,0,0,,,
MLM881807595,2023-12-21T20:07:04Z,"Es hermoso y de buen tamaño, las luces led alusan muy bonito.",0,5,0,0,2023-12-18T13:46:16Z,12,0,1,,,
MLM881807595,2023-10-03T09:02:31Z,Muy bonito excelente producto.,0,5,0,0,2023-04-21T23:29:42Z,4,0,1,,,
MLM881807595,2023-07-03T00:54:04Z,"Muy bonito, buen tamaño, materiales corresponden a la imagen, pero dura muy poco encendido.",0,4,0,0,2023-04-10T20:25:23Z,14,0,1,,,
MLM881807595,2023-04-26T03:17:00Z,"Precioso, me encantó.",0,5,0,0,2023-04-19T01:11:04Z,3,0,1,,,
MLM881807595,2024-01-15T07:03:40Z,𝙃𝙚𝙧𝙢𝙤𝙨𝙤 𝙖𝙩𝙧𝙖𝙨𝙪𝙚𝙣𝙤𝙨.,0,4,0,0,2022-03-31T22:55:36Z,2,0,0,,,
MLM881807595,2024-01-12T06:38:53Z,"Aaay súper bonito, bello! excelente decoración y su luz tenue te permite dormir sin problema.",0,5,0,0,2024-01-04T06:12:15Z,15,0,0,,,
MLM881807595,2024-01-09T00:30:09Z,Mui bien excelente productos.,0,5,0,0,2024-01-07T19:17:14Z,4,0,0,,,
MLM881807595,2023-12-07T02:20:07Z,"Muy bonito, pero la batería no dura.",0,5,0,0,2023-03-19T00:16:21Z,7,0,0,,,
MLM881807595,2023-11-26T15:35:58Z,Se cuelga bien esta muy bonita y decora bien.,0,5,0,0,2023-03-28T05:22:34Z,9,0,0,,,
MLM881807595,2023-11-24T17:38:55Z,Divino es muy hermoso.,0,5,0,0,2023-11-16T23:33:31Z,4,0,0,,,
MLM881807595,2023-09-10T15:11:40Z,Me encantooooo.,0,5,0,0,2023-02-07T22:51:26Z,2,0,0,,,
MLM881807595,2023-08-13T00:43:23Z,Está muy chiquito y se le acabó la pila muy rápido.,0,5,0,0,2022-05-23T18:07:55Z,11,0,0,,,
MLM881807595,2023-08-11T16:55:32Z,Muy lindo.,0,5,0,0,2021-11-09T12:15:15Z,2,0,0,,,
MLM881807595,2023-07-31T07:57:49Z,Hermoso compré dos y volvería a comprar más lucen muy bien. Colores tiernos.,0,5,0,0,2022-05-08T04:21:55Z,13,0,0,,,
MLM881807595,2023-07-29T15:12:37Z,Excelente 🤙🏻🤙🏻🤙🏻🤙🏻.,0,5,0,0,2023-02-09T14:38:40Z,1,0,0,,,
MLM881807595,2023-07-02T06:26:53Z,Muy lindo.,0,5,0,0,2023-01-07T20:00:57Z,2,0,0,,,
MLM881807595,2023-06-29T21:32:48Z,A mi hija le encantó.,0,5,0,0,2023-01-04T03:33:48Z,5,0,0,,,
MLM881807595,2023-06-21T13:27:42Z,Muy bonito el tamaño esta super bien se los recomiendo 100%.,0,5,0,0,2023-05-20T04:14:20Z,11,0,0,,,
MLM881807595,2023-06-18T18:49:34Z,Le doy un 💯 es hermoso lindo 😍 la verdad si lo recomiendo mil.,0,5,0,0,2023-06-15T02:45:00Z,12,0,0,,,
MLM881807595,2023-06-17T16:00:19Z,Es bonito.,0,4,0,0,2023-06-03T04:26:32Z,2,0,0,,,
MLM881807595,2023-06-13T03:06:50Z,"Muy bonitos colores, material se ve bien y resistente además de que las luces le dan un toque muy bonito. Sin duda lo recomiendo.",0,5,0,0,2023-06-10T21:51:48Z,24,0,0,,,
MLM881807595,2023-06-10T12:12:30Z,"Materiales super bien, hacen que luzca tu lugar, lo recomiendo.",0,5,0,0,2023-05-20T23:31:18Z,10,0,0,,,
MLM881807595,2023-06-09T20:03:39Z,"Está muy lindo, lo pedí por los colores y realmente vienen tal cual a la imagen. Es un regalo para mi nena y se que le va a encantar!.",0,5,0,0,2023-06-07T21:55:32Z,29,0,0,,,
MLM881807595,2023-06-07T17:34:37Z,"Super lindo, fue un regalo y les encanto.",0,5,0,0,2023-03-03T03:57:28Z,8,0,0,,,
MLM881807595,2023-06-03T05:50:06Z,Muy bonito.,0,5,0,0,2023-04-04T17:45:35Z,2,0,0,,,
MLM881807595,2023-06-02T19:33:17Z,Se ven muy bonitos ya puestos.,0,5,0,0,2022-05-31T02:16:26Z,6,0,0,,,
MLM881807595,2023-05-31T21:12:05Z,"Esta hermoso, le da un toque femenino y tranquilo.",0,5,0,0,2023-01-30T10:33:19Z,9,0,0,,,
MLM881807595,2023-05-25T00:47:14Z,Me encato.,0,5,0,0,2023-05-18T23:03:53Z,2,0,0,,,
MLM881807595,2023-05-17T01:34:09Z,"Excelente, me permitió además complementarlos con un diseño único para regalo. Gracias.",0,5,0,0,2023-05-08T18:23:37Z,12,0,0,,,
MLM881807595,2023-05-13T10:07:32Z,Se ven super padres!.,0,5,0,0,2023-04-15T10:14:24Z,4,0,0,,,
MLM881807595,2023-05-11T21:09:17Z,"Precioso el atrapasueños, lo único malo es que la batería solo duró una noche.",0,5,0,0,2022-06-14T21:00:29Z,14,0,0,,,
MLM881807595,2023-05-10T11:23:21Z,Es más de lo que yo esperaba.,0,5,0,0,2023-04-03T22:58:02Z,7,0,0,,,
MLM881807595,2023-03-24T17:52:58Z,Excelente tal cual.,0,5,0,0,2022-12-26T23:28:59Z,3,0,0,,,
MLM881807595,2023-03-22T01:07:45Z,Muy parecido a la imagen.,0,5,0,0,2023-03-15T03:56:47Z,5,0,0,,,
MLM881807595,2023-02-16T00:35:11Z,Me lo imaginé un poco más grande pero está padre.,0,4,0,0,2023-02-09T20:43:04Z,10,0,0,,,
MLM881807595,2023-02-12T02:39:24Z,Excelente producto.,0,5,0,0,2023-01-13T13:30:18Z,2,0,0,,,
MLM881807595,2023-02-11T19:06:37Z,Muy bonito me encantó.,0,5,0,0,2023-02-04T15:32:41Z,4,0,0,,,
MLM881807595,2023-02-09T20:49:12Z,Muy buena decoracion.,0,5,0,0,2022-10-28T23:27:39Z,3,0,0,,,
MLM881807595,2023-02-08T16:51:05Z,"Bonito, tal. Com9 en la foto, nos encantó.",0,5,0,0,2022-12-31T07:37:41Z,8,0,0,,,
MLM881807595,2023-02-07T19:59:27Z,Tal cual como viene en la foto.,0,5,0,0,2023-01-06T19:58:57Z,7,0,0,,,
MLM881807595,2023-02-07T00:19:41Z,Lindo.,0,5,0,0,2023-01-21T05:48:10Z,1,0,0,,,
MLM881807595,2023-01-22T18:11:16Z,Muy bonito.,0,5,0,0,2022-12-27T16:00:36Z,2,0,0,,,
MLM881807595,2023-01-17T04:56:12Z,"Muy lindo los colores y el tamaño, fue para un regalo y verlo fue una grata sorpresa y más ver que prende, es una buena compra en relación al precio.",0,5,0,0,2022-12-06T23:51:18Z,30,20,0,,,
MLM881807595,2023-01-02T01:49:28Z,Muy bonito y de excelente calidad.,0,5,0,0,2022-12-30T19:01:42Z,6,0,0,,,
MLM881807595,2022-12-18T06:33:46Z,Exelente calidad esta hermoso.,0,5,0,0,2022-11-29T03:12:35Z,4,0,0,,,
MLM881807595,2022-12-17T17:24:38Z,"Me encantó es delicado, lindo, se ve precioso.",0,5,0,0,2022-12-01T19:06:34Z,8,0,0,,,
MLM881807595,2022-12-08T02:28:20Z,"Excelente producto, el precio justo para el atrapa sueños, se ve exactamente como en las imágenes, muy colorido y las luces funcionan bien.",0,5,0,0,2022-12-07T16:17:43Z,23,0,0,,,
MLM881807595,2022-11-22T00:26:08Z,Esta hermoso y se ve increíble con las luces.,0,5,0,0,2022-10-23T16:58:08Z,9,0,0,,,
MLM881807595,2022-09-01T20:52:10Z,Muy bonito y en muy buen estado me encantó.,0,5,0,0,2022-09-01T02:01:18Z,9,0,0,,,
MLM881807595,2022-08-17T16:49:39Z,"Esta muy bien, tal y como se muestra en la imagen.",0,5,0,0,2022-08-15T20:55:10Z,11,0,0,,,
MLM881807595,2022-08-04T13:29:45Z,Muy bonito de buena calidad me gusto.,0,5,0,0,2022-06-27T18:15:09Z,7,0,0,,,
MLM881807595,2022-07-10T18:06:55Z,Me encanto luce muy bonito en mi abitacion.,0,5,0,0,2022-06-21T22:29:10Z,8,0,0,,,
MLM881807595,2022-07-04T14:44:51Z,"Los compré para mis sobrinas y les encantó, los colores son tal cual y de un excelente tamaño.",0,5,0,0,2022-06-04T02:23:12Z,18,0,0,,,
MLM881807595,2022-06-24T13:37:21Z,Tamaño adecuado y las luces funcionan bien ;).,0,5,0,0,2022-05-25T16:40:46Z,7,0,0,,,
MLM881807595,2022-06-19T15:10:26Z,"Colorido, las lucesitas ya vienen pegadas en el atrapasueños y se ven bonitas de noche.",0,5,0,0,2022-06-02T21:42:29Z,15,0,0,,,
MLM881807595,2022-06-13T12:43:54Z,"Se ve hermoso, los colores son tal cual la imagen, lo único que me paso, fue que no servían las pilas que venían, me toco comprar inmediatamente para que funcionara correctamente.",0,5,0,0,2022-05-27T03:27:01Z,31,0,0,,,
MLM881807595,2022-05-23T00:29:18Z,"Simplemente hermoso, me encantó mi atrapasueños está genial.",0,5,0,0,2022-05-19T02:12:21Z,8,0,0,,,
MLM881807595,2022-05-11T21:36:01Z,"Esta divino!!! hermoso! me encantó y viene bien empacado, no se maltrató. Me gustó mucho.",0,5,0,0,2022-05-11T14:35:54Z,15,0,0,,,
MLM881807595,2022-05-11T20:52:33Z,Muy divinamente lindo. Esta hermoso. Buen obsequio.,0,5,0,0,2022-05-10T15:52:24Z,7,0,0,,,
MLM881807595,2022-05-02T23:09:33Z,En las fotos se ve muy distinto. Las medidas no son las mismas.,0,3,0,0,2022-04-15T11:00:52Z,13,0,0,,,
MLM881807595,2022-04-24T19:47:25Z,Exelente muy buenos y bonitos le gustaron mucho a mi esposa y la recarga da un toque lindo moderno.,0,5,0,0,2022-03-26T02:54:15Z,19,0,0,,,
MLM881807595,2022-04-17T22:03:55Z,"Muy lindo, me encantaron la calidad y los colores. Tal como en las fotos. Muchas gracias.",0,5,0,0,2022-04-02T03:32:46Z,16,20,0,,,
MLM881807595,2022-04-01T15:14:23Z,Muy bonitos los atrapasueños me encantaron los colores tal cual la foto.,0,5,0,0,2022-03-31T18:32:10Z,12,0,0,,,
MLM881807595,2022-03-05T19:28:38Z,"Se ve bien, si prendieron las luces.",0,4,0,0,2022-02-01T20:21:54Z,7,0,0,,,
MLM881807595,2022-03-02T22:44:17Z,"Es perfecto, es tal cual la foto y esta hermoso.",0,5,0,0,2022-02-03T05:37:12Z,10,0,0,,,
MLM881807595,2022-02-27T02:55:15Z,Calidad regular y muy lindo como adorno para una adolecente.,0,4,0,0,2022-02-16T07:18:12Z,10,0,0,,,
MLM881807595,2022-02-24T16:53:12Z,"Es muy bonito, lo compre para decoración del cuarto de mi hija, y quedo divino. Y con las luces que tiene, de noche se ve super.",0,5,0,0,2022-02-07T04:07:39Z,26,20,0,,,
MLM881807595,2021-12-26T22:30:06Z,Me encantó. Pensé que era más grande pero aún así es muy tierno.,0,5,0,0,2021-12-01T04:21:11Z,13,0,0,,,
MLM881807595,2021-12-13T20:04:24Z,"Es hermoso a mi hija le encanto, ademas ilumina bastante.",0,5,0,0,2021-11-28T00:36:30Z,10,0,0,,,
MLM881807595,2021-12-12T16:09:50Z,Hermoso sin duda lo volvería a comprar.,0,5,0,0,2021-12-11T17:58:05Z,7,0,0,,,
MLM881807595,2021-11-14T01:44:37Z,"Las luces no encendieron, compré el atrapasueños precisamente por su iluminación.",0,1,0,0,2021-10-03T22:01:19Z,11,20,0,,,
MLM881807595,2021-10-24T13:47:22Z,Ya tengo 1 mes y aún está funcionando ala perfección.,0,5,0,0,2021-09-20T15:52:12Z,10,0,0,,,
MLM881807595,2021-10-22T14:03:18Z,"Excelente producto, muy atractivo para decorar.",0,5,0,0,2021-10-07T00:34:17Z,6,0,0,,,
MLM881807595,2021-10-17T13:31:20Z,"Muy bonito, y funciona bien la luz.",0,5,0,0,2021-09-28T19:41:57Z,7,0,0,,,
MLM881807595,2021-09-03T17:14:03Z,Exelente producto lp recomiendo.,0,5,0,0,2021-08-16T08:11:18Z,4,0,0,,,
MLM1362392211,2023-06-09T03:18:43Z,Exelente.,2,5,2,0,2023-06-07T06:26:51Z,1,0,0,,,
MLM1362392211,2022-07-18T00:15:58Z,Es bueno pero la beteria se termina muy rapido no deberian ofrecerlo con luz led sale mas elevado el costo de las 2 pilas que necesita.,1,2,1,0,2022-07-01T17:03:03Z,26,0,0,,,
MLM1362392211,2023-07-02T02:44:42Z,Muy bonito. Me gustó bastante.,0,5,0,0,2023-06-22T05:01:28Z,5,0,2,,,
MLM1362392211,2023-12-07T21:02:04Z,Es hermoso realmente y el precio super.,0,5,0,0,2023-12-04T03:55:24Z,7,0,1,,,
MLM1362392211,2023-11-09T23:19:48Z,Creí que era muy pequeño pero no esta bien para mi auto.,0,5,0,0,2023-11-08T01:41:47Z,12,0,1,,,
MLM1362392211,2023-09-20T20:10:30Z,"Está genial ☺️, de buen material.",0,5,0,0,2023-03-18T21:19:26Z,5,0,1,,,
MLM1362392211,2024-01-13T14:11:57Z,Excedió mis expectativas.,0,5,0,0,2023-12-19T16:47:10Z,3,0,0,,,
MLM1362392211,2024-01-08T01:05:04Z,Super. Bonito.,0,5,0,0,2023-12-20T02:59:55Z,2,0,0,,,
MLM1362392211,2024-01-06T17:56:19Z,Super hermoso!.,0,5,0,0,2023-12-14T23:35:02Z,2,0,0,,,
MLM1362392211,2023-12-12T05:44:51Z,"Rei que estaría más grande,.
Es de pila.
Realmente muy lindo 😊.",0,3,0,0,2023-12-09T05:57:09Z,11,0,0,,,
MLM1362392211,2023-12-12T04:31:22Z,Muy bonito.,0,5,0,0,2023-12-05T22:19:39Z,2,0,0,,,
MLM1362392211,2023-12-05T22:50:10Z,"Las plumas son lindas y el largo muy bien, solo el tipo de encaje que trae no me gusto mucho se ve sencillo.",0,4,0,0,2023-12-04T21:04:47Z,23,0,0,,,
MLM1362392211,2023-08-19T00:10:53Z,Me encanta 😊.,0,5,0,0,2022-11-28T18:43:42Z,2,0,0,,,
MLM1362392211,2023-08-06T05:37:48Z,Me encanto el diseño. Igual a la foto.,0,4,0,0,2023-06-12T14:22:31Z,8,0,0,,,
MLM1362392211,2023-08-03T09:40:19Z,Super lindo y buen tamaño iluminación buena.,0,5,0,0,2023-04-30T21:19:40Z,7,0,0,,,
MLM1362392211,2023-07-24T17:33:30Z,Lo imagine más grande :( creo no cheque las medidas.,0,2,0,0,2023-06-14T20:08:03Z,9,0,0,,,
MLM1362392211,2023-07-03T16:33:01Z,Se descargo muy rapido pero de ahi esta bonito.,0,4,0,0,2023-05-20T16:50:10Z,9,0,0,,,
MLM1362392211,2023-06-10T12:13:11Z,"Super bonito y elegante, los materiales super bien 👌 y las luces hace que se vea más hermoso.",0,5,0,0,2023-05-20T23:31:18Z,17,0,0,,,
MLM1362392211,2023-06-10T03:24:00Z,"Me encantó muchísimo, lo quiero para regalo y ahora me lo quiero quedar 😁. Lo volveré a comprar 🌟🌟🌟🌟🌟.",0,5,0,0,2023-06-09T13:15:39Z,17,0,0,,,
MLM1362392211,2023-05-26T05:32:01Z,Esta hermoso bello belloooo.,0,5,0,0,2023-05-24T18:51:13Z,4,0,0,,,
MLM1362392211,2023-05-25T22:52:25Z,"Le encantó a mi hija, pensó que iba a ser más grande, pero no es tema ya que le pareció hermoso.",0,5,0,0,2023-05-23T19:03:20Z,21,0,0,,,
MLM1362392211,2023-05-17T00:52:52Z,Hermoso 🤩.,0,5,0,0,2023-05-10T03:49:26Z,1,0,0,,,
MLM1362392211,2023-05-10T03:55:04Z,"A mi niña le encanto pronto pediré otro, la luz que tiene es muy cálida.",0,5,0,0,2023-05-06T21:57:23Z,15,0,0,,,
MLM1362392211,2022-12-07T21:35:50Z,Esta muy bien hecho y muy bonito.,0,5,0,0,2022-11-09T00:22:00Z,7,0,0,,,
MLM1362392211,2022-12-03T22:41:25Z,Está hermoso.,0,5,0,0,2022-11-03T16:41:55Z,2,0,0,,,
MLM1362392211,2022-09-23T15:19:07Z,"Excelente producto, esta hermoso.",0,5,0,0,2022-09-05T22:59:24Z,4,0,0,,,
MLM1362392211,2022-08-04T15:02:07Z,De buena calidad esta precioso me encanto.,0,5,0,0,2022-06-27T18:15:09Z,7,0,0,,,
MLM1362392211,2022-06-27T09:50:16Z,"Fue comprada para un regalo y les encantó, gracias.",0,5,0,0,2022-05-24T19:38:35Z,9,0,0,,,
MLM1362392211,2022-05-23T00:26:21Z,Le daría más estrellas porque está hermoso estoy feliz por mi compra.,0,5,0,0,2022-05-19T02:12:21Z,12,20,0,,,
MLM1362392211,2022-05-04T22:05:20Z,Muy bonito y por el precio es recomendable.,0,5,0,0,2022-05-03T02:33:57Z,8,0,0,,,
MLM1713526957,2023-08-08T03:14:12Z,Muy bonito si lo recomiendo.,0,5,0,0,2023-07-06T02:24:13Z,5,0,0,,,
MLM1713526957,2023-05-17T04:09:28Z,Excelente producto ! se ve súper lindo. Superó todas mis expectativas.,0,5,0,0,2023-05-15T18:27:06Z,10,0,0,,,
MLM1663556502,2023-06-18T20:27:21Z,Lindo que es!.,1,5,1,0,2023-05-22T16:51:18Z,3,0,0,,,
MLM1663556502,2023-05-13T04:19:26Z,"Me encantaron! uno lo use para el coche de mi hijo y mi l otro para su recámara, es grande y luce muy bonito.",1,5,1,0,2023-05-10T06:10:00Z,24,0,0,,,
MLM910347877,2023-12-30T15:31:34Z,Bellísimas. Volveré a comprar.,0,5,0,0,2023-03-28T21:10:43Z,4,0,0,,,
MLM910347877,2022-08-26T17:05:25Z,Excelente de muy buena calidad y de buen tamaño.,0,5,0,0,2022-08-25T14:45:47Z,9,0,0,,,
MLM910347877,2022-06-05T20:07:46Z,"Es lo que buscaba, excelente producto!.",0,5,0,0,2022-05-20T02:21:10Z,6,0,0,,,
MLM910347877,2022-03-05T22:35:12Z,"Es un producto muy bueno, sólo necesita una pulida.",0,5,0,0,2022-02-14T19:22:51Z,9,0,0,,,
MLM910347877,2021-10-28T15:34:10Z,Excelente la calidad y el tamaño.,0,5,0,0,2021-10-11T16:19:00Z,6,0,0,,,
MLM830596930,2023-05-29T19:32:04Z,Buen producto.,0,4,0,0,2023-05-23T00:47:06Z,2,0,0,,,
MLM1760459087,2023-06-13T20:38:09Z,Está bueno. Buena compra.,0,4,0,0,2023-06-05T20:43:41Z,4,20,0,,,
MLM1886709628,2023-06-05T02:38:31Z,Muy lindo. Los colores muy bonitos.,1,5,1,0,2023-06-03T15:24:10Z,6,0,0,,,
MLM1937245081,2023-10-20T03:00:31Z,Muy bonitas me encantaron.,0,5,0,0,2023-10-14T02:05:03Z,4,0,0,,,
MLM1553353482,2023-06-22T17:20:48Z,"Muy bonito, le encanto a mi hija.",0,5,0,0,2023-05-21T19:50:36Z,7,0,0,,,
MLM1553353482,2023-06-19T04:53:24Z,Me parece muy simple.,0,3,0,0,2023-05-17T17:51:14Z,4,0,0,,,
MLM1553353482,2023-06-07T01:00:28Z,Muy bueno y bien terminado felicidades por este producto!!!.,0,5,0,0,2023-05-28T18:07:14Z,9,0,0,,,
MLM1553353482,2023-05-11T17:49:43Z,"Es muy bonito, en mi caso no utilice la tira de luces led ni la probé, me gustó para decorar.",0,5,0,0,2023-04-25T22:29:37Z,20,0,0,,,
MLM1553353482,2023-03-08T00:58:38Z,"Está precioso! tamaño perfecto, muy bien hecho, excelente calidad. Volvería a comprar sin dudar. Muy buena compra.",0,5,0,0,2023-03-01T00:16:46Z,17,20,0,,,
MLM830597043,2021-04-10T21:57:08Z,"Buena calidad, buen producto, lo recomiendo.",0,5,0,0,2021-03-06T20:00:00Z,6,0,0,,,
MLM830597043,2020-12-21T19:00:03Z,Me encanto! justo lo que necesitaba.,0,5,0,0,2020-11-30T20:00:00Z,6,0,0,,,
MLM1481390950,2023-05-10T14:16:27Z,"Súper bonito, muy suave y del tamaño adecuado!🥰.",1,5,1,0,2023-05-03T23:33:28Z,8,0,2,,,
MLM1481390950,2024-01-11T05:38:37Z,"Está súper bonito y aparte trae luz, me encantó.",0,5,0,0,2024-01-09T19:04:50Z,9,0,1,,,
MLM1481390950,2023-12-25T21:03:21Z,Muy lindo solo un poco más pequeño de lo que imaginaba.,0,4,0,0,2023-12-07T17:22:31Z,11,0,0,,,
MLM1481390950,2023-07-30T19:14:26Z,Lindo.,0,4,0,0,2023-07-23T19:38:36Z,1,0,0,,,
MLM1481390950,2023-06-18T03:52:48Z,Fué un pequeño regalo para mi hija y le gustó mucho. Lo recomiendo.,0,5,0,0,2023-06-02T12:45:20Z,13,0,0,,,
MLM1481390950,2023-06-16T00:07:50Z,En 2 dias las luces ya no prendian.,0,1,0,0,2023-06-10T04:17:31Z,8,0,0,,,
MLM2314436750,2023-12-11T00:57:24Z,Muy bonito.,0,5,0,0,2023-12-03T17:45:21Z,2,0,0,,,
MLM1838831212,2023-07-29T20:54:00Z,Un poco pequeño pero muy bonito.,0,4,0,0,2023-07-07T00:17:05Z,6,0,0,,,
MLM2016022488,2023-12-25T18:49:21Z,,0,5,0,0,2023-12-19T05:48:43Z,0,0,1,,,
MLM1480747346,2023-02-11T20:33:23Z,Muy bonito y a buen precio.,1,5,1,0,2023-01-26T00:08:22Z,6,0,0,,,
MLM1480747346,2023-12-24T19:25:40Z,Buen producto.,0,4,0,0,2023-04-23T02:20:20Z,2,0,0,,,
MLM1480747346,2023-12-17T06:20:05Z,"Es más pequeño de lo que parece, es bonito, pero si buscas algo llamativo, este no es el lugar correcto.",0,2,0,0,2023-03-01T20:44:47Z,20,0,0,,,
MLM1480747346,2023-09-09T00:08:58Z,"Bonito, fue un regalo gusto mucho.",0,5,0,0,2023-09-04T17:12:07Z,6,0,0,,,
MLM1480747346,2023-08-17T14:09:28Z,Esta precioso yo lo compre para un regalo y la persona el encanto viene de muy buen tamaño 100% recomendado.,0,5,0,0,2023-07-17T18:24:03Z,20,0,0,,,
MLM1480747346,2023-06-22T00:23:52Z,Muy lindo.,0,5,0,0,2022-11-17T00:09:00Z,2,0,0,,,
MLM1480747346,2023-06-16T20:23:36Z,"Me encanta, es pequeño pero luce e ilumina bastante bien.",0,5,0,0,2022-12-03T18:20:54Z,10,0,0,,,
MLM1480747346,2023-05-13T22:27:50Z,Buen producto.,0,5,0,0,2023-02-15T19:48:36Z,2,0,0,,,
MLM1480747346,2023-04-21T21:38:22Z,Súper lindo me encanto.,0,5,0,0,2023-04-14T01:58:15Z,4,0,0,,,
MLM1480747346,2023-03-18T18:11:40Z,Muy bonito.,0,5,0,0,2023-03-12T21:53:59Z,2,0,0,,,
MLM1480747346,2023-02-16T21:53:57Z,Mi producto me pareció muy bueno. Me sirvió mucho.,0,5,0,0,2023-02-11T01:17:39Z,9,0,0,,,
MLM1480747346,2023-02-08T22:50:58Z,Excelente le gustó mucho a la persona que se lo regalé.,0,5,0,0,2023-01-30T21:11:55Z,11,0,0,,,
MLM1480747346,2023-01-26T20:48:23Z,Excelente muy padre y de muy buena calidad.,0,5,0,0,2023-01-07T04:44:23Z,8,0,0,,,
MLM1325347967,2024-01-12T06:34:39Z,"Simplemente bello, me encantó y mi hija que para ella fué. Más!! terminé comprando otro más. Dá una buena luz tenue que te permite dormir sin ser molesta y luce muuuy bonito!.",0,5,0,0,2023-12-30T07:46:22Z,32,0,0,,,
MLM1325347967,2023-12-14T05:14:02Z,Muy bonito.,0,5,0,0,2023-05-02T05:54:40Z,2,0,0,,,
MLM1325347967,2023-11-07T02:48:58Z,Me encantaron los atrapasueños están muy bonitos y de excelente calidad se ven divinos puestos y encendidos los recomiendo ampliamente.,0,5,0,0,2023-11-03T00:17:02Z,20,0,0,,,
MLM1325347967,2023-10-19T17:37:59Z,"Me gustó mucho es exactamente como se mira en las fotos, lo compre para regalárselo a una persona y le gustó mucho, y que llevara ya incluida la pila fue genial si recomiendo esta compra.",0,5,0,0,2023-10-12T19:01:19Z,35,20,0,,,
MLM1325347967,2023-09-26T11:39:54Z,Las luces led no encienden.,0,1,0,0,2023-09-23T23:29:51Z,5,0,0,,,
MLM1325347967,2023-09-11T03:43:57Z,Me encantó. Gracias.,0,5,0,0,2023-09-08T01:28:26Z,3,0,0,,,
MLM1325347967,2023-07-17T05:58:09Z,Excelente de muy buen tamaño 👌.,0,5,0,0,2023-06-08T02:39:58Z,5,0,0,,,
MLM1325347967,2023-07-14T00:50:43Z,Me gustó.,0,5,0,0,2023-06-21T13:34:16Z,2,0,0,,,
MLM1325347967,2023-07-06T22:06:28Z,Es muy hermoso.,0,5,0,0,2023-07-03T00:37:19Z,3,0,0,,,
MLM1325347967,2023-05-19T18:22:10Z,Las luces no prenden.,0,1,0,0,2023-05-03T04:40:01Z,4,0,0,,,
MLM1325347967,2023-05-12T16:20:48Z,Está hermoso 🥰.,0,5,0,0,2023-05-10T02:44:02Z,2,0,0,,,
MLM1325347967,2023-05-09T02:29:44Z,Muy bonito e igual a la foto !!!.,0,5,0,0,2023-05-01T04:08:23Z,7,0,0,,,
MLM1325347967,2022-12-21T02:13:46Z,Bueno bonito y barato.,0,5,0,0,2022-12-14T21:29:17Z,4,0,0,,,
MLM1325347967,2022-11-04T17:52:43Z,"Excelente producto, esta precioso.",0,5,0,0,2022-11-03T16:24:40Z,4,0,0,,,
MLM1325347967,2022-10-14T04:24:07Z,Muy bonito. Lo que esperaba es muy hermoso.,0,5,0,0,2022-10-12T19:26:33Z,8,0,0,,,
MLM1325347967,2022-07-07T07:26:57Z,Muy bonito tamaño y calidad recomendable.,0,5,0,0,2022-06-07T23:51:17Z,6,0,0,,,
MLM1325347967,2022-07-01T21:23:12Z,"Estupendo la compra, si lo recomiendo.",0,5,0,0,2022-06-30T06:01:56Z,6,20,0,,,
MLM1325347967,2022-05-23T05:07:26Z,"Muy lindos, compré dos y les encantaron a mis hijas!.
Lo único malo es que se les acabó la pila al segundo día =(.",0,5,0,0,2022-05-04T12:48:07Z,23,0,0,,,
MLM1325347967,2022-05-22T21:17:42Z,"Son muy bonitos tamaño, y color tal cual en la descripción.",0,4,0,0,2022-05-10T02:03:38Z,11,0,0,,,
MLM1325347967,2022-05-11T13:36:42Z,"Está muy lindo, ilumina muy bien, excelente compra.",0,5,0,0,2022-05-10T13:57:38Z,8,20,0,,,
MLM1325347967,2022-04-13T22:02:19Z,"Muy buen producto, todo de muy buena calidad!!!.",0,5,0,0,2022-04-13T02:58:32Z,8,0,0,,,
MLM1325347967,2022-04-06T00:18:28Z,"Excelente producto, muy oadre el diseño y el color. Me agrado mucho.",0,5,0,0,2022-04-04T04:56:46Z,12,0,0,,,
MLM1325347967,2022-03-28T22:57:43Z,Excelente y muy hermoso el atrapasueños.,0,5,0,0,2022-03-25T17:34:03Z,6,0,0,,,
MLM611841166,2021-08-21T02:04:08Z,"Muy bonita, tela gruesa y estampado hermoso.",0,5,0,0,2021-07-13T20:00:00Z,7,0,0,,,
MLM611841166,2018-11-02T11:49:31Z,Me gusto. Mucho mil gracias estaré en contacto cntg.,0,5,0,0,0001-01-01T00:00:00Z,9,30,0,,,
MLM1431809234,2023-07-13T22:53:07Z,Muy bonitos.,0,5,0,0,2023-07-12T01:36:12Z,2,0,1,,,
MLM1431809234,2023-12-22T01:03:19Z,Hermosos!! hermosos!!.,0,5,0,0,2022-08-27T01:06:23Z,2,0,0,,,
MLM1431809234,2023-07-30T02:55:18Z,Un detalle muy lindo! se ve muy elegante y bonito.,0,5,0,0,2023-03-05T20:22:29Z,10,0,0,,,
MLM1431809234,2023-03-31T04:10:24Z,Hermosos quiero mas.,0,5,0,0,2023-03-08T21:30:03Z,3,0,0,,,
MLM1431809234,2023-02-20T17:10:17Z,Excelente.,0,5,0,0,2023-01-20T05:31:53Z,1,0,0,,,
MLM1431809234,2022-11-19T16:59:50Z,"Un producto genial , me gusto mucho , estético y bonito.",0,5,0,0,2022-11-04T13:50:46Z,9,0,0,,,
MLM1431809234,2022-10-06T18:16:40Z,"Está súper bonito, me encantó, el material es de excelente calidad y se ve increíble.",0,5,0,0,2022-09-21T23:54:49Z,15,0,0,,,
MLM1431809234,2022-07-19T14:59:04Z,"Están bonitos, tal cual la imagen más económicos que comprar por separado. El tamaño es el que indica la publicación, me gustaría que fueran más grandes pero por el precio está bien. Las luces vienen con pilas chiquitas y esconder la caja detrás del atrapasueños es fácil.",0,5,0,0,2022-07-18T14:58:10Z,47,0,0,,,
MLM744337387,2023-05-10T19:27:52Z,Muy bonita funciona muy bien.,0,5,0,0,2023-04-17T06:20:56Z,5,0,0,,,
MLM744337387,2021-01-24T21:10:05Z,"Hermoso, de buen tamaño. Aunque la pila se acabó rápido.",0,5,0,0,2020-12-18T20:00:00Z,10,0,0,,,
MLM744337387,2021-01-17T11:35:23Z,"Justo lo que esperaba,muy buen producto.",0,5,0,0,2020-12-22T20:00:00Z,7,0,0,,,
MLM2408390934,2023-10-24T22:37:17Z,Muy bonito.,0,5,0,0,2023-10-13T22:07:09Z,2,0,0,,,
MLM952526065,2023-08-15T12:50:35Z,Muy bonito me encsnto.,0,5,0,0,2022-04-07T01:52:20Z,4,0,0,,,
MLM613992133,2020-02-25T12:11:26Z,"Muy bien, cumplió las espectativas.",0,5,0,0,2020-02-09T20:00:00Z,5,0,0,,,
