id,Calificación,Fecha,Reseña,Cantidad de imagenes,Utilidad
CCCA2X1MAHJ2P,5,08 ago. 2023,,1,0
CCCA2X1MAHJ2P,5,08 jul. 2023,,1,0
CCCA2X1MAHJ2P,5,11 sep. 2023,"Para lo que se describe, están bien.",0,0
CCCA2X1MAHJ2P,5,06 sep. 2023,"Son buenas cortinas por su precio, no cubren completamente la luz pero si cumple su funcion.",0,0
CCCA2X1MAHJ2P,5,11 ago. 2023,Súper recomendable el producto muy bien material.,0,0
CCCA2X1MAHJ2P,5,07 ago. 2023,Super bonitas. Me encantaron. Realmente no dejan pasar nada de luz.,0,0
CCCA2X1MAHJ2P,5,03 ago. 2023,Muy bien el producto y muy buena calidad por el precio. También buenas terminaciones.,0,0
CCCA2X1MAHJ2P,5,01 ago. 2023,"Me gustó mucho el hecho de que no permitan la entrada de la luz así como la salida de la misma, así lo vecinos chismosos no ven el rectángulo de la pantalla desde la calle cuando la estoy viendo jajaja.",0,0
CCCA2X1MAHJ2P,5,01 ago. 2023,"Cumplen su función, no transparentan, no son de la mejor calidad pero se entiende por el precio, las recomiendo.",0,0
CCCA2X1MAHJ2P,5,13 jul. 2023,"De muy buena calidad, no se ve nada de afuera hacia adentro pero viceversa si, está genial!. Medida exacta, le quedó perfecto a mi cocina.",0,0
CCCA2X1MAHJ2P,5,10 jul. 2023,Buenas cortinas aunque un poco delgadas.,0,0
CCCA2X1MAHJ2P,5,14 jun. 2023,Buena calidad de la tela. Suficientemente gruesa para que no entre el sol.,0,0
CCCA2X1MAHJ2P,5,02 jun. 2023,"Muy bonitas buen color no lo perdieron al lavarse, delgadas pero calidad precio 10/10.",0,0
CCCA2X1MAHJ2P,5,16 may. 2023,"Ideal para mantener iluminada la habitación sin necesidad de ser translúcida, dando oportunidad de tener privacidad.",0,0
CCCA2X1MAHJ2P,5,05 may. 2023,"Super buen producto, para el precio la calidad es buena.",0,0
CCCA2X1MAHJ2P,5,23 mar. 2023,Exactamente lo que buscaba en medida.,0,0
CCCA2X1MAHJ2P,5,16 mar. 2023,"Excelente producto, satisfacción garantizada.",0,0
CCCA2X1MAHJ2P,5,06 feb. 2023,"No son tan gruesas, pero si son lo suficientemente resistentes y cubridoras para dejar pasar la luz y a la vez no dejar ver desde el exterior hacia la casa.",0,0
CCCA2X1MAHJ2P,5,03 feb. 2023,Excelente calidad están muy padres si las compro de nuevo.,0,0
CCCA2X1MAHJ2P,5,21 ene. 2023,"Están muy bonitas, son la perfecta combinación entre dejar pasar la luz y el color obscuro.",0,0
CCCA2X1MAHJ2P,5,19 ene. 2023,"Quedaron a la medida de mi puerta. Buena calidad, no transparenta.",0,0
CCCA2X1MAHJ2P,5,19 ene. 2023,"Es un producto de muy buena calidad, y sin problema cumple lo que ofrece.",0,0
CCCA2X1MAHJ2P,5,19 ene. 2023,"Bien material, cuando se ponen se mira transparente, pero realmente si tapa la luz y da buena vista.",0,0
CCCA2X1MAHJ2P,5,24 jun. 2023,"Miy buenas cortinas, a muy buen precio.",0,0
CCCA2X1MAHJ2P,5,19 jun. 2023,"Excelente , muy bonitas.",0,0
CCCA2X1MAHJ2P,5,16 jun. 2023,Muy bonitas excelentes 👌.,0,0
CCCA2X1MAHJ2P,5,03 jun. 2023,Se ven lindas y de buena calidad con referencia al precio.,0,0
CCCA2X1MAHJ2P,5,12 abr. 2023,Quedó exacto.,0,0
CCCA2X1MAHJ2P,5,07 abr. 2023,Son tal cual la imagen.,0,0
CCCA2X1MAHJ2P,5,01 abr. 2023,Me encantaron muy bonitos!!.,0,0
CCCA2X1MAHJ2P,5,23 feb. 2023,Exelente buenas y bonitas me encantarin.,0,0
CCCA2X1MAHJ2P,5,10 feb. 2023,Exelente.,0,0
CCCA2X1MAHJ2P,5,09 feb. 2023,Excelente producto.,0,0
CCCA2X1MAHJ2P,5,02 feb. 2023,De muy buena calidad.,0,0
CCCA2X1MAHJ2P,5,27 ene. 2023,Excelente calidad.,0,0
CCCA2X1MAHJ2P,5,19 ene. 2023,Las recomiendo están largas quedaron ala medida buena calidad estoy satisfecha con mi compra.,0,0
CCCA2X1MAHJ2P,5,13 ene. 2023,"Muy bien, está bonita la tela y a buen precio.",0,0
CCCA2X1MAHJ2P,5,02 ene. 2023,Buena calidad y medida exacta.,0,0
CCCA2X1MAHJ2P,5,30 dic. 2022,Excelente producto!!!!.,0,0
CCCA2X1MAHJ2P,5,29 dic. 2022,Las cortinas quedaron perfectas están del grueso adecuado para permitir dejar pasar un poco la luz. Precio calidad bien.,0,0
CCCA2X1MAHJ2P,5,17 dic. 2022,Bien.,0,0
CCCA2X1MAHJ2P,5,16 dic. 2022,Justo lo que necesitaba.,0,0
CCCA2X1MAHJ2P,5,08 dic. 2022,Excelente compra si valió la pena ya que no esta delgada la tela se ve de calidad y lujo.,0,0
CCCA2X1MAHJ2P,5,08 dic. 2022,"La cortina es igual que la de la foto, si cumple la función de black out y es bella!!.",0,0
CCCA2X1MAHJ2P,5,07 dic. 2022,"Buen producto del largo indicado, en mi caso quedaron justo a la altura, tal vez necesitaba unas un poco más largas.",0,0
CCCA2X1MAHJ2P,5,04 dic. 2022,Excelentes.,0,0
CCCA2X1MAHJ2P,5,14 nov. 2022,Estan bellas ❤️.,0,0
CCCA2X1MAHJ2P,5,18 nov. 2022,"Excelente producto,.",0,0
CCCA2X1MAHJ2P,5,21 sep. 2022,Pedi las grises no es oxford es como gris azulado al final me gusto las volvere a comprar en negras.,0,0
CCCA2X1MAHJ2P,5,04 nov. 2022,Bonitas casi no se trasparenta nada el color exactamente el de la imagen buena calidad.,0,0
CCCA2X1MAHJ2P,4,17 ene. 2023,"Están muy lindas, pero no son gruesas, con luz dentro de casa se transparenta.",0,4
CCCA2X1MAHJ2P,4,10 dic. 2022,Son buenas ! solo un poco delgadas.,0,2
CCCA2X1MAHJ2P,4,12 dic. 2022,"Crei que eran mas oscuras, dejan pasar mucha luz, pero tienen buena hechura.",0,2
CCCA2X1MAHJ2P,4,30 ago. 2023,"Están bien para una habitación en la que no se necesite obstruir toda la luz, son un poco delgadas, pero resistentes.",0,0
CCCA2X1MAHJ2P,4,28 ago. 2023,"Es bueno, esperaba que fueran más oscuras ya que se transparenta un poco. No me molesta solo es un comentario.",0,0
CCCA2X1MAHJ2P,4,09 ago. 2023,"El azul es mas obscuro, pero por el precio vale la pena.",0,0
CCCA2X1MAHJ2P,4,19 jul. 2023,La tela es delgada y traspasa la luz.,0,0
CCCA2X1MAHJ2P,4,05 feb. 2023,Está bien pero se transparente un poco y quedó más chico de lo que pensaba no sé si venian mal las medidas pero dentro de lo que cabe está bien.,0,0
CCCA2X1MAHJ2P,4,03 feb. 2023,Buen producto.,0,0
CCCA2X1MAHJ2P,4,10 ene. 2023,"La vdd si está padre la cortina, pero se atrás aparenta un buen no mucho pero si, pero de ahí todo bien.",0,0
CCCA2X1MAHJ2P,4,08 ene. 2023,Muy buena tela color igual al de la imagen.,0,0
CCCA2X1MAHJ2P,4,27 jun. 2023,"Bueno, aunque un poco caro.",0,0
CCCA2X1MAHJ2P,4,27 jun. 2023,They look nice but tthey are thin.,0,0
CCCA2X1MAHJ2P,4,09 jun. 2023,"Buena, pero la tela algo degalda para mí gusto.",0,0
CCCA2X1MAHJ2P,4,03 jun. 2023,"Son muy sencillas, pero cubren la función.",0,0
CCCA2X1MAHJ2P,4,01 may. 2023,"Me gustaron y el color quedó perfecto, son delgadas pero bien hechas.",0,0
CCCA2X1MAHJ2P,4,01 abr. 2023,Very nice curtains.,0,0
CCCA2X1MAHJ2P,4,16 mar. 2023,Son muy bomitas y la medida es excelente.,0,0
CCCA2X1MAHJ2P,4,22 ene. 2023,Esta muy bonito la cortina 😊 me encantó.,0,0
CCCA2X1MAHJ2P,4,14 ene. 2023,Las cortinas son buenas pero algo delgadas pero dejan entrar luz y se ven bien para un lugar que se requiere iluminado como la cocina.,0,0
CCCA2X1MAHJ2P,4,16 dic. 2022,"Es lo que esperaba gracias, muy bonitas.",0,0
CCCA2X1MAHJ2P,3,20 ene. 2023,Me hubieran gustado menos traslúcidas.,0,4
CCCA2X1MAHJ2P,3,02 ene. 2023,"Son de buen tamaño, se ven elegantes, lo único que le veo yo es que no son tan gruesas como pensé pero fuera de eso están genial.",0,2
CCCA2X1MAHJ2P,3,10 feb. 2023,Son muy delgadas muyy.,0,1
CCCA2X1MAHJ2P,3,18 sep. 2023,"Es bastante delgada la tela, llega a traspasar la luz con mucha facilidad.",0,0
CCCA2X1MAHJ2P,3,07 sep. 2023,"Están lindas, pero se me hicieron en extremo delgadas, muy transparentes.",0,0
CCCA2X1MAHJ2P,3,28 ago. 2023,Muy delagas y traslúcidas.,0,0
CCCA2X1MAHJ2P,3,24 jul. 2023,Son muy delgadas va a entrar luz y si se ve hacia adentro si las quieren para habitación tendrían que ponerle otro fondo para la privacidad pero cumplen su función.,0,0
CCCA2X1MAHJ2P,3,11 jul. 2023,Muy transparente.,0,0
CCCA2X1MAHJ2P,3,01 jul. 2023,Tela de muy baja calidad y se trasluce aunque sean oscuras.,0,0
CCCA2X1MAHJ2P,3,07 feb. 2023,Se transparente mucho y quedo más corto del largo que decía.,0,0
CCCA2X1MAHJ2P,3,26 jun. 2023,No cumplió mi expectativa.,0,0
CCCA2X1MAHJ2P,3,18 jun. 2023,"El producto la verdad esta muy bien. Pero en cuestión con las medidas de ancho no es lo que comenta. Supuestamente es para cubrir una ventana de 2. 00mts pero cubrio como 1. 70mts, asi que recomiendo comprar un poquito mas ancha.",0,0
CCCA2X1MAHJ2P,3,08 jun. 2023,Entra mucho la luz.,0,0
CCCA2X1MAHJ2P,3,30 ene. 2023,"Un poco malo, ya que es súper transparente. Tuve que poner doble y aún así se ve transparente. La tele es muy delgada, todo lo demás está bien, pero para mí sí es importante la tela y es en lo que falla. No puedo agregar fotos para que se notará el nivel de transparencia.",0,0
CCCA2X1MAHJ2P,3,24 ene. 2023,Es un producto muy sencillo bien terminado pero muy sencillo y pues no es un ofertón.,0,0
CCCA2X1MAHJ2P,3,12 ene. 2023,"El producto en términos generales está ok sin embargo si se transparenta el exterior, a mi gusto es delgada la cortina.",0,0
CCCA2X1MAHJ2P,2,17 mar. 2023,Muy delgadas.,1,3
CCCA2X1MAHJ2P,2,17 feb. 2023,"No es como se ve en la imagen, es muy transparente.",0,1
CCCA2X1MAHJ2P,2,08 sep. 2023,Pasa muchísimo la luz.,0,0
CCCA2X1MAHJ2P,2,19 ago. 2023,"Son muy transparentes. En realidad, la tela es tan delgada que permite todo el paso de la luz.",0,0
CCCA2X1MAHJ2P,2,07 ene. 2023,"Demasiado sencillas, muy muy muy delgadas. No compraría otra vez.",0,0
CCCA2X1MAHJ2P,2,22 jun. 2023,Muy trasparente.,0,0
CCCA2X1MAHJ2P,2,06 jun. 2023,La verdad son muy transparentes :(.,0,0
CCCA2X1MAHJ2P,2,08 mar. 2023,"Son diferentes a cómo pensé, están transparentes y además muy cortas. Me dejé llevar por el título que dice 2mx1. 35 y creí que cada panel sería así, no pensé que los 2m serían juntando las dos cortinas 🙄.",0,0
CCCA2X1MAHJ2P,2,10 ene. 2023,"Muy delgadas, deja pasar la luz y el frío, anteriormente había comprado unas que cumplían bien, pero estás no.",0,0
CCCA2X1MAHJ2P,2,31 dic. 2022,"Horrible calidad, se transparentan demasiado, vayan por otras opciones tal vez ven el precio barato pero junten un poco más y cómprense algo de mejor calidad, son muy malas,.",0,0
CCCA2X1MAHJ2P,1,01 dic. 2022,"No la recomiendo la tela esta súper transparente nada que ver con lo que ofrecen, todo se hacía la aviación no lo comprenden.",0,19
CCCA2X1MAHJ2P,1,20 dic. 2022,"Estéticamente bonitas, pero ultra delgadas, se transparenta absolutamente todo.",0,2
CCCA2X1MAHJ2P,1,16 feb. 2023,Una de las cortinas tenía un corte como de unas tijeras.,1,1
CCCA2X1MAHJ2P,1,07 sep. 2023,Horribles.,0,0
CCCA2X1MAHJ2P,1,15 ago. 2023,La tela es demasiado transparente. Pedí negras para que no entrara la luz al cuarto y se trasparenta toda. Muy muy delgadas. La tela muy delgada.,0,0
CCCA2X1MAHJ2P,1,02 ago. 2023,"Som muy sencillas y delgadas y creo que por ese precio puedo encontrar algo muchísimos mejor y que se adapte a tus medidas, claro necesitas tiempo para mandarlo a hacer.",0,0
CCCA2X1MAHJ2P,1,19 jul. 2023,Supertransparente.,0,0
CCCA2X1MAHJ2P,1,27 may. 2023,Tela super delgada y trasparente.,0,0
CCCA2X1MAHJ2P,1,25 mar. 2023,"Leer muy bien las medidas, el que dan es la suma de las 2pz. A mi me generó confusión; no cubrieron el espacio en mi ventana, pero es mi error por suponer que la medida es por cada pz.",0,0
CCCA2X1MAHJ2P,1,22 ene. 2023,"Para nada es black yo pedi las negras y son super transparentes y ademas de que se ve todo de afuera para adentro, entra muchisma luz.",0,0
CCCA2X1MAHJ2P,1,21 ene. 2023,"No era lo qe esperaba ,se transparenta la luz.",0,0
CCCA2X1MAHJ2P,1,20 jun. 2023,"No me gusto nada la tela muy fea, claro eso es a lo que nos arriesgamos en pedir algo sin verlo.",0,0
PS6PDFA,5,01 may. 2023,"Me encantaron, los puse al sol y se esponjaron muy bonito, así lucen más hermosas, los colores están muy lindos. Muy feliz con la compra 🛍️.",2,2
PS6PDFA,5,12 may. 2023,Me parecieron muy bonitas solo que hay que tener mucho cuidado con ellas porque se despeluchan si se maltratan. Se ven elegantes en un ambiente rústico.,0,1
PS6PDFA,5,09 ago. 2023,"En lo personal me encantaron, ahí en foto está la mitad de la caja, vienen bien resguardadas, sin duda las recomiendo y las volveré a comprar.",1,0
PS6PDFA,5,09 jul. 2023,"Me encantaron, en las fotos se ven más frondosas, pero son menos, si las acomodas en un jarrón pequeño le da mucha vista, por el costo vale la pena, a mí me encantaron, las use para una decoración y hacen la diferencia. Si las recomiendo.",1,0
PS6PDFA,5,23 sep. 2023,Se ven muy bonitas y vienen muy bien empacadas!.,0,0
PS6PDFA,5,26 ago. 2023,Me encantaron.,0,0
PS6PDFA,5,09 ago. 2023,Me encantaron estan super esponjisitas despues de ponerla al sol y quedaron perfecta en mi jarron.,0,0
PS6PDFA,5,01 ago. 2023,Tal cual la foto solo q son pequeñas y no tan frondosas pero para lo que las necesitaba estuvieron bien.,0,0
PS6PDFA,5,27 jul. 2023,Super hermosas 🥰 de gran calidad y precio 👍❣️.,0,0
PS6PDFA,5,20 jul. 2023,Bonito para adornar cualquier lugar.,0,0
PS6PDFA,5,13 jul. 2023,Me encantaron!! lucen muy bien.,0,0
PS6PDFA,5,13 jul. 2023,Muy lindo.,0,0
PS6PDFA,5,04 jul. 2023,"Tomen en cuenta el tamaño antes de comprar y ponerlas en el sol para que se esponjen, me gustaron mucho.",0,0
PS6PDFA,5,04 jul. 2023,"Honestamente resultó mejor de lo que yo esperaba, se sienten super suaves y no se ven chafas. El largo a mi no me pareció malo, yo creo que depende mucho la boquilla del florero.",0,0
PS6PDFA,5,03 jul. 2023,Muy bonitas.,0,0
PS6PDFA,5,23 jun. 2023,"Están hermosas, un poco pequeñas pero hermosas.",0,0
PS6PDFA,5,20 jun. 2023,"Muy bonitas, me encantaron, me sirvió para dos floreros medianos.",0,0
PS6PDFA,5,19 jun. 2023,Excelente.,0,0
PS6PDFA,5,31 may. 2023,Me encantó.,0,0
PS6PDFA,5,12 abr. 2023,"Excelente producto, tal cual la imagen.",0,0
PS6PDFA,5,17 mar. 2023,"Muy bonitas las pampas, buena calidad y rinden mucho.",0,0
PS6PDFA,5,14 mar. 2023,Es un producto excelente en colores.,0,0
PS6PDFA,5,27 feb. 2023,"Muy bonitas y tupidas, dan un toque de calidez a mi sala.",0,0
PS6PDFA,5,13 feb. 2023,Muy hermosas.,0,0
PS6PDFA,5,23 ene. 2023,"Súper lindo, me encantó.",0,0
PS6PDFA,5,22 ene. 2023,Bonito❤️.,0,0
PS6PDFA,5,08 ene. 2023,Es lo que estaba esperando. Muy buen producto.,0,0
PS6PDFA,5,17 dic. 2022,Me pareció excelente y creo que me voy hacer cliente frecuente ampliamente recomendaso.,0,0
PS6PDFA,5,17 dic. 2022,Muy bonitas.,0,0
PS6PDFA,5,15 dic. 2022,Exelente muy recomendables era lo buscava.,0,0
PS6PDFA,5,14 dic. 2022,Son muy bonitas pensé que serían mas frondosas son frágiles pero son muy bonitas.,0,0
PS6PDFA,5,08 dic. 2022,Perfectas.,0,0
PS6PDFA,5,02 dic. 2022,Muy padres están las recomiendo.,0,0
PS6PDFA,5,17 nov. 2022,Muy lindo y bueno gracias.,0,0
PS6PDFA,5,24 sep. 2022,Excelente producto la calidad y textura las hacen ver hermosas.,0,0
PS6PDFA,4,13 sep. 2022,"Muy bonitas, solo deben poner el la descripción del producto su medida 40cm de largo c/u aproximadamente.",0,4
PS6PDFA,4,17 sep. 2023,Se ven bien. Lo puse en ese jarrito que tenía.,3,0
PS6PDFA,4,22 jun. 2023,"Me gustaron , el único inconveniente es que son muy cortas del tallo.",0,0
PS6PDFA,4,30 mar. 2023,"Son bonitas solo que muy cortas, ojalá tuviera la rama más larga para poderla ajustar al florero.",0,0
PS6PDFA,4,09 feb. 2023,Hermosas.,0,0
PS6PDFA,4,09 ene. 2023,"Pense que estarían más grandes, el tallo no es tan largo.",0,0
PS6PDFA,4,13 dic. 2022,Me gustó pero pensé que eran más grandes.,0,0
PS6PDFA,3,05 mar. 2023,Están muy bonitos. Pero les falta más variedad de tamaño para cuando esponjen se vea mejor.,0,0
PS6PDFA,3,30 ene. 2023,A mi me gustaron mucho lo unico es que no te mandan las 60 pcs/ aun asi me gustaron. Yo pedi 2 paquetes para que se viera mas abundante. Claro que el jarron en donde las puse es grande.,0,0
PS6PDFA,2,10 abr. 2023,"Para nada lo que esperaba, faltó que especificara las medidas, las esperaba más largas, la foto esta engañosa.",0,1
PS6PDFA,2,21 nov. 2022,Pensé que serían más esponjosas y no tan frágiles. Muchas apenas y tienen plumas. Solo hicieron el maso son revisar que valieran la pena y se puedan utilizar en una decoración.,0,0
PS6PDFA,1,16 ago. 2023,"Definitivamente no es lo que aparece en la imagen. Son mucho más pequeñas, flacuchitas y sin chiste. No las recomiendo.",0,0
PS6PDFA,1,28 dic. 2022,Muy caras para lo que eran. No era lo que esperaba.,0,0
PS6PDFA,1,17 jun. 2023,Malo porque yo pense que era mas grande pero ni modos ya no se pudo aser nada.,0,0
FDTAPD3PR,5,06 jun. 2022,Definitivamente hermosas lucen tan hermosas excelente materiales y excelente calidad a mí me encantaron y quiénes ven mis hermosos tulipanes me preguntan dónde los compré. Los recomiendo mucho si son amantes de las flores wwooowww estas les van a enamorar parecen naturales definitivamente volveré a comprar. Mi color favorito son las rosadas.,0,7
FDTAPD3PR,5,24 ene. 2021,"Excelente calidad del producto, al tacto se sienten muy finas. Se ven muy bien. Solo revisen las medidas desde antes de comprar porque son ramos pequeños. En mi caso afortunadamente tenía los jarrones y me salieron doa floreritos.",0,7
FDTAPD3PR,5,27 may. 2023,"Me encantaron , parecen naturales. El bulbo es más chico que un tulipán natural pero eso no las deja de ver muy lindas.",1,4
FDTAPD3PR,5,29 ago. 2023,Excelentes!!👌🏻👌🏻.,2,3
FDTAPD3PR,5,15 feb. 2023,Hermosas y de calidad excelente.,0,1
FDTAPD3PR,5,25 ago. 2023,Muy bonitas las super recomiendo.,2,0
FDTAPD3PR,5,20 ago. 2023,Muy bonitas y el color es como se muestra en las fotos.,1,0
FDTAPD3PR,5,16 ago. 2023,Muy bonitas y de buena calidad.,1,0
FDTAPD3PR,5,20 jul. 2023,,1,0
FDTAPD3PR,5,18 jul. 2023,Super lindos cómo ralos y si quieres algo mas. Abultado compra 2.,1,0
FDTAPD3PR,5,30 may. 2023,,1,0
FDTAPD3PR,5,04 may. 2023,Hermosos ! muy buena calidad ! me encantaron.,1,0
FDTAPD3PR,5,11 sep. 2023,Excelente.,0,0
FDTAPD3PR,5,26 ago. 2023,Linda sorpresa para la pareja.,0,0
FDTAPD3PR,5,26 ago. 2023,"Hermosas flores, parecen reales comprare mas colores para cambiarlo cada mes. Recomendadas con un buen jarrón de cristal tu casa se vera muy elegante siempte.",0,0
FDTAPD3PR,5,19 ago. 2023,Excelentes muy bonitas y de buena calidad.,0,0
FDTAPD3PR,5,10 ago. 2023,Hermosas y muy reales!!.,0,0
FDTAPD3PR,5,03 ago. 2023,Excelente.,0,0
FDTAPD3PR,5,03 ago. 2023,"Trae varias de buen material, buen tamaño, excelente compra.",0,0
FDTAPD3PR,5,27 jul. 2023,Buen producto 👌.,0,0
FDTAPD3PR,5,21 jul. 2023,Preciosas quiero más.,0,0
FDTAPD3PR,5,17 jul. 2023,Hermosos y su textura parecen reales!!!.,0,0
FDTAPD3PR,5,13 jul. 2023,"Muy bonitas y de buena calidad , ya llevo más de un año con ellas y siguen igual no han perdido color.",0,0
FDTAPD3PR,5,08 jul. 2023,Parecen de verdad a mi mujer y mi mamá les gustaron mucho.,0,0
FDTAPD3PR,5,01 jul. 2023,"Nose de que material sean, pero están muy suaves solo compré uno, y después pedí más porque están muy lindas.",0,0
FDTAPD3PR,5,27 jun. 2023,Hermosos y parecen de verdad 😍.,0,0
FDTAPD3PR,5,14 jun. 2023,"Son muy lindos y parecen de foami, están bellísimos.",0,0
FDTAPD3PR,5,10 jun. 2023,"Muy bonitas, parecen naturales.",0,0
FDTAPD3PR,5,09 jun. 2023,Muy bonitas y si parecen naturales.,0,0
FDTAPD3PR,5,06 jun. 2023,Muy buen producto 👍.,0,0
FDTAPD3PR,5,31 may. 2023,Son muy hermosas. Me encantaron.,0,0
FDTAPD3PR,5,30 may. 2023,Hermosas muy bonitas para regalar.,0,0
FDTAPD3PR,5,28 may. 2023,Excelente producto.,0,0
FDTAPD3PR,5,24 may. 2023,Excelente producto. Recomendable al 100.,0,0
FDTAPD3PR,5,20 may. 2023,"Hermosas, hasta parecen naturales.",0,0
FDTAPD3PR,5,15 may. 2023,Están hermosas 💖.,0,0
FDTAPD3PR,5,14 may. 2023,Super bonita. Y parece. Reales.,0,0
FDTAPD3PR,5,13 may. 2023,Están super bonitas como si fueran reales.,0,0
FDTAPD3PR,5,13 may. 2023,Muy bonitas y a buen precio.,0,0
FDTAPD3PR,5,13 may. 2023,Se ven muy naturales. Son un muy buen detalle para regalar.,0,0
FDTAPD3PR,5,12 may. 2023,Muy bonitas.,0,0
FDTAPD3PR,5,12 may. 2023,Muy bonito producto y de muy buena calidad.,0,0
FDTAPD3PR,5,11 may. 2023,Son de buena calidad y muy bonitas.,0,0
FDTAPD3PR,5,11 may. 2023,"Muy bonitas, excelente tamaño y calidad, parecen flores reales. Volvería a comprar!!!.",0,0
FDTAPD3PR,5,10 may. 2023,En general hasta el momento estoy satisfecha con mis compras obtenidas en esta plataforma. Ha sido confiable y rápido obtener los productos. Seguiré con compras próximas.,0,0
FDTAPD3PR,5,04 may. 2023,"Hermosos, de buena calidad y de apariencia super natural.",0,0
FDTAPD3PR,5,04 may. 2023,"Me encantaron, se ven muy bonitas y parecen reales.",0,0
FDTAPD3PR,5,03 may. 2023,"Fueron un regalo, y son perfectas, comparadas a un tulipán natural, son una opción perfecta.",0,0
FDTAPD3PR,5,23 abr. 2023,Muy bonitos parecen reales.,0,0
FDTAPD3PR,5,22 abr. 2023,Muy bonitas.,0,0
FDTAPD3PR,5,16 abr. 2023,Me gusto el producto y por su relación precio calidad me parecen buenas y bonitas las flore. Las volveria a comprar.,0,0
FDTAPD3PR,5,02 abr. 2023,Se ven hermosas y se ven de calidad.,0,0
FDTAPD3PR,5,25 feb. 2023,"Hermosas. Bonito color, buen tamaño y calidad.",0,0
FDTAPD3PR,5,21 feb. 2023,Excelente son hermosas y de buena calidad.,0,0
FDTAPD3PR,5,20 feb. 2023,Se ven lindas.,0,0
FDTAPD3PR,5,20 feb. 2023,Producto exacto como se ve en fotógrafia.,0,0
FDTAPD3PR,5,17 feb. 2023,"Muy bonitas flores artificiales, cumplen su función, aunque debería decir que no creo que valgan el precio marcado. Son de buena calidad pero no valen su precio.",0,0
FDTAPD3PR,5,17 feb. 2023,Muy bonitas y parecen naturales.,0,0
FDTAPD3PR,5,15 feb. 2023,Era lo que esperaba hermosas y muy finas.,0,0
FDTAPD3PR,5,13 feb. 2023,"Buena textura , llenan un florero pequeño , lindas.",0,0
FDTAPD3PR,5,13 feb. 2023,"Exelente, es lo que pedi y le agrado mucho a mi esposa. Buena calidad, precio.",0,0
FDTAPD3PR,5,11 feb. 2023,El producto es bueno delicado.,0,0
FDTAPD3PR,5,09 feb. 2023,"Excelente producto, la textura es asombrosa. Parecen naturales.",0,0
FDTAPD3PR,5,08 feb. 2023,"El diseño es hermoso, las flores si parecen reales. ¡hermoso!.",0,0
FDTAPD3PR,5,11 ene. 2023,"Hermosas, las coloque en un florero de vidrio y parecen naturales.",0,0
FDTAPD3PR,5,30 dic. 2022,Muy buena calidad… fueron un regalo y le encantaron. Recomendado.,0,0
FDTAPD3PR,5,27 dic. 2022,Excelente material se ven muy reales.,0,0
FDTAPD3PR,5,16 dic. 2022,De buena calidad muy satisfecha con mi producto.,0,0
FDTAPD3PR,5,12 dic. 2022,"Exelente la verdad, muy bonitos superaron mis espectativas.",0,0
FDTAPD3PR,5,06 dic. 2022,Son hermosas y de muy buena calidad.,0,0
FDTAPD3PR,5,05 dic. 2022,Parecen naturales exclente calidad ya le pase el link a mis hermanas porq les encantaron.,0,0
FDTAPD3PR,5,05 dic. 2022,La verdad están súper hermosas me encantaron y la calidad excelente las recomiendo y las volveré a comprar están hermosísimas 10000000% recomenda.,0,0
FDTAPD3PR,5,02 dic. 2022,Muy hermosas!!.,0,0
FDTAPD3PR,5,17 nov. 2022,Muy bonitas y elegantes. Buena calidad.,0,0
FDTAPD3PR,5,06 nov. 2022,Todo muy atiempo y rapido todo.,0,0
FDTAPD3PR,5,02 nov. 2022,Hermosas me encantaron las volvería a comprar.,0,0
FDTAPD3PR,5,29 oct. 2022,"Muy reales al tacto,hermosas,pequeños pero perfecta decoración.",0,0
FDTAPD3PR,5,28 oct. 2022,"Son hermosas, parecen reales. Super recomendadisimo.",0,0
FDTAPD3PR,5,16 oct. 2022,Muy bonitas y buen material.,0,0
FDTAPD3PR,5,04 oct. 2022,"Están hermosísimas, parecen reales, muchas gracias!.",0,0
FDTAPD3PR,5,02 oct. 2022,"Excelente calidad, parecen reales. Es la mejor opción en tulipanes, recomendado 100%.",0,0
FDTAPD3PR,5,28 jul. 2022,"Se ven super reales , son pequeñas pero están muy bonitas , en color rosa creo que es el color mejor , todos preguntan dónde las compré y si son reales.",0,0
FDTAPD3PR,5,22 jul. 2022,Excelente producto la calidad excelente.,0,0
FDTAPD3PR,5,15 jun. 2022,Simplemente hermosas. Se ven como naturales.,0,0
FDTAPD3PR,5,12 jun. 2022,"Quedaron espectaculares en el ramo, están muy lindas.",0,0
FDTAPD3PR,5,07 jun. 2022,Preciosas. Se ven naturales. Se cayeron unas hijitas del tallo pero nada que no se pueda arreglar.,0,0
FDTAPD3PR,5,04 jun. 2022,"Se ven muy bonitas y parecen de verdad, en mi caso pude hacer dos floreros con un paquete de 30; fue un regalo para mi madre y le gustaron mucho, ideal para un bonito adorno.",0,0
FDTAPD3PR,5,03 jun. 2022,"Muy bonitos, no parecen artificiales.",0,0
FDTAPD3PR,5,01 jun. 2022,Le gustaron mucho a mi esposa. Se ven muy reales.,0,0
FDTAPD3PR,5,31 may. 2022,Son muy honitas y en relacion precio calidad es un buen producto. Me encanta como se ven.,0,0
FDTAPD3PR,5,26 may. 2022,Se ven muy reales y son de tamaño pequeño.,0,0
FDTAPD3PR,5,18 may. 2022,"Justo como en la imagen, están bien perronas para decorar.",0,0
FDTAPD3PR,5,12 may. 2022,Excelente muy bonitas calidad.,0,0
FDTAPD3PR,5,13 feb. 2022,"Jamas habia comprado flores tan realistas, el color es igual al de la foto.",0,0
FDTAPD3PR,5,10 feb. 2022,"Hermosas!, lastima que en este momento no están disponibles.",0,0
FDTAPD3PR,5,03 feb. 2022,Excelente en vdd se ven súper reales y de buena calidad valen mucho la pena y es un ramo bastante abundante yo llene 3 floreros pequeños.,0,0
FDTAPD3PR,5,29 ene. 2022,"Son tan bellas , como aterciopeladas , estan divinas !!!!!!.",0,0
FDTAPD3PR,5,26 ene. 2022,"El producto es bueno, lo recomiendo, tal vez un poco + grandes.",0,0
FDTAPD3PR,5,17 dic. 2021,Hermosas de buen estado y de buen calidad.,0,0
FDTAPD3PR,5,19 may. 2021,"Precioso ramo, como lo comentan, son pequeñas pero muy parecidas a las naturales no te arrepentirás de comprarlas.",0,0
FDTAPD3PR,5,03 may. 2021,Excelente calidad y muy buen diseño.,0,0
FDTAPD3PR,5,24 abr. 2021,"Se ven bellísimas, parecen naturales 100%.",0,0
FDTAPD3PR,5,23 abr. 2021,"Pues bellas, de buena calidad, perfectas para mi florero y para el sitio dónde las coloque, todo muy bien.",0,0
FDTAPD3PR,5,08 mar. 2021,"Muy bonitos ,los tulipanes, la verdad el material es excelente, es muy bonito a la vista y al tacto, ademas de que como adorno o regalo quedan perfecto.",0,0
