id,Calificación,Fecha,Reseña,Cantidad de imagenes,Utilidad
LGDL2FEI1,5,11 feb. 2023,"Muy buenas luces tanto para interiores como exteriores. Tienen un bonito diseño y están muy bien fabricados. La extensión tiene un largo de más de quince metros y cuenta con veinticinco focos. Se puede colgar de distintos lugares como el techo o las paredes. Los focos son muy resistentes a todo tipo de climas como agua, nieve y viento fuerte. La luz es tenue y hace de cualquier lugar un sitio muy acogedor, relajante y bonito. Se pueden instalar de manera fácil por cualquiera.",0,0
LGDL2FEI1,5,28 ene. 2023,Se ven de maravilla. Recomendados.,0,0
LGDL2FEI1,5,26 ene. 2023,"El empaquetado viene en excelente estado y el producto como tal bien cubierto, es lo prometido.",0,0
LGDL2FEI1,5,19 dic. 2022,"Es perfecto, se nota robusto y de buena calidad ademas se ajusta muy bien a la descripción.",0,0
LGDL2FEI1,5,07 nov. 2022,"Lámparas de alta calidad y resistentes, diseño contemporáneo y material resistente, muy fino en su hechura, buena luz y resistencia a la lluvia.",0,0
LGDL2FEI1,5,07 nov. 2022,"Me encantaron!! las utilice para colocarlas en mi patio de atrás y se ve increíble! de verdad me gustaron mucho, las recomiendo, porque no ocupas ni encender el foco de atrás, porque aluza muy bien!.",0,0
LGDL2FEI1,5,15 nov. 2022,"Esta guirnalda es muy bonita, combina perfecto con la decoracion y logra crear un ambiente bohemio. La iluminacion es muy buena y el tamaño de cada foco es adecuado, además de que calidad de los materiales es excelente, tanto que ya llovio y siguen funcionado perfectamente. La instale en mi patio y se ven geniales, cambio totalmente el como se veía y el ambiente que se generaba. Mi intención es comprar mas, ya que mi patio es grande y me hicieron falta. También las recomendaria para decorar salones de eventos, algún café, ya que en otras tiendas su precio es aún más alto levado, así que el precio aqui es de lo mejor.",0,0
LGDL2FEI1,4,21 ago. 2023,"Buen producto acorde al precio, el cable no se ve de buena calidad pero tampoco tan mala.",0,0
LGDL2FEI1,4,04 jun. 2023,"El producto se ve bien, pero la calidad del plástico nl se ve ta fuerte, espero que duren.",0,0
HADPTD1TP,5,23 dic. 2022,"Es un hermoso kit de decoración, creo que cuenta con un estilo genial. No había visto un kit de decoración con un estilo tan genial. Yo lo use para decorar una fiesta pero puedes usarlo también para decorar tu casa, las hojas son resistentes y reutilizables, se pueden lavar fácilmente y el precio es bajo.",0,2
HADPTD1TP,5,18 dic. 2022,"Ahora que fue mi boda me sirvieron mucho estas decoraciones le dieron un toque natural y fresco ami evento vienen diferentes tipos y tamaños de hojas entran perfecto tanto meterlo entre los globos o ponerlos en la mesa queda genial, los puse en mi patio y puedo decir que son resistentes ala intérperie me gusta que son reutilizables y el precio se me ha hecho bastante bueno y económico me agrada que vienen bastantes piezas me gustaron.",0,2
HADPTD1TP,5,14 dic. 2022,"El producto está muy bonito, el material y el color perfecto. Solo aclarar que las hojas grandes no traen tallo y son de tela. Vaya no sirven para ponerlas en un jarrón. Sino para ponerlas sobre una superficie plana. Por ejemplo en una mesa. No obstante muy bonito color y de muy buen tamaño, me funcionaron excelente par lo que las requeria. Están bastante económicas de hecho.",0,2
HADPTD1TP,5,21 ago. 2023,"Nos fascinaron. Las ocuparemos para otros eventos, y lo mejor es el precio. Muy accesible ya que cuenta con muchas piezas.",2,0
HADPTD1TP,5,15 ago. 2023,Hermosas!!! simplemente bellas. Valen la pena.,1,0
HADPTD1TP,5,17 jun. 2023,Buena calidad.,1,0
HADPTD1TP,5,31 ago. 2023,"Muy bonitas, lucidoras.",0,0
HADPTD1TP,5,29 ago. 2023,Excelente 👌 muy buena calidad.,0,0
HADPTD1TP,5,14 ago. 2023,Muy buena calidad. Hojas muy bonitas y variedad.,0,0
HADPTD1TP,5,10 ago. 2023,Muy buen producto excelente.,0,0
HADPTD1TP,5,10 ago. 2023,10/10.,0,0
HADPTD1TP,5,08 ago. 2023,Muy bonitas.,0,0
HADPTD1TP,5,03 ago. 2023,Me encanto 😍.,0,0
HADPTD1TP,5,02 ago. 2023,Justo lo que se esperaba e igual a lo que se especifica.,0,0
HADPTD1TP,5,31 jul. 2023,Muy bueno.,0,0
HADPTD1TP,5,27 jul. 2023,Buen producto.,0,0
HADPTD1TP,5,26 jul. 2023,"Muy bien todo, lo recomiendo ampliamente.",0,0
HADPTD1TP,5,25 jul. 2023,Bueno.,0,0
HADPTD1TP,5,20 jul. 2023,Me en contaron. Muy bonitas las recomiendo.,0,0
HADPTD1TP,5,16 jul. 2023,Gracias me funcionaron para el fin.,0,0
HADPTD1TP,5,16 jul. 2023,Excelente me sirvió muchísimo.,0,0
HADPTD1TP,5,09 jul. 2023,Muy bonito producto.,0,0
HADPTD1TP,5,01 jul. 2023,Todo muy bello.,0,0
HADPTD1TP,5,01 jul. 2023,"Muy buen producto. La textura del producto es agradable. No pensé que este precio podría comprar este producto de alta calidad. Además, el comerciante respondió a mis preguntas de manera oportuna. Es una experiencia de compra agradable. Lo recomendaré a mis amigos.",0,0
HADPTD1TP,5,01 jul. 2023,Divino y muy buena calidad.,0,0
HADPTD1TP,5,29 jun. 2023,Buen tamaño.,0,0
HADPTD1TP,5,27 jun. 2023,"Me gustaron mucho, excelente compra.",0,0
HADPTD1TP,5,19 jun. 2023,Calidad-precio. Excelente compra.,0,0
HADPTD1TP,5,19 jun. 2023,Bonitas!!.,0,0
HADPTD1TP,5,09 jun. 2023,Era lo que esperaba las recomiendo.,0,0
HADPTD1TP,5,06 jun. 2023,Buen producto. Cumplen con su función.,0,0
HADPTD1TP,5,03 jun. 2023,Excelente 👌 producto.,0,0
HADPTD1TP,5,02 jun. 2023,Muy bonitos y de buena calidad.,0,0
HADPTD1TP,5,26 may. 2023,Buena calidad tal como vienen en la fotos.,0,0
HADPTD1TP,5,07 may. 2023,"Hermosas! me encantaron, muy buena calidad, las recomiendo al 100%.",0,0
HADPTD1TP,5,30 abr. 2023,Son hojas de excelente calidad me gustaron mucho las recomiendo.,0,0
HADPTD1TP,5,29 mar. 2023,"Material sencillo, pero justo a la imagen.",0,0
HADPTD1TP,5,07 mar. 2023,"Si era lo que esperaba, muy bonitas variadas y de buen tamaño.",0,0
HADPTD1TP,5,05 mar. 2023,Excelnte.,0,0
HADPTD1TP,5,03 mar. 2023,"Son hojas muy lindas, de muy buena calidad, son bastantes.",0,0
HADPTD1TP,5,16 feb. 2023,"De buena calidad, se ven muy bonitos en todo tipo de decoración. En mi caso los pinté con aerosol para una decoración y sin problemas.",0,0
HADPTD1TP,5,10 feb. 2023,"Igual que la imagen, muy útiles y buen material se los recomiendo.",0,0
HADPTD1TP,5,04 feb. 2023,Me gusto mucho. Completo.,0,0
HADPTD1TP,5,02 feb. 2023,Bonitas y de buen material.,0,0
HADPTD1TP,5,18 ene. 2023,"Divinas, justo lo que se ve en imagenes.",0,0
HADPTD1TP,4,02 ago. 2023,Me gustó esta dentro de las espectativas que tenía lo volvería a comprar en un futuro.,0,0
HADPTD1TP,4,26 jul. 2023,Están súper bien. Estaría excelente si las hojas grandes tuvieran tallo como todas las demás.,0,0
HADPTD1TP,4,25 jun. 2023,"Buen material muy funcionales, las voleria a comprar.",0,0
HADPTD1TP,4,22 jun. 2023,Excelente producto pero me hubiera gustado si todos fueran del mismos material.,0,0
HADPTD1TP,3,07 ago. 2023,Me hubiera gustado q todas las hojas tuvieran su palito para sostenerse.,0,0
75HDDP,5,21 ago. 2023,"Excelente producto, contenta mi hija.",0,0
2PMPDDPA3,5,15 jul. 2023,"Se ven muy bonitas las puedes abrir y acomodar como mejor te guste, el pegamento es muy resistente y no se nota ya que es transparente, las medidas quedan muy bien para decoraciones en globos o con flores, resaltan mucho. Sin duda volvería a comprar!!!.",1,1
2PMPDDPA3,5,24 jul. 2023,"Me gustaron las mariposas porque tienen un color dorado metálico muy padre, lucen muy bien con la luz que les refleja, es fácil de pegarlas en cualquier lugar, por ejemplo yo las utilicé en mi habitación, decore toda una pared y aún así me quedaron muchas mariposas para poder colocarlas en cualquier lugar, me agradó porque la terminación de los recortes está muy bien, no tiene algún residuo de material, se siente que son de una calidad considerable y creo que su precio está adecuado.",2,0
2PMPDDPA3,5,22 jul. 2023,"Me encantaron!! están super bien hechos, tienen buena calidad, son muy bonitos y cumplen con su función, me gustaron mucho, los recomiendo!! los compraría de nuevo.",2,0
2PMPDDPA3,5,24 jul. 2023,Son una mariposas decorativas muy brillantes bonitas y elegantes se verán muy bonitos en la decoración de los pasteles y sobre todo no son toxinas ni tampoco suelta toxinas es de muy buen material!! también se pueden usar para otros tiempo de decoración como adornos de habitaciones me encanta compraré de deferentes colores!!.,1,0
2PMPDDPA3,5,21 jul. 2023,"Su diseño es muy bonito y de buena calidad, a mi hija le gustaron mucho para la decoración de su cuarto y son de buen tamaño.",1,0
2PMPDDPA3,5,24 sep. 2023,"Muy lindas, me gustó que vienen en diferentes tamaños, y los tamaños son perfectos para los ramos de rosas eternas.",0,0
2PMPDDPA3,5,23 sep. 2023,Estas divinas.,0,0
2PMPDDPA3,5,01 sep. 2023,Excelente producto lo recomiendo mucho la verdad.,0,0
2PMPDDPA3,5,25 ago. 2023,"Más bonito, de lo que esperaba.",0,0
2PMPDDPA3,5,15 ago. 2023,Excelente.,0,0
2PMPDDPA3,5,15 ago. 2023,"Hoy quiero compartir con ustedes un hallazgo emocionante que ha transformado por completo mi habilidad para embellecer cualquier espacio. Si eres como yo y disfrutas añadiendo un toque de estilo y personalidad a tus entornos, entonces estas pegatinas son un verdadero tesoro. Lo que me fascina de estas pegatinas es la amplia variedad de modelos y tamaños que vienen en cada paquete. Con un total de 288 pegatinas en tres tamaños diferentes, nunca te quedarás corto de opciones creativas para embellecer tus rincones favoritos.",0,0
2PMPDDPA3,5,04 ago. 2023,Están muy bonitas tal cual a la imagen.,0,0
2PMPDDPA3,5,27 jul. 2023,Perfecto viene en empaques individuales.,0,0
2PMPDDPA3,5,27 jul. 2023,Justo lo q yo esperaba.,0,0
2PMPDDPA3,5,25 jul. 2023,"Se ven de muy buena calidad y trae bastantes, con un solo paquete puedes decorar toda una pared o mucho más, en mi caso coloque algunas en mi consultorio y me quedaron bastantes, además los colores y el material se ven súper padre, la verdad es que me encantaron, muy recomendables para cualquier decoración ya sea permanente o temporal.",0,0
2PMPDDPA3,5,22 jul. 2023,"Un producto muy bonito, de fácil instalación.",0,0
2PMPDDPA3,5,19 jul. 2023,Las mariposas son hermosas adornaron mi casa son de buen material y son de buen tamaño el precio es muy accesible en si no tengo queja alguna alcontrario superó mis expectativas.,0,0
2PMPDDPA3,5,14 jul. 2023,"Totalmente hermosas!! la verdad de excelente material, estéticamente se ven hermosas, la calidad del producto en general es asombroso, luce muy bonito, son fáciles de utilizar, fácil de acomodar y son bastante resistentes, me encantaron, fue más de lo que esperaba y si lo recomiendo muchas gracias.",0,0
2PMPDDPA3,3,18 sep. 2023,"Las mariposas son hermosas a la vista, sin embargo el adhesivo no es suficiente bueno y fuerte para mantenerlas fijas en el sitio.",0,0
2PMPDDPA3,3,21 ago. 2023,"El. Producto. Esta super bien, solo que vienen todas de un solo estilo y no se parece al de la foto, si están muy bonitas y de buena calidad, pero eso que no son del estilo de la foto.",0,0
CDLDP,4,30 jul. 2023,Están bien si lo que buscan es sencillez me gustaron muy bonitos y se pueden limpiar con un paño húmedo.,0,0
MLSN1MIM,5,22 jun. 2023,"Muy buen producto, excelente calidad/precio.",2,2
MLSN1MIM,5,07 jul. 2023,Ilumina muy bonito.,0,2
MLSN1MIM,5,06 jul. 2023,Muy sastifecho.,0,2
MLSN1MIM,5,17 jun. 2023,Me gustaron son muy resistentes y contra el agua cambian de intermitencia.,0,2
MLSN1MIM,5,12 jul. 2023,Muy bueno 👌 👍.,0,1
MLSN1MIM,5,08 jul. 2023,Muy bueno 👌.,0,1
MLSN1MIM,5,13 sep. 2023,"Sí son blancas led! , ya que compré anteriormente otras y no eran blancas , estas sí y son de buena calidad compré dos y las unimos , buena iluminación.",1,0
MLSN1MIM,5,19 sep. 2023,Muy buen producto le quedó perfecto y las impresiones son adecuadas.,0,0
MLSN1MIM,5,05 sep. 2023,Exelente producto gracias.,0,0
MLSN1MIM,5,04 sep. 2023,Excelente en calidad y precio.,0,0
MLSN1MIM,5,29 ago. 2023,Era lo que esperaba me encantaron.,0,0
MLSN1MIM,5,22 ago. 2023,Excelenre.,0,0
MLSN1MIM,5,13 ago. 2023,Buen producto calidad de materiales.,0,0
MLSN1MIM,5,13 ago. 2023,El producto jala al 100.,0,0
MLSN1MIM,4,09 jun. 2023,Bueno.,0,2
MLSN1MIM,4,31 jul. 2023,"Es buen producto por el precio recibes lo que compras, me hubiese gustado que tuviera funciones ya que solo es fija.",0,0
JDVADCDSD2O9P,5,17 may. 2023,"Estan muy padres las velas, vienen en su caja y es ideal para regalar, traen una variedad de aromas, el botesito de las velas es muy bonito son metalicos y una vez que se termina la vela puedes reutilizar el bote para guardar cositas, el diseño es muy bonito y el aroma es duradero y huelen muy rico.",2,2
JDVADCDSD2O9P,5,17 may. 2023,"Me encantó estas velas aromáticas, huelen riquísimas me ayudan a relajarme y los diseños de los tarritos estan super cool, los uso cuando me voy a dormir y la verdad esta terapia con las velas está genial , duran mucho, y no se derriten tan fácilmente y los tarritos pueden reutilizarse. Excelente calidad y precio justo.",2,1
JDVADCDSD2O9P,5,14 may. 2023,"Están divinas. Excelente opción si tienes varios regalos que dar, envueltas individualmente con una tarjeta pueden ser un bonito detalle y es algo que fácilmente le puede gustar y servir a la gente. Se ven muy bonitas como decoración tanto en cajita como prendidas.",2,1
JDVADCDSD2O9P,5,14 ago. 2023,"Aroma delicioso en cada vela,.",2,0
JDVADCDSD2O9P,5,13 ago. 2023,"Me encantaron tienen un rico aroma y todas tienen diferente aroma,y vienen en una cajita muy bonita.",2,0
JDVADCDSD2O9P,5,14 ago. 2023,"El aroma es muy rico, desde que destapas la latita, mi único inconveniente que vinieron sucias las cajitas de cera derretida, las dos de abajo, pero no afecta su uso y sigo encantada.",1,0
JDVADCDSD2O9P,5,09 sep. 2023,"Realmente son hermosas, fue un regalo y la persona quedó encantada, aún no las utilizamos sin embargo el aroma de las velas es muy rico y la presentación es realmente linda. Un plus es que puedes utilizar los recipientes en diferentes ideas ya que están decorados muy padres.",0,0
JDVADCDSD2O9P,5,02 sep. 2023,Lindo.,0,0
JDVADCDSD2O9P,5,30 ago. 2023,"Fue un regalo y cumplió perfecto el cometido, las velas huelen bien, de buen tamaño, vienen en una caja muy bonita. Las recomiendo.",0,0
JDVADCDSD2O9P,5,25 ago. 2023,Son hermosas ❤️.,0,0
JDVADCDSD2O9P,5,23 ago. 2023,"Super recomendadas! todas tienen olor diferente, super bonitas!.",0,0
JDVADCDSD2O9P,5,22 ago. 2023,Huelen maravilloso excelente producto para alguien que le gusta la velas y están muy bellas.,0,0
JDVADCDSD2O9P,5,21 ago. 2023,"Excelente producto, están hermosas, huelen muy bien.",0,0
JDVADCDSD2O9P,5,20 ago. 2023,"Están pequeñitas pero muy bonitas, es un detalle lindo.",0,0
JDVADCDSD2O9P,5,18 ago. 2023,"Los aromas de estas velas me gustan mucho, cada una tiene un aroma diferente. Vienen muy bien empacadas. Perfecto para regalar. Los recipientes que están muy bonitos, ya vacíos se pueden usar para guardar objetos pequeños.",0,0
JDVADCDSD2O9P,5,18 ago. 2023,Huelen muy rico y el tamaño de cada vela es adecuado. Volveré a comprar.,0,0
JDVADCDSD2O9P,5,18 ago. 2023,"Súper bonitas, bien empaquetadas y huelen muy rico.",0,0
JDVADCDSD2O9P,5,16 ago. 2023,"Estan super bonitas, vienen en su cajita tambien muy bonita para regalar o para uno mismo. De entrada huelen muy rico pero no sè ya cuando se prendan. Pero insisto estan muy bonitas.",0,0
JDVADCDSD2O9P,5,31 jul. 2023,"Huelen riquisimo y tienen una excelente presentacion, si duda volveria a comprarlas.",0,0
JDVADCDSD2O9P,5,30 jul. 2023,Excelente me gustaron las velas buen aroma y el contenedor de aluminio excelente.,0,0
JDVADCDSD2O9P,5,27 jul. 2023,Belleza de velas.,0,0
JDVADCDSD2O9P,5,27 jul. 2023,"Exelente muy buen producto, me encantaron.",0,0
JDVADCDSD2O9P,5,26 jul. 2023,Maravillosos para regalar. En cuanto a relación calidad precio me quedo satisfecho.,0,0
JDVADCDSD2O9P,5,25 jul. 2023,"Buenísimo para un regalo, los aromas muy buenos.",0,0
JDVADCDSD2O9P,5,21 jul. 2023,Preciosa y tienen buen aroma.,0,0
JDVADCDSD2O9P,5,20 jul. 2023,Excety de muy buena calidad.,0,0
JDVADCDSD2O9P,5,20 jul. 2023,"Huelen muy rico, cada vela tiene un diseño diferente y bonito, me encantaron.",0,0
JDVADCDSD2O9P,5,20 jul. 2023,"Me encantaron los aromas, los diseños, me trajo muchos recuerdos cada una y me hicieron tener una experiencia increíble, amo la aroma terapia y estas velitas resultaron mágicas, 10 de 10.",0,0
JDVADCDSD2O9P,5,19 jul. 2023,"Son hermosas, fueron un regalo y quien las recibió quedó encanta.",0,0
JDVADCDSD2O9P,5,17 jul. 2023,"Huelen súper rico y dura bastante el olor, las recomiendo mucho.",0,0
JDVADCDSD2O9P,5,16 jul. 2023,Huelen delicioso!.,0,0
JDVADCDSD2O9P,5,14 jul. 2023,Esta súper bonitas y prácticas.,0,0
JDVADCDSD2O9P,5,10 jul. 2023,"Me emcataron, excelente calidad ha sido una de las mejores compras que he hecho, tienen un olor muy rico, los envaces de las velas los pueden resiclar y sirver como alajero, y también son muy lindos, lo recomiendo mucho vale cada peso.",0,0
JDVADCDSD2O9P,5,08 jul. 2023,Satisfecha con la compra.,0,0
JDVADCDSD2O9P,5,07 jul. 2023,"Estan increibles, y el aroma es sutil, no apesta el cuarto. Volveré a comprar pronto.",0,0
JDVADCDSD2O9P,5,04 jul. 2023,"Me encantaron, al abrirlas huelen súper bien, además que después de que se acabe la cera quedan unos tarritos muy lindos para usarlos para guardar aretes u otras cosas, los compre para regararlos pero creo que me los voy a quedar.",0,0
JDVADCDSD2O9P,5,03 jul. 2023,"Muy bonitos, de buena calidad y precio, huelen rico, y estan hermosas sus cajitas!.",0,0
JDVADCDSD2O9P,5,01 jul. 2023,Me encantó simplemente las latas son hermosas y los aromas deliciosos. Satisfecha al 💯 %.,0,0
JDVADCDSD2O9P,5,30 jun. 2023,"Son hermosos los diseños y los olores de algunos también, si las recomiendo.",0,0
JDVADCDSD2O9P,5,27 jun. 2023,Muy bonitas y aromaticas.,0,0
JDVADCDSD2O9P,5,19 may. 2023,"Me encantaron los aromas, los colores; excelente como obsequio.",0,0
JDVADCDSD2O9P,5,06 may. 2023,Todo bien y en forma.,0,0
JDVADCDSD2O9P,4,24 jul. 2023,No tenían floresitas secas.,0,0
JDVADCDSD2O9P,3,08 jul. 2023,"Esta bien la presentación, pero los aromas no fueron del todo mi agrado.",0,0
P3D5BPCA2,5,06 sep. 2023,Excelente producto paneles bien echos quedo de amil mi pared 100%.,1,1
P3D5BPCA2,5,20 sep. 2023,Fácil de instalar y de muy buena calidad.,1,0
P3D5BPCA2,5,14 sep. 2023,Un excelente producto le da un toque único a tus espacios.,1,0
P3D5BPCA2,5,06 sep. 2023,Excelente material se los recomiendo.,1,0
P3D5BPCA2,5,25 sep. 2023,Excelente producto.,0,0
P3D5BPCA2,5,24 sep. 2023,Excelente pegan bien con la cinta que incluyen y se ven muy bien.,0,0
P3D5BPCA2,5,24 sep. 2023,Excelente.,0,0
P3D5BPCA2,5,22 sep. 2023,"Muy buen producto, realza las paredes muy bien.",0,0
P3D5BPCA2,5,20 sep. 2023,Excelente.,0,0
P3D5BPCA2,5,20 sep. 2023,Tendra paquetes del mismo modelo pero de menos piezas.,0,0
P3D5BPCA2,5,18 sep. 2023,Excelente producto super recomendable.,0,0
P3D5BPCA2,5,18 sep. 2023,Facilísimo de pegar! cae de maravilla que traigan su cinta doble cara porque ya no gastas en adhesivo pero si le quieres dar más reforzamiento con no más clavos puedes darle unos toques por atrás del adhesivo adicional a la cinta doble cara y listo! no veo necesario el no más clavos pero no está de más. Honestamente no creía que la cinta doble cara que traía fuera resistente pero después de pegar el primer molde quedó perfecto! la mejor decisión que pude haber hecho en cuanto a estas pegatinas 3d. Las super recomiendo! excelente relación calidad / precio. Cómpralas sin dudarlo! te van a quedar super bonitas! te las recomiendo mucho!.,0,0
P3D5BPCA2,5,17 sep. 2023,Excelente producto.,0,0
P3D5BPCA2,5,06 sep. 2023,Excelente producto! súpero mis expectativas. Se siente resistente y tiene una apariencia de gran calidad.,0,0
P3D5BPCA2,5,06 sep. 2023,Muy bueno producto y de buena calidad.,0,0
P3D5BPCA2,5,06 sep. 2023,"Aun no se. Instala, pensé q venia más delgado se ve resistente, y muy elegante.",0,0
P3D5BPCA2,5,06 sep. 2023,"Quedan hermoso en la pared ,me encantó.",0,0
P3D5BPCA2,5,06 sep. 2023,"Me encanto, fácil de instalarse y se ve muy bonito.",0,0
P3D5BPCA2,5,06 sep. 2023,Buen producto.,0,0
P3D5BPCA2,5,06 sep. 2023,"Satisfecha con el producto, muy recomendable!.",0,0
P3D5BPCA2,5,03 sep. 2023,Muy buen producto y fácil de instalar.,0,0
P3D5BPCA2,5,03 sep. 2023,"Excelente producto me encanto, fácil de instalar.",0,0
P3D5BPCA2,5,01 sep. 2023,Excelente calidad y super económico.,0,0
P3D5BPCA2,5,01 sep. 2023,Muy buen producto si lo recomiendo.,0,0
P3D5BPCA2,5,30 ago. 2023,Se ve muy bien. La cinta adhesiva está bien y sirve.,0,0
P3D5BPCA2,5,29 ago. 2023,Excelente calidad del producto los cuadros empalman sin ningún problema.,0,0
P3D5BPCA2,5,21 ago. 2023,"Súper precio y espectacular producto , quede muy satisfecho.",0,0
P3D5BPCA2,5,20 ago. 2023,Excelente producto y lo mejor que le puedes aplicar pintura al tono que quieras (automotriz) aplicándolo con pistola y compresora.,0,0
1PSPDVPD,5,11 sep. 2023,Les encantaron.,0,0
1PSPDVPD,5,08 ago. 2023,Me gustó mucho es lo que esperaba.,0,0
1PSPDVPD,3,28 ago. 2023,Muy chiquitas pero bonitas.,0,0
GDL2FVD1PE,5,27 jun. 2023,Excelentes.,1,4
GDL2FVD1PE,5,03 jul. 2023,Excelente compra !!! me encantaron!!!.,1,1
GDL2FVD1PE,5,31 ago. 2023,Me encantaron. Precio y calidad lo valen.,1,0
GDL2FVD1PE,5,30 jul. 2023,Hermosas.,1,0
GDL2FVD1PE,5,29 jul. 2023,Me encantoron😍.,1,0
GDL2FVD1PE,5,23 sep. 2023,Mi producto me fascinó lo recomiendo mucho.,0,0
GDL2FVD1PE,5,19 sep. 2023,Súper bien.,0,0
GDL2FVD1PE,5,18 sep. 2023,Excelente!!! muy bonitas para decoración.,0,0
GDL2FVD1PE,5,18 sep. 2023,"Me encantaron, ya tenía una serie igual y la verdad es que me han funcionado bien, todos los foquitos funcionan, son algo frágiles pero hasta ahora solo se me ha quebrado un foco.",0,0
GDL2FVD1PE,5,17 sep. 2023,Muy bonitas muy buena compra.,0,0
GDL2FVD1PE,5,11 sep. 2023,"Excelente. Me gusto funcionan bien aun que, crei que los focos eran mas grande pero, muy bueno.",0,0
GDL2FVD1PE,5,07 sep. 2023,"Son tal cual lo qe promete, lucen muy bien y crean un ambiente excelente.",0,0
GDL2FVD1PE,5,07 sep. 2023,Buen tamaño de los focos ni chicos ni grandes.,0,0
GDL2FVD1PE,5,07 sep. 2023,Super bonitos.,0,0
GDL2FVD1PE,5,04 sep. 2023,Excelente producto.,0,0
GDL2FVD1PE,5,27 ago. 2023,Exelente compra👛💰👐.,0,0
GDL2FVD1PE,5,23 ago. 2023,Muy buenos.,0,0
GDL2FVD1PE,5,21 ago. 2023,Me gustaron mucho.,0,0
GDL2FVD1PE,5,20 ago. 2023,Muy buenas cumplen su función.,0,0
GDL2FVD1PE,5,13 ago. 2023,Es muy bueno iluminó el cumpleaños que festejamos y son resistentes los poquitos iluminan bien.,0,0
GDL2FVD1PE,5,11 ago. 2023,Excelente.,0,0
GDL2FVD1PE,5,09 ago. 2023,Para reuniones familiares excelente.,0,0
GDL2FVD1PE,5,06 ago. 2023,"Súper bonitas de decoración, además, iluminan muy bien, me parece un buen producto, buena inversión.",0,0
GDL2FVD1PE,5,02 ago. 2023,"Buena calidad, alumbran bien.",0,0
GDL2FVD1PE,5,02 ago. 2023,"Buen producto para decorar jardín, terraza o alguna reunión.",0,0
GDL2FVD1PE,5,02 ago. 2023,"Al principio no le tenía fe, pero me sorprendió lucen hermosas.",0,0
GDL2FVD1PE,5,26 jul. 2023,Buen producto ilumina bien.,0,0
GDL2FVD1PE,5,18 jul. 2023,Justo lo que esperaba.,0,0
GDL2FVD1PE,5,12 jul. 2023,Supero mis expectativas.,0,0
GDL2FVD1PE,5,06 jun. 2023,Muy practicas.,0,0
GDL2FVD1PE,5,22 mar. 2023,Buena calidad y a buen precio.,0,0
GDL2FVD1PE,5,30 may. 2023,Buen producto cumple con su función.,0,0
GDL2FVD1PE,5,23 may. 2023,"Súper lindas, son como lo esperaba.",0,0
GDL2FVD1PE,5,21 may. 2023,Excelente producto.,0,0
GDL2FVD1PE,5,26 abr. 2023,Excelente producto!.,0,0
GDL2FVD1PE,5,18 abr. 2023,Excelente producto.,0,0
GDL2FVD1PE,5,27 mar. 2023,Me gustaron y están súper padres.,0,0
GDL2FVD1PE,4,14 sep. 2023,"Un poco sencillos pero funcionales para su evento, la calidad no es la mejor pero por el precio se me hace justo.",0,0
GDL2FVD1PE,4,07 sep. 2023,Están muy bonitos y que dan muy bonitos para decorar.,0,0
GDL2FVD1PE,4,13 jul. 2023,Están bonitos.,0,0
GDL2FVD1PE,3,21 may. 2023,Me falto un foco.,0,0
2VLEDLCEFL,5,12 jun. 2023,"Tengo una papelería y constantemente llegan a pedir este tipo de velas sin flama. Obviamente comprarlas así en paquete me sale más barato, son aceptables pues la calidad no es de lo mejor. Pero por el precio pagado no se le puede pedir más. Todas incluyen su bateria y botón de encendido y apagado.",1,4
2VLEDLCEFL,5,16 ene. 2023,Es justo lo que mis ojos ven.,0,3
2VLEDLCEFL,5,24 ene. 2023,Muy bonitas y de buena calidad.,0,2
2VLEDLCEFL,5,05 ago. 2023,Me encantaron las velas 🙊la luz es calida ❤️ y alumbra muy lindo ❤️.,2,1
2VLEDLCEFL,5,19 jun. 2023,"Hermosas velitas, para adornar están geniales, muy románticas, vienen con las pilas ya puestas, la luz es tenue, son algo fragiles pero todas funcionaron perfecto.",2,0
2VLEDLCEFL,5,25 sep. 2023,Las lamparas iluminan muy bien y la pila es duradera muy recomensable.,0,0
2VLEDLCEFL,5,25 ago. 2023,"Super prácticas y bonitas, de buen tamaño.",0,0
2VLEDLCEFL,5,15 ago. 2023,Muy bien nada más tres salieron mal pero por el precio está bien.,0,0
2VLEDLCEFL,5,13 ago. 2023,"Muy buen producto, la luz dura de manera continua hasta 7 hrs, ideal para adornos de mesa nocturnos.",0,0
2VLEDLCEFL,5,07 ago. 2023,Son muy lindas y funcionan por mucho tiempo.,0,0
2VLEDLCEFL,5,01 ago. 2023,"Cumplen su función, traen ya sus pilas, las ocupamos para unos centros de mesa están lindas.",0,0
2VLEDLCEFL,5,30 jul. 2023,Bueno.,0,0
2VLEDLCEFL,5,29 jul. 2023,100%.,0,0
2VLEDLCEFL,5,26 jul. 2023,Si luz es intensa son muy lindas.,0,0
2VLEDLCEFL,5,25 jul. 2023,"Estoy encantada con estas velas led, recomendada la compra.",0,0
2VLEDLCEFL,5,23 jul. 2023,Excelente producto y de muy buena calidad.,0,0
