id,Calificación,Fecha,Reseña,Cantidad de imagenes,Utilidad
2PDRADSRYB,5,22 sep. 2023,Me encanto ¡se ve super real! para un evento es super excelente. Recomendadisimo!.,0,0
2PDRADSRYB,5,13 sep. 2023,Tienen textura lo que hace que se vean reales. La verdad son demasiados y estan muy bien por el precio.,0,0
2PDRADSRYB,5,11 ago. 2023,"Más que excelentes, a simple vista parecen reales y hace que todo se vea precioso. 100% recomendables.",0,0
1BHBGB7PP,5,19 ago. 2023,"Lo primero que noté fue la generosa cantidad de 120,000 balas de hidrogel en el paquete. Esto significa que tendré suficiente munición para numerosas sesiones de juego y diversión sin preocuparme por quedarme sin balas. La calidad y textura de las balas de gel son notables. Son suaves y elásticas al tacto, lo que las hace seguras y cómodas para su uso en juegos. Además, cuando se hidratan adecuadamente, se expanden a su tamaño de 7-8mm, lo que las convierte en balas de juego ideales. El proceso de hidratación es simple y rápido. Sólo se requiere sumergirlas en agua durante un tiempo, y luego están listas para usar. No causan daño ni dolor y son biodegradables, lo que es una característica positiva en términos de sostenibilidad.",1,0
1BHBGB7PP,5,24 sep. 2023,"Excelentes, son muy rápidas para crecer a su tamaño de uso.",0,0
1BHBGB7PP,5,22 ago. 2023,Bueno.,0,0
1BHBGB7PP,5,18 ago. 2023,Muy bueno.,0,0
MSLNSLPEB,5,03 mar. 2023,"Esta como la. Quería, no tan larga la. Manguera y esta super chida.",0,1
MSLNSLPEB,5,20 sep. 2023,Excelente.,0,0
MSLNSLPEB,5,25 ago. 2023,Excelente producto.,0,0
MSLNSLPEB,4,12 sep. 2023,"Funcionan bien, los materiales no son de alta calidad pero responden mal precio. Es jn manguera delgada pero aguanta bien el exterior, habrán que ver aún cuantos usos duran. Satisfecho hasta el momento.",0,0
MSLNSLPEB,2,11 sep. 2023,"Me falló una manguera , no enciende.",0,0
MPTP2DC,5,17 jun. 2023,Excelente cañidad y a muy buen precio.,0,0
MPTP2DC,5,13 jun. 2023,Le quedo perfecto a mi titulo universitario que mide 42x 30 cm.,0,0
MPTP2DC,5,04 jun. 2023,"Es un buen producto y es de calidad, es el que tiene las dimensiones más parecidas a mi título le quedó grande, pero nada que no arregle una hoja de fondo. Y viene preparado para colgarse y muy bien protegido.",0,0
MPTP2DC,5,28 may. 2023,"Excelente calidad, elegante y resistente.",0,0
MPTP2DC,5,23 may. 2023,Un buen material para documentos.,0,0
MPTP2DC,5,19 may. 2023,Buen producto.,0,0
MPTP2DC,5,07 may. 2023,"El producto es muy bueno, cada detalle del marco al cien % excelente compra.",0,0
MPTP2DC,5,05 abr. 2023,Excelente justo a la medida solicitado.,0,0
MPTP2DC,5,17 mar. 2023,"Muy bonito, y llega en excelentes condiciones. Lo recomiendo ampliamente.",0,0
MPTP2DC,5,16 mar. 2023,"Quedó un poco grande para el título del ipn, pero nada que un fondo no pueda arreglar.",0,0
MPTP2DC,5,04 mar. 2023,Muybueno.,0,0
MPTP2DC,5,16 feb. 2023,"Muy buena calidad, el acabado, vidrio, tamaño y gancho para colgar son muy buenos. Me encantó!.",0,0
MPTP2DC,5,06 feb. 2023,Perfecto!!. Mi documento cupo sin problemas y además es ligero y fácil de colocar!.,0,0
MPTP2DC,5,14 ene. 2023,Todo cómo se describe.,0,0
MPTP2DC,5,19 dic. 2022,Hermosisimo!!!! me encanto! ademas viene muy muy cuidadosamente envuelto. Feliz con mi compra!.,0,0
MPTP2DC,5,03 dic. 2022,De muy buenísima calidad 100% recomendado!!.,0,0
MPTP2DC,4,26 ago. 2023,"El detalle importante son los broches de atrás para colocar el título me dió trabajo están muy duros , y si tienen título de unam les. Comento les queda chico el de doble carta.",0,0
MPTP2DC,4,18 jun. 2023,Bien/regular económico.,0,0
MPTP2DC,4,04 feb. 2023,El producto cumplió con las especificaciones. Esta un poco chueco pero no es muy notorio.,0,0
6BDAPGRYE,5,14 ago. 2022,"Simplemente me hace mucho mas facil mi trabajo. Tengo ahora todo organizado y por ejemplo mis cobijas ya no huelen a polvo o a guardado. Las lavo y las meto en las bolsas y conservan su aroma a suavitel. Pero no solo es para guardar cobijas, guardo toallas, ropa, o hasta juguetes de mi hijo. Tiene seis bolsas del mismo tamaño y de verdad les caben todo. Son muy practicas y eficientes. Yo solo las meto en la parte de arriba de mi closet y listo. Otra cosa que me gusta es que tienen unas partes transparentes y eso es mucho mejor porque asi puedes ver lo que contienen y no tienes que estar abriendo y sacando todo. Incluso puedes regalarlas y las van a amar porque si te facilitan mucho las cosas.",0,14
6BDAPGRYE,5,05 jul. 2022,"Excelentes bolsas de almacenamiento, la verdad que estas bolsas de almacenamiento están excelentes, me ayudan muchísimo a organizar mi closet y éstas, al estar vacías, puedo plegarlas. Los materiales de los que está hecha son muy buenos, resistentes, no manchan la ropa o se les pega mucha pelusa, también hay que considerar que vienen en excelente tamaños por la misma compra. Creo que las utilidades son muchas más que sólo organizar la ropa dentro del closet. Quiero adquirirlo más juegos de éstos porque me parecen grandiosos. Me gusto que bien en seis bolsas, son de muy buena calidad, son modernas. Es justo lo que buscábamos para darle una mejor apariencia a todos los cobertores y ropa de invierno que almacenamos arriba del closet. Son muy prácticos y espaciosos, pensé q serían más chicos pero no, tienen buen tamaño y las sábanas, toallas y edredones caben perfectamente y se ve ordenado,.",0,13
6BDAPGRYE,5,10 jul. 2022,"Me gusta la tela de estas bolsas. No tengo miedo de desgarrarlos como productos similares que están hechos de tela tan delgada y frágil que no se rompen en nada. La gran ventana en la parte delantera de la bolsa es conveniente para un acceso rápido a su contenido. Las cremalleras no parecen ser de muy alta calidad, pero si las conoces y las manejas con cuidado, no creo que haya ningún problema. Además, es mejor no llenar demasiado la bolsa.",0,2
6BDAPGRYE,5,27 jun. 2022,"Este juego de bolsas de almacenamiento me gustaron mucho y me parecen muy prácticas, tienen un excelente tamaño lo que permite guardar edredones tamaño king size sin ningún problema, el material con el que está construido es muy resistente, las manijas vienen reforzadas por lo que no se rompen fácilmente, el tamaño permite guardarlas dentro del closet sin ningún problema, la utilizo para mantener organizada la ropa de invierno y la de verano y como tiene partes transparentes me permite saber perfectamente que está adentro de ellas, una excelente compra.",0,2
6BDAPGRYE,5,08 feb. 2023,"Estan bien y grandes como esperaba, para guardar. Muy bien.",0,1
6BDAPGRYE,5,18 ene. 2023,"Muy buenas, le caben mucho la verdad, si recomiendo para organizar closets.",0,1
6BDAPGRYE,5,09 sep. 2023,Están bien para su precio.,3,0
6BDAPGRYE,5,17 jul. 2023,"Prácticas,y muy resistente.",1,0
6BDAPGRYE,5,05 jul. 2023,"Muy buenas para guardar ropa, edredones y sábanas.",1,0
6BDAPGRYE,5,25 sep. 2023,Excelente.,0,0
6BDAPGRYE,5,23 sep. 2023,"Me encanta, excelente capacidad y calidad !!.",0,0
6BDAPGRYE,5,21 sep. 2023,"Excelente producto, muy versátil, solo algo facil de abrirse en las esquinas, hay que cuidar eso.",0,0
6BDAPGRYE,5,19 sep. 2023,"Son de buen tamaño y practicas para guardar y almacenar,.",0,0
6BDAPGRYE,5,17 sep. 2023,Me encantaron.,0,0
6BDAPGRYE,5,13 sep. 2023,Excelente.,0,0
6BDAPGRYE,5,13 sep. 2023,Esta muy funcional este producto. Le cabe muchísimo. Yo lo use para edredones king y sin problema cupieron.,0,0
6BDAPGRYE,5,12 sep. 2023,"Me encantaron, súper ahorradoras de espacio, la tela viene como capitonada por dentro y me imagino que eso le ayuda para mantener el aroma de las prendas que guardes en ellas, sin duda las volveré a comprar y las recomiendo ampliamente para quienes ya no saben que hacer con tanto edredón y sábanas (para no maltratar un edredón matrimonial lo guardé sólo en una bolsita, cupo a la perfección y como las bolsitas son de tela, puedes doblar lo del espacio que sobre).",0,0
6BDAPGRYE,5,12 sep. 2023,"Son amplios y se ven buenos para lo que son: guardar edredones, ponerlos en un sitio y no tocarlos en mucho tiempo. Para un uso más constante ya no se ven muy prácticos.",0,0
6BDAPGRYE,5,07 sep. 2023,Muy buen artículo y lleno mis expectativas así como en calidad y precio.,0,0
6BDAPGRYE,5,06 sep. 2023,Buen material y calidad.,0,0
6BDAPGRYE,5,06 sep. 2023,"Están más grandes de lo que pensé. De las cobijas que tengo, caben hasta 2.",0,0
6BDAPGRYE,5,05 sep. 2023,"Producto bastante funcional, jamas tendra esa forma tan pareja ya que es tela y tratenlos con cuidado que se rompen de las agarraderas si pesa mucho,.",0,0
6BDAPGRYE,5,02 sep. 2023,"Para mí estay muy bien, funcionales, le caben muchas cosas, sí se sienten algo frágiles, y los cierres están pequeños y se siente algo frágiles, pero hasta ahora han funcionado muy bien, el color es bonito y el material se siente algo delgado pero resistente. Hasta el momento todo bien.",0,0
6BDAPGRYE,5,31 ago. 2023,"Muy útil para ahorrar el espacio, ahí metí sabanas y mochilas que no necesito y las coloque de bajo de la cama su calidad con muy malas pero realmente como es raro que las vaya a tocar no me importa realmente.",0,0
6BDAPGRYE,5,31 ago. 2023,No se puede pedir más por el precio.,0,0
6BDAPGRYE,5,30 ago. 2023,Súper amplias y de momento resistentes ni tuve que ocupar todas ya que su gran capacidad permite guardar todo.,0,0
6BDAPGRYE,5,29 ago. 2023,Excelente.,0,0
6BDAPGRYE,5,29 ago. 2023,Súper amplias.,0,0
6BDAPGRYE,5,28 ago. 2023,"Genial. Me ayudo a poner mis colchas ,sábanas. En orden. Me encanto.",0,0
6BDAPGRYE,5,27 ago. 2023,Me encantaron y muy amplias.,0,0
6BDAPGRYE,5,26 ago. 2023,Están súper amplias y se ven súper lindas son grande cistas las medidas son las correctas y están perfectas.,0,0
6BDAPGRYE,5,26 ago. 2023,Práctico y muy buen material.,0,0
6BDAPGRYE,5,24 ago. 2023,Buen producto.,0,0
6BDAPGRYE,5,23 ago. 2023,"Resistentes, con gran capacidad de almacenamiento, recomiendo para guardar ropa de cama, suéteres y cosas voluminosas.",0,0
6BDAPGRYE,5,22 ago. 2023,Excelente producto muy práctico.,0,0
6BDAPGRYE,5,21 ago. 2023,Bien.,0,0
6BDAPGRYE,5,20 ago. 2023,"Excelente producto, recomendable!! lo volveré a comprar.",0,0
6BDAPGRYE,5,17 ago. 2023,Excelente.,0,0
6BDAPGRYE,5,17 ago. 2023,Buen almacenaje y calidad!!!!.,0,0
6BDAPGRYE,5,16 ago. 2023,Excelente compra! cumple con todo lo descrito :d.,0,0
6BDAPGRYE,5,15 ago. 2023,Es un producto muy útil en casa.,0,0
6BDAPGRYE,5,14 ago. 2023,👍.,0,0
6BDAPGRYE,5,14 ago. 2023,Muy practicas!!! les cabe bastante ropa.,0,0
6BDAPGRYE,5,13 ago. 2023,"Cumple con las características, viene amplia la bolsa y se adaptan a lugares pequeños para su almacenamiento.",0,0
6BDAPGRYE,5,12 ago. 2023,Excelente.,0,0
6BDAPGRYE,5,12 ago. 2023,Muy practicos para guardar ropa. Muy buen material.,0,0
6BDAPGRYE,5,11 ago. 2023,Un poco más queque lo de lo que parece.,0,0
6BDAPGRYE,5,11 ago. 2023,"Excelente producto buenísimo muy bien fabricado, muy útil y exente precio.",0,0
6BDAPGRYE,5,10 ago. 2023,Están super padres y muy grandes las recomiendo mucho se ven elegantes por el color y son practicas.,0,0
6BDAPGRYE,5,09 ago. 2023,Buena relación entre precio y calidad.,0,0
6BDAPGRYE,5,08 ago. 2023,Ta' bueno👍. 🤓☝️.,0,0
6BDAPGRYE,5,07 ago. 2023,Súper prácticas.,0,0
6BDAPGRYE,5,03 ago. 2023,Super grandes y resistente!.,0,0
6BDAPGRYE,5,02 ago. 2023,Es lo que esperaba. Muy bien.,0,0
6BDAPGRYE,5,01 ago. 2023,"Buen producto para guardar ropa, sábanas, colchas, buen espacio, prácticas de cargar y resistentes.",0,0
6BDAPGRYE,5,01 ago. 2023,"Excelente calidad, amplias y muy útiles para el hogar.",0,0
6BDAPGRYE,5,31 jul. 2023,Excelente producto muy servicial ahorra espacio y tienen muy buen tamaño.,0,0
6BDAPGRYE,5,30 jul. 2023,"Súper resistentes y bonitas, muy prácticas.",0,0
6BDAPGRYE,5,29 jul. 2023,"Perfecto, realmente lo que necesitaba para organizar mi closet.",0,0
6BDAPGRYE,5,29 jul. 2023,De muy bueno calidad.,0,0
6BDAPGRYE,5,28 jul. 2023,Súper bueno y resistente.,0,0
6BDAPGRYE,5,27 jul. 2023,Muy buenas para su precio.,0,0
6BDAPGRYE,5,26 jul. 2023,Genial.,0,0
6BDAPGRYE,5,25 jul. 2023,Muy buen producto 👍.,0,0
6BDAPGRYE,5,25 jul. 2023,"Funcionan como se esperaba, son bolsas, no tienen estructura.",0,0
6BDAPGRYE,5,25 jul. 2023,"Muy bien producto, espaciosos y sirve perfectos para la ropa de cama y toallas.",0,0
6BDAPGRYE,5,21 jul. 2023,Tienen gran capacidad y mantienen todo ordenado.,0,0
6BDAPGRYE,5,20 jul. 2023,Super cómodas.,0,0
6BDAPGRYE,5,18 jul. 2023,Muy útil. Para guardar edredones individuales y matrimoniales.,0,0
6BDAPGRYE,5,17 jul. 2023,"Me encantaron,cumplen muy bien su funcionalidad.",0,0
6BDAPGRYE,5,17 jul. 2023,Sin palabras el tamaño y el materiel es justo con relacion al precio tiene gran capaciadad. Desventaja solo el cierre o ciper es muy sensillo tiende a salirse de las orillas pero nada que no soluciono un puntal de hilo.,0,0
6BDAPGRYE,5,17 jul. 2023,Ya van varios paquetes que compro y todos han salido muy bien.,0,0
6BDAPGRYE,5,14 jul. 2023,Uso regular nada nuevo.,0,0
6BDAPGRYE,5,12 jul. 2023,Muy bueno.,0,0
6BDAPGRYE,5,10 jul. 2023,"Buen producto , de buena calidad. Se recomienda!! y llega rápido.",0,0
6BDAPGRYE,5,10 jul. 2023,Excelente compra me encanto muy. Amplia.,0,0
6BDAPGRYE,5,09 jul. 2023,Muy bien cumple con mis necesidades.,0,0
6BDAPGRYE,5,09 jul. 2023,Justo lo q necesitaba para mi ropa de invierno y colchas q por falta de espacio no entran en el ropero.,0,0
6BDAPGRYE,5,07 jul. 2023,Si era lo que esperaba y mu gusto mucho.,0,0
6BDAPGRYE,5,05 jul. 2023,Muy prácticas.,0,0
6BDAPGRYE,5,04 jul. 2023,"Son enormes, les caben muchas cosas, es tela delagadita pero si resisten.",0,0
6BDAPGRYE,5,04 jul. 2023,"Pensé que las caras eran duras, sin embargo, al ir llenandolo toma su forma y es bastante fácil apilar una sobre otra sin temor a que se caigan.",0,0
6BDAPGRYE,5,02 jul. 2023,"Buen material, el cierre no está en el borde por lo que complica algo introducir las telas, excelente producto.",0,0
6BDAPGRYE,5,02 jul. 2023,"Buen material y muy buen tamaño, lo recomiendo… :).",0,0
6BDAPGRYE,5,02 jul. 2023,"Precio y calidad bueno, guardado de sabanas, bastante amplio , me encantaron ahorra espacio.",0,0
6BDAPGRYE,5,01 jul. 2023,Buen producto.,0,0
6BDAPGRYE,5,30 jun. 2023,"Me gusto, practico y funcional, un poco fragil pero si eres cuidadoso no pasa nada.",0,0
6BDAPGRYE,5,30 jun. 2023,Excelente me encantaron voy a comprar mas.,0,0
6BDAPGRYE,5,30 jun. 2023,Excelente son super resistentes muy amplias ahora ya tengo todo bien organizado 🤭.,0,0
6BDAPGRYE,5,28 jun. 2023,Cumple con lo esperado y son muy prácticas.,0,0
6BDAPGRYE,5,28 jun. 2023,Cumple con la descripcion.,0,0
6BDAPGRYE,5,28 jun. 2023,Excelente calidad de material. Son blandos pero muy buenos. Me gustaron por qué ahí guardo parte de mi ropa. Recomiendo ampliamente.,0,0
6BDAPGRYE,5,27 jun. 2023,Muy prácticos super espacio y a bien precio los recomiendo aún que el cierre está muy pequeño pero esta bien.,0,0
6BDAPGRYE,5,27 jun. 2023,Exelente.,0,0
6BDAPGRYE,5,24 jun. 2023,"Sentí el material muy delgado y el cierre muy frágil, pero por el precio está bien.",0,0
6BDAPGRYE,5,23 jun. 2023,"Muy lindas, solo que me gustaría que hubiera más grandes.",0,0
6BDAPGRYE,5,22 jun. 2023,"Son muy espaciosas y cumplen su función, sin embargo esperaba que fueran un poco más rígidas. Estoy contento con mi compra.",0,0
6BDAPGRYE,5,22 jun. 2023,"Perfectas para lo que necesitaba, muy buen tamaño y material acorde a lo que nos ofrecen, considero serán durables.",0,0
6BDAPGRYE,5,22 jun. 2023,"Me gustaron porque es buen tañamo y le entra mucha ropa, toallas o edredones.",0,0
6BDAPGRYE,5,21 jun. 2023,"Están amplias, aunque son delgadas y sencillas, me gustaron.",0,0
6BDAPGRYE,5,21 jun. 2023,"Excelente calidad y gran capacidad, me gustaron mucho.",0,0
6BDAPGRYE,5,20 jun. 2023,"Super práctico, y bien grande las bolsas cabe muy bien edredones.",0,0
6BDAPGRYE,5,20 jun. 2023,Muy prácticas y super bolsas donde puedo guardar bien mis colchas y chamarras.,0,0
6BDAPGRYE,5,19 jun. 2023,Buenas.,0,0
6BDAPGRYE,5,18 jun. 2023,Me encanta. Lo volveré a comprar.,0,0
6BDAPGRYE,5,17 jun. 2023,Muy buen producto. Buena relación costo beneficio. Práctico y espacioso.,0,0
6BDAPGRYE,5,14 jun. 2023,Super funcional. Al principio pensé que la tela y el cierre no resistirian el peso pero hasta el momento no se han roto y ninguno de los cierres se ha descompuesto. Vienen muy amplias para guardar cualquier cosa. Muy buen producto lo recomiendo.,0,0
6BDAPGRYE,5,13 jun. 2023,"Muy bien producto, tiene mucha capacidad y son de buen material, aparte q se ven bonitas.",0,0
6BDAPGRYE,5,13 jun. 2023,"Muy bien producto para guardar, cumple con su función.",0,0
6BDAPGRYE,5,12 jun. 2023,Buenísimo el tamaño grande y práctico por ese espacio transparente para poder hayar todo más facil.,0,0
6BDAPGRYE,5,11 jun. 2023,Muy prácticos para el almacenamiento.,0,0
6BDAPGRYE,5,11 jun. 2023,"Son de buena calidad,organizas muy bien tus cobijas.",0,0
6BDAPGRYE,5,09 jun. 2023,Las bolsas vienen grandes. Son de buen material.,0,0
6BDAPGRYE,5,09 jun. 2023,"Cumple con su función, vienen muy espaciosas para ropa.",0,0
6BDAPGRYE,5,08 jun. 2023,Super ahorras mucho espacio y sabes lo k tienes en cada bolsa por lo trasparente de enmedio.,0,0
6BDAPGRYE,5,07 jun. 2023,Muy prácticas.,0,0
6BDAPGRYE,5,07 jun. 2023,Muy padre lo recomiendo.,0,0
6BDAPGRYE,5,06 jun. 2023,"Para el precio superó mis espectativas, muy amplias, prácticas y fácil de usar.",0,0
6BDAPGRYE,5,05 jun. 2023,Es exactamente lo que se ve y me urgía más orden en mi closed.,0,0
6BDAPGRYE,5,04 jun. 2023,Excelente producto! recomendado.,0,0
6BDAPGRYE,5,03 jun. 2023,Demasiado grandes pero muy utiles.,0,0
6BDAPGRYE,5,01 jun. 2023,Mi producto m gusto muchisimo muy practicas y con gran capacidad.,0,0
6BDAPGRYE,5,29 may. 2023,"La verdad les cabe bastante ropa,, quedé muy complacida con elmproducto,, lo recomiendo mucho.",0,0
6BDAPGRYE,5,29 may. 2023,Excelente producto me gustaron grandes y prácticas para acomodar muy bien mi ropa de invierno y mis cobertores.,0,0
6BDAPGRYE,5,26 may. 2023,Se mira muy bien.,0,0
6BDAPGRYE,5,22 may. 2023,"Son muy prácticas, le camben varias sabanas y cobijas gruesas la verdad las recomiendo si tienes poco espacio y necesitas organizar todos tus cobertores.",0,0
6BDAPGRYE,5,22 may. 2023,Super bien justo lo que yo nesecitaba son de gran tamaño estoy encantada en las seis bolsas entro todo lo que tenía en diez bolsas de basura la verdad estoy contentisima.,0,0
6BDAPGRYE,5,22 may. 2023,Excelente producto.,0,0
6BDAPGRYE,5,21 may. 2023,"Es bastante bueno, me encantó, aunque solo le caben dos edredones pero luce muy bien, el cierre se ve frágil pero por el precio es muy buen producto.",0,0
6BDAPGRYE,5,21 may. 2023,"Les caben 2 cobertores individuales y 1 cobija sin romperse. Me gustaron mucho excepto que una de las bolsas traía la parte del plástico rota, fuera de eso todo muy bien, ya me han durado bastante.",0,0
6BDAPGRYE,5,19 may. 2023,Excelente.,0,0
6BDAPGRYE,5,15 may. 2023,Gracias.,0,0
6BDAPGRYE,5,15 may. 2023,"Fabulosas ; muy buen tamaño , bonitas y económicas. Sin duda las volvería a comprar.",0,0
6BDAPGRYE,5,15 may. 2023,"Muy buen producto, se deforma un poco al llenado pero es por falta de rigidez, es normal y sí les cabe bastante ropa.",0,0
6BDAPGRYE,5,14 may. 2023,Totalmente lo que se pública y me agradaron para lo que quería usarlas están super bien.,0,0
6BDAPGRYE,5,14 may. 2023,Bueno buen material 👍 se acomodan alo nesesario.,0,0
6BDAPGRYE,5,13 may. 2023,Adecuado para el precio calidad.,0,0
6BDAPGRYE,5,09 may. 2023,"Exelente producto, me gustó mucho tiene una gran capacidad de almacenaje, eso sí cuídate mucho los cierres porque si se ven algo frágiles, pero de ahí en fuera si la recomiendo mucho.",0,0
6BDAPGRYE,5,06 may. 2023,Me encantaron.,0,0
6BDAPGRYE,5,06 may. 2023,Muy buen material.,0,0
6BDAPGRYE,5,04 may. 2023,"Buen tamaño, material. Me encantaron , las volvería a comprar.",0,0
6BDAPGRYE,5,04 may. 2023,"Me gustó el producto, las bolsas vienen amplias y de buen material.",0,0
6BDAPGRYE,5,28 abr. 2023,Excelente producto.,0,0
6BDAPGRYE,5,26 abr. 2023,"No son rígidas, son bolsas en sí básicamente pero son lo que esperaba están bonitas y son funcionales.",0,0
6BDAPGRYE,5,25 abr. 2023,Excelentes en tamaño y material. Creo que podrían mejorar los sierres que son muy sencillos pero en general muy buenas.,0,0
6BDAPGRYE,5,25 abr. 2023,"Buen producto, muy recomendable.",0,0
6BDAPGRYE,5,24 abr. 2023,Ya las ocupe y si tiene buen tamaño le cabe muchas cosas.,0,0
6BDAPGRYE,5,24 abr. 2023,"Es bueno, quedó perfecto las medidas son correctas.",0,0
6BDAPGRYE,5,23 abr. 2023,Esta excelente amplea.,0,0
6BDAPGRYE,5,22 abr. 2023,"Es funcional, si hay que tratarlo con cuidado pero la verdad muy amplio y se ve bien acomodado.",0,0
6BDAPGRYE,5,21 abr. 2023,Muy útiles dependiendo del peso y como las agarres será su durabilidad están bien para el precio obviamente es una opción económica.,0,0
6BDAPGRYE,5,21 abr. 2023,"Está bien, me gustaron, y eso que soy uy exigente, solo no le metan cosas pesadas, tratenlas con amor.",0,0
6BDAPGRYE,5,21 abr. 2023,De buen tamaño caben dos cobijas o dos cobertores en cada uno lo recomiendo para ahorrar espacio.,0,0
6BDAPGRYE,5,20 abr. 2023,Manifico para el espacio q tengo.,0,0
6BDAPGRYE,5,18 abr. 2023,"Las bolsas están súper grandes, cabe mucha ropa, de verdad muy recomendable para guardar colchas o muchos productos.",0,0
6BDAPGRYE,5,18 abr. 2023,"Muy bueno, las creí más pequeñas pero nooo! están de un buen tamaño! le caben varias cosas, como los edredones, 2-3 dependiendo lo grueso que estén pero muy bien todo, son un poco delgadas pero resistentes! el precio y la calidad es buena! lo recomienda.",0,0
6BDAPGRYE,5,15 abr. 2023,"Es muy grande, le caben muchas cosas y todo está perfectamente organizado, solo un detalle el cierre manejarlo con cuidado. Es frágil y se me rompió uno por la desesperación de cerrarlo rápido lo cosi y quedó bien.",0,0
6BDAPGRYE,5,11 abr. 2023,Muy buenas las bolsas.,0,0
6BDAPGRYE,5,11 abr. 2023,Todo muy bien gracias.,0,0
6BDAPGRYE,5,10 abr. 2023,"Están super bien, reconendables.",0,0
6BDAPGRYE,5,10 abr. 2023,Para guardar cosas y ropa esta bien ya que le cabe bastantes cosas lo malo es que esta muy frágil del cierre y de la agarradera y se rompe fácilmente.,0,0
6BDAPGRYE,5,07 abr. 2023,"Mi producto me pareció increíble, es muy eficiente y de muy buena calidad.",0,0
6BDAPGRYE,5,06 abr. 2023,"Excelente,le caben varias cobijas.",0,0
6BDAPGRYE,5,06 abr. 2023,"Me pareció buen producto, es igual a cómo se muestra en las imágenes, para lo que se requería quedo excelente.",0,0
6BDAPGRYE,5,05 abr. 2023,"Excelente producto, recomendado, por el precio, material de calidad y cumple con el propósito de guardado. Gracias!.",0,0
6BDAPGRYE,5,02 abr. 2023,Están muy amplias me gustaron mucho.,0,0
6BDAPGRYE,5,01 abr. 2023,Están hermosas y d evien tamaño.,0,0
6BDAPGRYE,5,28 mar. 2023,"Excelente producto, cumple su funcionalidad.",0,0
6BDAPGRYE,5,28 mar. 2023,"Muy amplias y al parecer resistentes, precio/ calidad excelente.",0,0
6BDAPGRYE,5,27 mar. 2023,De entrada parecían muy delgaditas pero ya que empiezas a meter cosas son resistentes y muy funcionales muy recomendable.,0,0
6BDAPGRYE,5,26 mar. 2023,Las ame son grandes y de verdad que si te ayudan un buen en organizar tus cosas las ame.,0,0
6BDAPGRYE,5,26 mar. 2023,"Excelente tal como lo muestran, buen tamaño, gracias.",0,0
6BDAPGRYE,5,20 mar. 2023,Me encantan!! los cierres poco débiles pero si no se fuerzan resistirán. La verdad son prácticas y lindas.,0,0
6BDAPGRYE,5,17 mar. 2023,Excelente.,0,0
6BDAPGRYE,5,14 mar. 2023,Muy bueno.,0,0
6BDAPGRYE,5,14 mar. 2023,Excelente tamaño y buen irgwnizador.,0,0
6BDAPGRYE,5,13 mar. 2023,Me gustó su tamaño ya que puedo almacenar varias sábanas.,0,0
6BDAPGRYE,5,12 mar. 2023,Excelentes muy prácticas.,0,0
6BDAPGRYE,5,12 mar. 2023,Bueno y eficiente es lo que buscaba.,0,0
6BDAPGRYE,5,10 mar. 2023,Excelente tamaño para edredones. El material es resitente a la vez de flexible.,0,0
6BDAPGRYE,5,09 mar. 2023,Me encantaron.,0,0
6BDAPGRYE,5,09 mar. 2023,"Muy buenas, yo pensé que eran pequeñas pero están amplias y le cabe varias colchas, las recomiendo. 👍🏻.",0,0
6BDAPGRYE,5,07 mar. 2023,"Bueno, sería bueno tuviera una base más firme.",0,0
6BDAPGRYE,5,02 mar. 2023,Mi producto me pareció excelente.,0,0
6BDAPGRYE,5,02 mar. 2023,Me gusto viene de buena calidad recomendado.,0,0
6BDAPGRYE,5,28 feb. 2023,"Creí que estarían más pequeñas, el tamaño es perfecto y la resistencia igual.",0,0
6BDAPGRYE,5,27 feb. 2023,Me pareció de buena calidad.,0,0
6BDAPGRYE,5,26 feb. 2023,Justo lo que necesitaba.,0,0
6BDAPGRYE,5,23 feb. 2023,"Bonitas, resistentes y amplias.",0,0
6BDAPGRYE,5,23 feb. 2023,"El producto es excelente, muy buen tamaño.",0,0
6BDAPGRYE,5,21 feb. 2023,Muy muy práctico y excelente sin queja.,0,0
6BDAPGRYE,5,20 feb. 2023,"Me gusto mucho el producto ahorra espacio, le caben bastantes cosas.",0,0
6BDAPGRYE,5,20 feb. 2023,Muy bueno.,0,0
6BDAPGRYE,5,20 feb. 2023,"Excelente tienen muy buen espacio para almacenar ropa colchas edredó, son delgados pero aguantan bien ya con la ropa dentro agarra figura.",0,0
6BDAPGRYE,5,19 feb. 2023,Excelente calidad.,0,0
6BDAPGRYE,5,18 feb. 2023,Muy bueno.,0,0
6BDAPGRYE,5,17 feb. 2023,Super funcionales y espaciosas.,0,0
6BDAPGRYE,5,14 feb. 2023,Resistentes y de tamaño medio. Me gustaron.,0,0
6BDAPGRYE,5,13 feb. 2023,"Estan bien en tamaño, solo hay que tener cuidado porque la tela es un poco delgada pero me han servido muy bien.",0,0
6BDAPGRYE,5,11 feb. 2023,Muy excelente producto resistente.,0,0
6BDAPGRYE,5,03 feb. 2023,"Me encanto, viene con buen espacio y la verdad se ve más ordenado todo y me sobro espacio en mi closet.",0,0
6BDAPGRYE,5,27 ene. 2023,Bastante funcional.,0,0
