id,Calificación,Fecha,Reseña,Cantidad de imagenes,Utilidad
CDJÁMT,5,05 jun. 2023,"Es hermosoooo, me encanto.",0,0
CDJÁMT,5,31 may. 2023,"Esta muy bien hecho, el marco de madera que tiene por detrás se siente muy duradero, calidad-precio.",0,0
CDJÁMT,4,17 abr. 2023,"Excelente la calidad , solo que no se como colgarlo.",1,2
CDJÁMT,3,23 jul. 2023,"Fue un personalizado, lo único que no me latió fue que no hubo cuidado al momento de pasar los datos del artista, hay datos erróneos por ejemplo en el nombre y la disquera (tiësto y black hole recordings), por lo demás, ok.",1,1
RDDCBBYLD,5,09 ago. 2023,"Es un reloj excelente, me gustó mucho ya que tiene varias funciones en un mismo aparato. Es un reloj digital muy moderno ya sea para la habitación o el escritorio de trabajo, también tiene la función de radio y bocina para escuchar música desde el celular vinculándolo vía bluetooth o insertando una tarjeta tf. También tiene entrada para audio y para recargar el reloj con un cable usb. Se pueden establecer dos alarmas, contestar llamadas y checar la temperatura ambiental. La pantalla sirve de espejo y en ella se aprecian tanto la hora como, la temperatura, los íconos de las alarmas, el bluetooth, el radio, etcétera, iluminados para mejor apreciación de día y de noche, y se puede elegir la intensidad de la luz. En la parte trasera del reloj está la bocina y una base retráctil en la parte interior para poner el celular mientras se ve algún vídeo o reproducir música, la cual se escucha muy bien y alcanza un volúmen alto.",3,5
RDDCBBYLD,5,07 ago. 2023,Se lo compré a mi hija ya que ella se va a trabajar y la verdad hay veces que le cuesta pararse temprano y encontré este. Reloj despertando digital acon bocina que le encanta ya que suena muy bien además su material es muy bueno ya que alumbran súper bien con este despertando se despierta súper rápido ya que su sonido es muy bueno.,2,3
RDDCBBYLD,5,08 ago. 2023,"El reloj esta muy bonito, es muy minimalista, la alarma tiene diferentes sonidos, tiene dos luces led a las orillas las cuales alumbran bastante bien, tiene diferentes funciones muy útiles ya que no solo es un reloj también es bocina y alcanza un buen volumen,.",1,1
RDDCBBYLD,5,22 sep. 2023,"Muy bien 👍 el producto solo no puedo configurar la alarma, busque tutoriales y nada.",0,1
RDDCBBYLD,5,02 jun. 2022,Me parece una excelente compra. El sonido de la bocina es muy bueno. Por lo q vale. Pero en verdad se escucha muy bien y tiene diferentes funciones. Lámpara bocina alarma te sirve para sostener tu cel en fin es muy buen producto.,0,1
RDDCBBYLD,5,06 sep. 2022,Hasta el momento parece ser lo que promete. El producto se ve de buena calidad y puedes conectarlo a google home.,0,1
RDDCBBYLD,5,09 ago. 2023,"Es una bocina muy buena, con un material que se ve duradero. Se puede conectar fácilmente a tu celular y escuchar las canciones que te requieras, fácil de usar y también puedes cambiar las canciones desde la bocina, aparte de ser una bocina también es un reloj con alarma y semilla de utilizar para tener una alerta al momento que uno lo programe,por las noches también se puede utilizar como lámpara de mesa. La verdad lo recomiendo 100%.",3,0
RDDCBBYLD,5,21 sep. 2023,Está increíble. Superó mis expectativas. Muy fácil de configurar y al conectar el bt tiene un muy buen audio. No sé cuánto dure la batería pues a penas lo encendí. Claro que lo recomiendo. Por el precio es un súper producto.,2,0
RDDCBBYLD,5,19 sep. 2023,,1,0
RDDCBBYLD,5,23 ago. 2023,Es estupendoo.,0,0
RDDCBBYLD,5,04 ago. 2023,"Buen producto,.",0,0
RDDCBBYLD,5,04 jul. 2023,Muy bonito.,0,0
RDDCBBYLD,5,24 jun. 2023,Bueno y lo volvería a comprar y lo recomiendo mucho le tarda mucho la pila.,0,0
RDDCBBYLD,5,06 jun. 2023,"Excelente producto, incluye grabadora solo necesita la memoria para grabar.",0,0
RDDCBBYLD,5,03 jun. 2023,Me encanto.,0,0
RDDCBBYLD,5,14 may. 2023,Ok.,0,0
RDDCBBYLD,5,27 abr. 2023,Excelente.,0,0
RDDCBBYLD,5,05 mar. 2023,Bueno.,0,0
RDDCBBYLD,5,22 feb. 2023,Cumple con todo lo prometido. Recomendable.,0,0
RDDCBBYLD,5,17 feb. 2023,"Está muy bonito, muy funcional, recargable se escucha bien y tiene todo lo que se describe a un precio realmente barato, excelente producto.",0,0
RDDCBBYLD,5,09 feb. 2023,Muy buen producto a un precio justo. Funciona muy bien con bluetooth y la luz de noche es muy útil. Super recomendado.,0,0
RDDCBBYLD,5,08 feb. 2023,Excelente.,0,0
RDDCBBYLD,5,06 feb. 2023,"Es un buen producto, pero el problema es la batería. Usando el reloj (sin otras funciones), dura 3 días. Para mi, no hay problema.",0,0
RDDCBBYLD,5,02 feb. 2023,Excelente articulo.,0,0
RDDCBBYLD,5,30 ene. 2023,Muy buen producto.,0,0
RDDCBBYLD,5,26 ene. 2023,Buen producto y practico gracias.,0,0
RDDCBBYLD,5,09 ene. 2023,👍.,0,0
RDDCBBYLD,5,05 ene. 2023,"Muy buen producto, el manual es muy general deben detallarlo para poder aprovechar las funciones del reloj.",0,0
RDDCBBYLD,5,03 nov. 2022,"Funciona exelente , un buen sonido y buen material.",0,0
RDDCBBYLD,5,03 oct. 2022,Cumple correctamente su objetivo. 100% recomendado.,0,0
RDDCBBYLD,5,23 sep. 2022,Muy buen producto. Supero mis espectativas. Altamente recomendable. Cumple todas sus funciones.,0,0
RDDCBBYLD,5,17 sep. 2023,Buen producto cumple con lo especificado.,0,0
RDDCBBYLD,4,24 jul. 2022,Buen producto el único detalle que yo ocupo y no lo tiene es que no se puede programar a 12 hrs solo en 24 por lo demás buen producto.,0,4
RDDCBBYLD,4,22 sep. 2023,Hasta el momento todo bien.,0,0
RDDCBBYLD,4,19 sep. 2023,Me gustó pero el volumen es bajo.,0,0
RDDCBBYLD,4,15 ago. 2023,"Por el precio es un producto que cumple con las espectativas, en gral. Buen producto, aunque se escuchan algo bajo sus bocinas.",0,0
RDDCBBYLD,4,10 ago. 2023,Por el precio es lo razonable.,0,0
RDDCBBYLD,4,21 jun. 2023,"Un buen producto, aunque se descarga muy rápido.",0,0
RDDCBBYLD,4,02 mar. 2023,"Bien funciona correcto la bocina poco la uso muy raro, solo para ver la hora, marca la temperatura, el termómetro es muy serca comparado con otros, le dura muy poco la pila dos días aproximadamente sin usar solo para ver la hora, luz aceptable, acabado espejo muy bueno.",0,0
RDDCBBYLD,4,07 feb. 2023,Funciona bien pero el cable del reloj no me funciona pero con otro si carga al 100.,0,0
RDDCBBYLD,4,01 feb. 2023,Es un buen producto sólo que el sonido del despertador no se escucha fuerte.,0,0
RDDCBBYLD,4,23 ene. 2023,"Muy buen producto, muy funcional, se escucha bastante bien para ser tan pequeño, batalle un poco al inicio para encontrar sus funciones.",0,0
RDDCBBYLD,4,17 ene. 2023,El reloj bien y la bocina. Pero los botones al poco tiempo empezaron a fallar y no agarraban su función.,0,0
RDDCBBYLD,4,21 dic. 2022,"Tal como lo describen, potente bocina.",0,0
RDDCBBYLD,4,26 sep. 2022,"Muy bueno para su precio, asta ahorita no me ah fallado.",0,0
RDDCBBYLD,3,04 sep. 2023,No trae am pm eso confunde por qué lo quería para mis hijos es difícil de usar por el cambio de idioma.,0,0
RDDCBBYLD,3,10 jul. 2023,No le entiendo mucho para poner despertado y le dura poco la pila.,0,0
RDDCBBYLD,3,29 jun. 2023,La pila dura muy poco muy difícil de configurar sin instrucciones.,0,0
RDDCBBYLD,3,11 may. 2023,"Me gusta, esta lindo, pero la carga no dura mucho, el cable de conexión a la luz en muy corto mide como 15 cms por lo que no puedo tenerlo conectado todo el tiempo, deberían poner un cable más largo.",0,0
RDDCBBYLD,3,21 ene. 2023,Hola el despertador está bien si cumple con la funciones solo un detalle q para configurar esta muy difícil se batalla mucho las instrucciones no ayudan mucho.,0,0
RDDCBBYLD,3,10 jun. 2023,No lo sé programar y me gustaría que marcará las 12 horas y no las 24. Funciona aunque un poco complicado para mi.,0,0
RDDCBBYLD,2,17 feb. 2023,"No se puede pedir mucho por lo que se paga por el , la bateria es una decepcion total , no compraria otro , con esos 2 que pedi, tuve !.",0,0
RDDCBBYLD,1,17 jul. 2022,"Es un producto de baja calidad, obvio el precio lo dice desde el principio ya que es de los más baratos en ml pero lo más criticable es que debería tener un volumen más alto en las alarmas, los instructivos solo vienen en chino e ingles y es una lata configurarlo la primera vez, la combinación de botones para un comando u otro es absurdo me arrepiento de mi compra. Lo q si me gustó fue el audio suena bien por eso me lo quedo a ver cuánto dura.",0,3
RDDCBBYLD,1,05 oct. 2022,"Muy malo, el despertador difícil de ajustar y no trae manual lo único bueno es el número grande, no trae antena para radio etc.",0,5
RDDCBBYLD,1,24 sep. 2023,No puedo poner la hora.,0,0
RDDCBBYLD,1,16 sep. 2023,Es muy corriente el producto.,0,0
RDDCBBYLD,1,09 sep. 2023,"Es difícil de programar, no tiene instructivo claro, tienes que adivinarle a los botones y si se apaga debes volver a programar, lo deje de usar ya que no pude volver a poner la hora.",0,0
RDDCBBYLD,1,08 jul. 2023,Nunca lo hice funcionar.,0,0
RDDCBBYLD,1,14 feb. 2023,Se descarga no le dura ninguna hora la carga de la batería lo cargo y se apaga en menos de una hora.,0,0
ALTCBYLPD,5,05 sep. 2023,"Muy lindo , es un poco pequeño , pero me encanto.",0,0
CBPV2CLO,5,15 abr. 2023,"Hermosas cortinas, igual que se muestran en las fotos, disminuyen mucho la entrada de luz, medida esperada. Y excelente el precio por el producto.",2,4
CBPV2CLO,5,08 ago. 2023,"Las volvería a comprar , buen precio, cumple la descripción , luce bien y oscurece considerablemente y minimiza la temperatura de la habitación.",1,1
CBPV2CLO,5,07 ago. 2023,"No pensé que fueran tan cortas, pero al final lucen muy bien.",0,1
CBPV2CLO,5,15 ago. 2023,"Para el precio es un excelente producto. Pensé que sería de mala calidad, pero la tela se siente muy suave y se ve muy linda una vez puesta. El único detalle es que me hubiera gustado que fuera un poco más ancha.",1,0
CBPV2CLO,5,25 sep. 2023,Me gustaron mucho igual q las fotos gracias.,0,0
CBPV2CLO,5,23 sep. 2023,Muy bonitas.,0,0
CBPV2CLO,5,23 sep. 2023,"De buena calidad,bloquea por completo la luz del sol,le encantó a mi esposa,compraría de nuevo sin dudarlo.",0,0
CBPV2CLO,5,22 sep. 2023,Me encantaron las recomiendo no deja que entren los rayos del sol.,0,0
CBPV2CLO,5,21 sep. 2023,Excelente producto. Buena calidad y presentación.,0,0
CBPV2CLO,5,20 sep. 2023,Muy buen material biene gruesas y muy bonitas.,0,0
CBPV2CLO,5,20 sep. 2023,"Excelente compra muy bueno,bonito y baratas las recomiendo al 1000.",0,0
CBPV2CLO,5,16 sep. 2023,"Muy bonito, si bloquea la luz. Lo recomiendo.",0,0
CBPV2CLO,5,15 sep. 2023,Me gusto mucho exelente calidad.,0,0
CBPV2CLO,5,14 sep. 2023,Muy buenas cortinas.,0,0
CBPV2CLO,5,09 sep. 2023,Definitivamente lo recomiendo y lo volveria a comprar es una cortina muy muy bonita.,0,0
CBPV2CLO,5,06 sep. 2023,Bueno aunq las medidas al colocarlas son menores a las establecidas.,0,0
CBPV2CLO,5,04 sep. 2023,Muy bonitas.,0,0
CBPV2CLO,5,01 sep. 2023,"De maravilla, luce muy bonita, excelente textura y materiales.",0,0
CBPV2CLO,5,31 ago. 2023,"Excelentes cortinas de calidad, cubren muy bien del sol y están muy bonitas!!.",0,0
CBPV2CLO,5,29 ago. 2023,Muy buenas cortinas superó mis espectativas son mucho mejor de lo que esperé.,0,0
CBPV2CLO,5,29 ago. 2023,Excelente producto.,0,0
CBPV2CLO,5,28 ago. 2023,Muy bonitas pero muy pequeñas quedó al ras de mi ventana.,0,0
CBPV2CLO,5,27 ago. 2023,Tal cuál se ve en las imágenes.,0,0
CBPV2CLO,5,25 ago. 2023,Están hermosas.,0,0
CBPV2CLO,5,25 ago. 2023,Me encantaron realmente tapa la luz el material de muy buena calidad diseño muy bonito.,0,0
CBPV2CLO,5,23 ago. 2023,Excelente la tela.,0,0
CBPV2CLO,5,23 ago. 2023,Excelente buscaba algo así y esto me ha ayudado mucho para esta época de calor.,0,0
CBPV2CLO,5,23 ago. 2023,Están hermosas!!! las super recomiendo.,0,0
CBPV2CLO,5,18 ago. 2023,Excelente la luz no pasa. Me encantó ❤️.,0,0
CBPV2CLO,5,17 ago. 2023,"Excelente producto , no deja pasar la luz ,fáciles de poner muy prácticas, me gustó.",0,0
CBPV2CLO,5,15 ago. 2023,Muy buen producto y cumple con la calidad.,0,0
CBPV2CLO,5,11 ago. 2023,Excelente producto y muy económico y de buena calidad la verdad me encantaron.,0,0
CBPV2CLO,5,11 ago. 2023,Muy bonita la volveria a comprar.,0,0
CBPV2CLO,5,11 ago. 2023,"Excelente apariencia, el grosor de la tela está muy bien,.",0,0
CBPV2CLO,5,07 ago. 2023,"Se ven muy bien ya puestas, lo unico q si le agregaria seria lo q trae cmo lazo viniera pegado para q no se perdieran, de hay todo excelente.",0,0
CBPV2CLO,5,06 ago. 2023,Muy bonita.,0,0
CBPV2CLO,5,05 ago. 2023,"Buena tela ,, no deja pasar la claridad, me gusta 👍.",0,0
CBPV2CLO,5,03 ago. 2023,"Muy bonitas me encantaron, se ven muy elegantes.",0,0
CBPV2CLO,5,31 jul. 2023,Buen precio y calidad.,0,0
CBPV2CLO,5,31 jul. 2023,Super 👌👌 m encantaron ❣️.,0,0
CBPV2CLO,5,25 jul. 2023,"Me pareció linda la tela y el estampado le da un toque de elegancia. Solo la sentí un poco cortas de lo ancho pero casi son perfectas, gracias.",0,0
CBPV2CLO,5,23 jul. 2023,Mi producto está exelente.,0,0
CBPV2CLO,5,14 jul. 2023,Excelente es 100% blackout las recomiendo.,0,0
CBPV2CLO,5,10 jul. 2023,"Exelente muy contento, buen material y tal como se ven en la imagen.",0,0
CBPV2CLO,5,10 jul. 2023,"Excelente precio y no pasa nada de luz por ellas, el diseño esta bonito y el material es muy agradable al tacto, volvería a comprarlas.",0,0
CBPV2CLO,5,09 jul. 2023,"Muy bonita cortina y de buen material para el precio, si cumple su función blackout.",0,0
CBPV2CLO,5,06 jul. 2023,"Preciosas, color chocolate quedaron hermosas y combinan perfecto, fue una buena compra y definitivamente compraré nuevamente.",0,0
CBPV2CLO,5,05 jul. 2023,Muy bien.,0,0
CBPV2CLO,5,25 jun. 2023,Buena calidad.,0,0
CBPV2CLO,5,25 jun. 2023,"Muy bien, y bueno para el precio.",0,0
CBPV2CLO,5,21 jun. 2023,"Realmente me sorprendió su calidad, son muy buenas, la tela muy linda, suave, gruesa y no deja pasar la luz, 100% recomendables.",0,0
CBPV2CLO,5,17 jun. 2023,Muy buena calidad.,0,0
CBPV2CLO,5,16 jun. 2023,"Excelente d el mejor calidad , muy bonita, aislamiento de luz excelente.",0,0
CBPV2CLO,5,14 jun. 2023,De buena calidad.,0,0
CBPV2CLO,5,03 jun. 2023,"Me gustan mucho ,las recomiendo.",0,0
CBPV2CLO,5,22 may. 2023,Exelente.,0,0
CBPV2CLO,5,02 may. 2023,"La cortina viene de muy buena calidad, es suave y tapa la luz del sol.",0,0
CBPV2CLO,5,26 abr. 2023,Hermosas. Aunque pensé que eran un poco más largas. Las recomiendo se ven muy elegantes. Gracias!.,0,0
CBPV2CLO,5,23 abr. 2023,Excelente calidad para el precio me encantaron.,0,0
CBPV2CLO,5,21 abr. 2023,"Buen material, la decoración es plateada y brilla, le he pasado la plancha sin problema, si volvería a comprar.",0,0
CBPV2CLO,5,19 abr. 2023,"Excelente tela, es ideal, no entra la luz tan fácil, la recomiendo 👍.",0,0
CBPV2CLO,5,17 abr. 2023,"Buen grosor y diseño, me gustaron bastante y para el precio pues estan mas que bien.",0,0
CBPV2CLO,5,11 abr. 2023,"Muy lindas y si son contra luz, son perfectas. 🤩.",0,0
CBPV2CLO,4,08 abr. 2023,Bueno lo recomiendo.,0,2
CBPV2CLO,4,31 ago. 2023,Lo único q viene más chicas.,0,0
CBPV2CLO,4,23 jul. 2023,Me parecio buen producto y de calidad acorde al precio.,0,0
CBPV2CLO,1,11 ago. 2023,Malisimo.,0,0
CSL3LNDF3,5,10 jul. 2023,Están hermosas ya tengo de todos los colores.,0,0
CSL3LNDF3,4,03 sep. 2023,Muy bonitas 😍.,0,0
CSL3LNDF3,3,23 sep. 2023,"Esta bien el producto, si enciende, el precio me parece justo sin embargo el color no es morado diría que es lila casi blanco.",0,0
CDSWDYHLT,5,07 feb. 2023,"Esta muy bien echo la calidad del color muy bien , excelente cuadro.",0,2
CDSWDYHLT,5,13 abr. 2022,"Me encanto el cuadro , esta bien definido , se ve super elegante , lo ame desde el primer momento. Trae una bolsa de proteccion , sin duda compraria otro mas pra mi o para regalo.",0,2
CDSWDYHLT,5,22 feb. 2023,"Está súper bonito, para regalar se ve precioso, y como bien dicen te saca del apuro, se ve estético e idéntico a la imagen, me gustó muchísimo!!!.",0,1
CDSWDYHLT,5,13 feb. 2023,De muy buena calidad.,0,1
CDSWDYHLT,5,06 feb. 2023,Excelente. Sería mejor si fueran de pintura fluorescente para que brillen con la luz. Saludos.,0,1
CDSWDYHLT,5,23 jun. 2022,Hermoso fue un regalo y le encantó.,0,1
CDSWDYHLT,5,22 oct. 2021,De maravilla es lo que esperaba.,0,1
CDSWDYHLT,5,22 sep. 2023,De excelente calidad y con un foco rgb se ven loquisimos los colores.,0,0
CDSWDYHLT,5,02 sep. 2023,"Exelente, la imagen se ve bien está perfecto para adornar una habitación.",0,0
CDSWDYHLT,5,26 ago. 2023,Muy bonitos.,0,0
CDSWDYHLT,5,24 jul. 2023,Queda genial.,0,0
CDSWDYHLT,5,10 jul. 2023,Exelente se ve muy bien da un toque diferente.,0,0
CDSWDYHLT,5,07 jul. 2023,No le tomé foto pero la verdad es que tiene un tamaño adecuado y está muy muy bonito me encantó 😊💐 muy contenta con la compra y venía en perfectas condiciones.,0,0
CDSWDYHLT,5,06 jul. 2023,"Me encantaron , están perfectos para decorar una pared llena de cuadros con estos diseños.",0,0
CDSWDYHLT,5,19 jun. 2023,"Muy buen cuadro, si vale la pena.",0,0
CDSWDYHLT,5,13 jun. 2023,Se ve padre.,0,0
CDSWDYHLT,5,07 may. 2023,"Está chido la verdad, es fiel a lo que vienen en las imágenes que se muestran.",0,0
CDSWDYHLT,5,07 feb. 2023,Fue un regalo pero si es algo bastante sencillo y genial que te saca de un apuro.,0,0
CDSWDYHLT,4,01 mar. 2023,Ta bonito.,0,1
CDSWDYHLT,4,07 dic. 2022,"Me gustó, aunque luciría más con una capa de barniz brillante, relación precio-calidad 100 % buena.",0,1
CDSWDYHLT,4,18 jul. 2023,"4. 5/5. Es un cuadro muy bueno, volvería a comprarlo.",0,0
CDSWDYHLT,4,03 abr. 2023,"El producto se ve bien, el único inconveniente, que su envoltura fue muy sencilla con el riesgo de sufrir algún daño en su trayecto, solo papel celofán y bolsa de paquetería.",0,0
CDSWDYHLT,4,16 mar. 2022,"Me gustó, aunque el que tengo de darth vader y de un stormtrooper tienen un acabado más brillante lo cuál hace que resalten los colores.",0,0
CDSWDYHLT,3,03 jun. 2023,Está bien aunque algo borrosa la imagen del cuadro.,0,0
CDDICGDP1P,5,29 mar. 2023,"Me gusto mucho, la calidad es buena y el material resistente, no se transparenta. Es lo que buscaba.",0,1
CDDICGDP1P,5,11 feb. 2023,"Excelente calidad, me gusta que se ve elegante.",0,1
CDDICGDP1P,5,23 sep. 2023,Buen producto.,0,0
CDDICGDP1P,5,20 sep. 2023,"Muy bonita , me gustó mucho el material se ve bien.",0,0
CDDICGDP1P,5,19 sep. 2023,"Para el precio está muy bien, no es tan delgada, se ve resistente.",0,0
CDDICGDP1P,5,16 sep. 2023,Excelente.,0,0
CDDICGDP1P,5,10 sep. 2023,Fiel a la imagen.,0,0
CDDICGDP1P,5,09 sep. 2023,Esta padrisima !!!!.,0,0
CDDICGDP1P,5,07 sep. 2023,"La verdad el material se siente bien, no es súper delgado, los orificios para los ganchos vienen con arillos así que ve se resistente.",0,0
CDDICGDP1P,5,05 sep. 2023,"Muy bueno, cumple c0n su propósito.",0,0
CDDICGDP1P,5,01 sep. 2023,Bueno producto.,0,0
CDDICGDP1P,5,27 ago. 2023,👏🏻👏🏻.,0,0
CDDICGDP1P,5,18 ago. 2023,"Muy bonito, es largo y por ende tuve que subir más el tubo , pero le dio otra vista al baño.",0,0
CDDICGDP1P,5,08 ago. 2023,Me gustó mucho.,0,0
CDDICGDP1P,5,18 feb. 2023,Me gustó mucho muy bonita y de buen material. Así como se ve en la imagen aparte no se transparenta sin duda la volvería a comprar.,0,0
CDDICGDP1P,5,11 feb. 2023,"Muy bonita, gruesa y muy alta me encantó.",0,0
CDDICGDP1P,4,15 ago. 2023,"Es bonita, básica!.",0,0
CDDICGDP1P,4,03 feb. 2023,"Perfectamente funcional,.",0,0
CDDICGDP1P,3,02 sep. 2023,Es plastico y no tela.,0,0
JCDTLTS2P,5,13 feb. 2023,"Muy bonitas, a pesar de que trasparentan, de afuera hacia adentro no se ve ,.",1,15
JCDTLTS2P,5,06 ene. 2023,Buena calidad y elegantes son algo largas.,0,6
JCDTLTS2P,5,11 may. 2023,,1,4
JCDTLTS2P,5,18 jun. 2023,Pensé que serían más translúcidas pero fueron perfectas.,1,3
JCDTLTS2P,5,10 feb. 2023,Tal cual dice la tela excelente producto.,0,2
JCDTLTS2P,5,31 dic. 2022,"El producto me pareció de buena calidad, las cortinas transparentan y yo las buscaba así, así que estoy satisfecha.",0,2
JCDTLTS2P,5,25 may. 2023,"Buen producto,.",0,1
JCDTLTS2P,5,23 may. 2023,Muy prácticas.,0,1
JCDTLTS2P,5,20 may. 2023,Super buenas. La verdad quedaron muy bien y no son tan tan trasparentes me gustaron.,0,1
JCDTLTS2P,5,20 may. 2023,Excelente producto y facil instalacion!.,0,1
JCDTLTS2P,5,04 may. 2023,Buen producto.,0,1
JCDTLTS2P,5,25 abr. 2023,Justo lo que estaba buscando para mi casa. Lo recomiendo.,0,1
JCDTLTS2P,5,06 abr. 2023,Justo el complemento que necesitaba para mis cortinas de sala comedor. Excelente calidad.,0,1
JCDTLTS2P,5,09 mar. 2023,Cumple con lo q ofrece.,0,1
JCDTLTS2P,5,28 feb. 2023,Bueno en general. Por el sistema de producción puede traer pequeños hilos sueltos de la costura. Pero en general bien! si es un punto entre traslúcido y transparente pero es normal por el tipo de tela. Cumple su función decorativa y para no perder luz en la habitación. La relación general del costo y calidad de producto es buena.,0,1
JCDTLTS2P,5,07 feb. 2023,Son muy bonitas.,0,1
JCDTLTS2P,5,15 ene. 2023,"Relación precio y calidad acordé. Aros resistentes, al principio la vi muy amarilla y no beige pero ya puesta no, se ve linda y elegante. Las costuras se ven bien. Sin duda volvería a comprar.",0,1
JCDTLTS2P,5,12 sep. 2023,"Excelente calidad y precio, superó mis expectativas 👍🏼.",2,0
JCDTLTS2P,5,12 ago. 2023,"La tela es muy delgada por lo que tuve que poner las dos cortinas juntas y quedó perfecto, tu puedes ver hacia el exterior pero de afuera hacia dentro no se ve nada, por lo que es increíble, detalles en las costuras pero nada de que preocuparse.",2,0
JCDTLTS2P,5,05 sep. 2023,,1,0
JCDTLTS2P,5,03 sep. 2023,Aún no lo pongo pero están bonitas.,1,0
JCDTLTS2P,5,26 ago. 2023,Muy padres recomendable y buena tela.,1,0
JCDTLTS2P,5,09 ago. 2023,"Lindas, cumplen el propósito por el costo, ligeramente amarillas pero lucen bien!!.",1,0
JCDTLTS2P,5,06 jun. 2023,,1,0
JCDTLTS2P,5,05 jun. 2023,Exelentes me encantaron muy buena calidad.,1,0
JCDTLTS2P,5,23 sep. 2023,Excelente calidad se ven muy lindas.,0,0
JCDTLTS2P,5,23 sep. 2023,Elegantes y baratas. Calidad a muy bajo precio.,0,0
JCDTLTS2P,5,20 sep. 2023,Excelentes.,0,0
JCDTLTS2P,5,19 sep. 2023,Excelente.,0,0
JCDTLTS2P,5,19 sep. 2023,Me gusto muchoo.,0,0
JCDTLTS2P,5,16 sep. 2023,"Excelente, justo lo que esperaba.",0,0
JCDTLTS2P,5,15 sep. 2023,Muy bien.,0,0
JCDTLTS2P,5,15 sep. 2023,Buen producto.,0,0
JCDTLTS2P,5,12 sep. 2023,"Muy bonitas, buena tela.",0,0
JCDTLTS2P,5,11 sep. 2023,"Es una excelente opción, en relación calidad precio. Se ven muy bonitas y permite la entrada de luz.",0,0
JCDTLTS2P,5,09 sep. 2023,"Muy bueno por el precio. El material es delgado pero suficiente resistente, no deja ver nada hacia adentro.",0,0
JCDTLTS2P,5,07 sep. 2023,Buena calidad.,0,0
JCDTLTS2P,5,05 sep. 2023,"El material se ve bien , aún no las he colocado , sin embargo , espero sean de utilidad.",0,0
JCDTLTS2P,5,04 sep. 2023,Excelente producto.,0,0
JCDTLTS2P,5,03 sep. 2023,Muy bien.,0,0
JCDTLTS2P,5,02 sep. 2023,"Ligera, delgada justo lo que esperaba.",0,0
JCDTLTS2P,5,29 ago. 2023,Son muy bonitas.,0,0
JCDTLTS2P,5,23 ago. 2023,"Las cortinas están muy bonitas, excelente producto.",0,0
JCDTLTS2P,5,22 ago. 2023,Excelente relación precio calidad.,0,0
JCDTLTS2P,5,22 ago. 2023,Me encantaron las cortinas aunque si son demasiado transparentes pero me encantaron.,0,0
JCDTLTS2P,5,22 ago. 2023,"Me gustó el resultado final, la forma en que vuelve un espacio simple en algo más acogedor.",0,0
JCDTLTS2P,5,19 ago. 2023,Excelente compra.,0,0
JCDTLTS2P,5,18 ago. 2023,A mí me gustaron. A mí pareja no jajajaja saludos y gracias.,0,0
JCDTLTS2P,5,10 ago. 2023,Bien buena calidad 👍.,0,0
JCDTLTS2P,5,10 ago. 2023,Muy bonito!.,0,0
JCDTLTS2P,5,09 ago. 2023,Hermosas y elegantes.,0,0
JCDTLTS2P,5,02 ago. 2023,Buena calidad.,0,0
JCDTLTS2P,5,28 jul. 2023,Excelente producto.,0,0
JCDTLTS2P,5,27 jul. 2023,"Cumplió con mis expectativas, son muy bonitas.",0,0
JCDTLTS2P,5,27 jul. 2023,Muy lindas y transparentes.,0,0
JCDTLTS2P,5,26 jul. 2023,Justo para el precio.,0,0
JCDTLTS2P,5,24 jul. 2023,Excelentes!!!.,0,0
JCDTLTS2P,5,23 jul. 2023,"Están lindas y bien hechas, estoy conforme con mí compra.",0,0
JCDTLTS2P,5,23 jul. 2023,"Se ven muy bonitas, me encantaron.",0,0
JCDTLTS2P,5,20 jul. 2023,Excel4ntes las voy a volver a comprar.,0,0
JCDTLTS2P,5,20 jul. 2023,Buen tamaño.,0,0
JCDTLTS2P,5,19 jul. 2023,Muy buen tamaño. Contenta con la compra.,0,0
JCDTLTS2P,5,17 jul. 2023,Excelente.,0,0
JCDTLTS2P,5,16 jul. 2023,Excelente calidad. Hacen lucir elegante el espacio.,0,0
JCDTLTS2P,5,12 jul. 2023,Me encantaron y volvería a comprar.,0,0
JCDTLTS2P,5,09 jul. 2023,"Si es la medida perfecta, si me gusta.",0,0
JCDTLTS2P,5,07 jul. 2023,Muy bonitas me encantaron.,0,0
JCDTLTS2P,5,03 jul. 2023,"Muy lindas y delgadas, tal como las necesitaba. Elegantes.",0,0
JCDTLTS2P,5,03 jul. 2023,Muy bonita.,0,0
JCDTLTS2P,5,03 jul. 2023,"Delgadas y de buen material, me gustaron mucho.",0,0
JCDTLTS2P,5,01 jul. 2023,Muy corrientes los materiales.,0,0
JCDTLTS2P,5,30 jun. 2023,Súper lindas y buena calidad.,0,0
JCDTLTS2P,5,29 jun. 2023,"Son geniales, considero buen precio, y se ven super elegantes.",0,0
JCDTLTS2P,5,20 jun. 2023,Lindas elegantes.,0,0
JCDTLTS2P,5,17 jun. 2023,Están bien bonitas.,0,0
JCDTLTS2P,5,16 jun. 2023,Muy bonitas.,0,0
JCDTLTS2P,5,09 jun. 2023,"Realmente fue lo que necesitaba, su textura suave y el color hermoso, las recomiendo!!!!.",0,0
JCDTLTS2P,5,07 jun. 2023,"Mi 7nico pero son las argollas, ya vienen de menor calida.",0,0
JCDTLTS2P,5,05 jun. 2023,Muy buen producto.,0,0
JCDTLTS2P,5,03 jun. 2023,Muy bonitas recomendadas.,0,0
JCDTLTS2P,5,02 abr. 2023,"Me gustaron mucho, son frescas, fáciles de limpiar, peroooo muy transparentes, de largo es buen tamaño pero me hubiera gustado un poco más largas.",0,0
JCDTLTS2P,4,15 may. 2023,No me fijé y los aros son dorados.,0,1
