id,Calificación,Fecha,Reseña,Cantidad de imagenes,Utilidad
GDLSNI22F,5,23 jun. 2023,"Muy bonitas, sin embargo no iluminan demasiado, para decorar esta bien pero si se busca que ilumine bastante mejor no.",0,0
GDLSNI22F,5,19 jun. 2023,Excelente.,0,0
GDLSNI22F,5,16 jun. 2023,"Excelente, muy satisfecho.",0,0
GDLSNI22F,5,16 jun. 2023,Excelente calidad.,0,0
GDLSNI22F,5,07 jun. 2023,Me gustó mucho.,0,0
GDLSNI22F,5,02 jun. 2023,Muy bonitas y se ven excelentes para decorar y lo mejor son solares.,0,0
GDLSNI22F,5,02 jun. 2023,Excelente y gran duración de batería se los recomiendo.,0,0
GDLSNI22F,5,24 may. 2023,"Buen producto, buena calidaddon hermosas como decoración, no sirven para iluminar. Pero si brillan muy bonito si esta oscuro.",0,0
GDLSNI22F,5,20 may. 2023,Bien.,0,0
GDLSNI22F,5,16 may. 2023,"Excelente producto, se ve muy bella la luz de cada foquito. Yo la coloque en un árbol y se mira muy bien.",0,0
GDLSNI22F,5,04 may. 2023,Muy buenos.,0,0
GDLSNI22F,5,01 may. 2023,Buen producto.,0,0
GDLSNI22F,5,01 may. 2023,"Muy buen producto, ideal para no gastar corriente con la modalidad del panel solar.",0,0
GDLSNI22F,5,27 abr. 2023,"Me pareció excelente producto, calidad-precio!! bien.",0,0
GDLSNI22F,5,04 abr. 2023,Son muy lindas.,0,0
GDLSNI22F,5,03 abr. 2023,Muy buena.,0,0
GDLSNI22F,5,23 mar. 2023,Es muy hermoso me gusto mucho y me resolvieron mi problema muy rápido.,0,0
GDLSNI22F,5,18 mar. 2023,"Ahorradora de luz ya que tiene el panel, deja un ambiente lindo tranquilo, romántico, lo volvería a comprar.",0,0
GDLSNI22F,5,17 mar. 2023,Las luces se ven muy bonitas y funcionan muy bien.,0,0
GDLSNI22F,5,13 mar. 2023,Muy bien muchas gracias.,0,0
GDLSNI22F,5,09 mar. 2023,"Esta padrisima la guía, compré dos. En la noche se ven increíbles. Lo recomiendo totalmente !.",0,0
GDLSNI22F,5,06 mar. 2023,"Muy buenas, relacion costo beneficio todo perfecto.",0,0
GDLSNI22F,5,06 mar. 2023,Práctica y util.,0,0
GDLSNI22F,5,23 feb. 2023,Me pareció muy práctico muy bonitas las luces.,0,0
GDLSNI22F,5,17 feb. 2023,Muy bueno.,0,0
GDLSNI22F,5,16 feb. 2023,Me parecio muy bien el producto.,0,0
GDLSNI22F,5,11 feb. 2023,"El producto es tal cual viene en la descripción, lo regrese porque es sumamente largo para lo que lo necesito.",0,0
GDLSNI22F,5,08 feb. 2023,Ise una excelente compra gracias.,0,0
GDLSNI22F,5,07 feb. 2023,Muy bonitas y buena luz.,0,0
GDLSNI22F,5,18 ene. 2023,"Me encantaron las luces! es obvio que la luz no será tan intensa como una bombilla. Pero la verdad que por el precio y lo que ofrece está súper bien. Las utilice para hacer una cena al aire libre y la verdad lucían muy lindas. Además de que están súper largas. Tiene diferentes modos las luces, pueden parpadear, apagar y prender, estático, etc.",0,0
GDLSNI22F,5,19 nov. 2022,Muy buen producto.,0,0
GDLSNI22F,5,16 nov. 2022,"Super, pensé que sería muy corriente.",0,0
GDLSNI22F,5,13 nov. 2022,Súper bonito.,0,0
GDLSNI22F,4,08 jun. 2023,"El producto está muy padre, a mi me salió defectuoso y lo tuve que devolver, pero de haber funcionado bien, hubiera sido una excelente compra, lástima que en electrónica es común el fallo.",1,3
GDLSNI22F,4,01 ago. 2023,Ocupa un par de baterías para mayor durabilidad.,0,0
GDLSNI22F,4,29 jul. 2023,La luz es muy baja.,0,0
GDLSNI22F,4,16 jun. 2023,Si prenden pero hay unos leds que prende más que otros y la separación de los leds es mucha.,0,0
GDLSNI22F,4,02 jun. 2023,Es buen producto.,0,0
GDLSNI22F,4,15 feb. 2023,Se ven bien en el rancho donde la única luz que hay es la de la luna.,0,0
GDLSNI22F,4,02 feb. 2023,Cumple con todo lo que dice.,0,0
GDLSNI22F,4,19 ene. 2023,Funciona bien aunque el brillo de los led es un poco bajo pero se ven bien.,0,0
GDLSNI22F,3,09 sep. 2023,"Para el precio, está bien!.",1,0
GDLSNI22F,3,11 sep. 2023,"Se ven bonitas, pero son tenues, incluso conectadas a la energía eléctrica.",0,0
GDLSNI22F,3,29 jul. 2023,Es super frágil aunque se ven muy lindas.,0,0
GDLSNI22F,3,16 jul. 2023,"Funcionó a medias 1 vez, porque no prendían bien varios focos, los filamentos son muy delgados, en la segunda ocasión que se usó se rompieron 4 focos estando en uso, cosa peligrosa por los vidrios.",0,0
GDLSNI22F,3,23 jun. 2023,"Esta súper bien que sea de luz solar, el panel funciona muy bien 👍🏼 solo me hubiera gustado un poco más de intensidad en los leds, realmente se iluminan mucho pero pienso que como decoración discreta están ok 👌🏻.",0,0
GDLSNI22F,3,21 jun. 2023,Me gustó para decorar mi patio.,0,0
GDLSNI22F,3,02 mar. 2023,"Para los exteriores es una luz demasiado baja, no logra iluminar, para adorno está muy bien!.",0,0
GDLSNI22F,3,01 mar. 2023,"Prenden más de un lado que otro, de ahí en fuera buen producto creo es lo correcto por el precio.",0,0
GDLSNI22F,3,07 feb. 2023,Bueno en verdad.,0,0
GDLSNI22F,2,30 mar. 2023,"Venia la mitad como fundida o más baja de intensidad a pesar de que la conecte directo a la luz. Aún no pruebo que tanto alumbra en la noche, pero dudo que mucho.",0,1
GDLSNI22F,2,08 ago. 2023,Prende más de un solo lado así como se ve en la foto.,1,0
GDLSNI22F,2,20 sep. 2023,Se mira bonito pero no alusan.,0,0
GDLSNI22F,2,31 mar. 2023,"Deje todo el dia las celdas solares cargando y en la noche no funcionaron, prenden y se apagan, tuve q conectarlas por medio usb.",0,0
GDLSNI22F,1,03 jul. 2023,"Apenas y prenden, se ven muy muy tenues casi como si estuvieran apagadas.",0,0
GDLSNI22F,1,30 jun. 2023,"Muy sencillas para el precio, la verdad no me gustaron! no las recomiendo.",0,0
GDLSNI22F,1,01 abr. 2023,No lo he encendido pero el empaque vino bastante mal.,0,0
CBEMPS,5,03 jul. 2023,Super mis expectativas.,1,1
CBEMPS,5,21 ago. 2023,"Excelente producto. No es total black out, cubre la luz en un 60%. Por el precio está bien.",1,0
CBEMPS,5,20 jul. 2023,Súper prácticas.,1,0
CBEMPS,5,21 ago. 2023,Me gustó mucho. Volveré a comprar.,0,0
CBEMPS,5,16 ago. 2023,De muy buena calidad. Recomiendo el producto.,0,0
CBEMPS,5,09 ago. 2023,Es muy bonita el detalle que trae ollitos.,0,0
CBEMPS,5,07 ago. 2023,"Buen producto, excelente precio.",0,0
CBEMPS,5,04 ago. 2023,"Buenísimo yo encargué 4piezas para dos ventanas y están muy bonitas y muy buena calidad, ahora compraré para todas mis ventanas. 😍😍😍😍😍.",0,0
CBEMPS,5,01 ago. 2023,Súper lindas me encantaron el color un poco más claro que la foto.,0,0
CBEMPS,5,30 jul. 2023,Excelente está bastante gruesa y muy muy linda cubrió perfectamente el espacio para el cual la compré.,0,0
CBEMPS,5,22 jul. 2023,Muy buena calidad.,0,0
CBEMPS,5,17 jul. 2023,Muy buen producto de muy buena calidad y a un excelente precio. Muy recomendable.,0,0
CBEMPS,5,16 mar. 2023,Me parecieron bastante bonitos y oscuros.,0,0
CBEMPS,5,07 mar. 2023,"Justo me sirve para lo que necesitaba. Es muy delgada, transparenta. Para lo que quería viene bien.",0,0
CBEMPS,4,28 ago. 2023,Si cumple con la descripciòn.,0,0
CBEMPS,4,24 ago. 2023,"Las cortinas cumplen su funcion, la tela es delgada, no obscurecen tanto la habitacion, eso me agrada a mi, tengo doble cortina, asi que si tu estas bien con algo de luz, te van a gustar, si lo que quieres es que obscurescan, no es la opcion.",0,0
CBEMPS,4,18 ago. 2023,Bueno bonito y barato.,0,0
CBEMPS,4,04 ago. 2023,Buen producto para su precio.,0,0
CBEMPS,4,03 ago. 2023,Bueno.,0,0
CBEMPS,4,28 jul. 2023,Bien pero es un poco translúcida.,0,0
CBEMPS,4,28 jul. 2023,No son tan gruesas como pensé pero está bien por el precio.,0,0
CBEMPS,4,20 jul. 2023,Es un poco transparente.,0,0
CBEMPS,3,25 jun. 2023,"No es blackout para nada, e comprado de otras y vaya que si oscurecen mucho en el día, estás no son así, hablando justo de ese color en específico, el color es muy bonito pero no no tapan la luz de día.",2,3
CBEMPS,3,21 jul. 2023,"A pesar comprar el color negro, tienes que ponerla doble para que impida el paso de la luz un poco. No son blackout.",0,0
CBEMPS,3,20 feb. 2023,Las cortinas son largas pero la blanca transparenta mucho y la tela tiene la calidad de una sábana.,0,0
CBEMPS,2,01 ago. 2023,"No es blackout, entra mucha luz….",0,0
CBEMPS,2,09 jul. 2023,Le tela es muy muy delgada cubre un 20% de luz.,0,0
CBEMPS,2,27 jun. 2023,El producto es bueno pero no son blackout.,0,0
CBEMPS,1,09 ago. 2023,No son blackout para nada se transparenta mucho la tela parece la tela que compras en $20 él metro…. No se las recomiendo almenos que solo las quieran de adorno porque como blackout no funciona yo e comprado y se nota mucho la diferencia de tela esta es muy corriente.,0,1
CBEMPS,1,26 ago. 2023,Se transparentan mucho.,0,0
CBEMPS,1,24 jul. 2023,"Están muy delgadas, se ve todo. Parece papel.",0,0
CDCZI2P,5,11 sep. 2023,Super resistentes muy buen producto.,0,0
CDCZI2P,5,06 sep. 2023,Excelente producto.,0,0
CDCZI2P,5,17 jul. 2023,Buenos tal cual a la descripción.,0,0
CDCZI2P,5,21 jun. 2023,"Buen producto y económico , claro que los volvemos a pedir.",0,0
CDCZI2P,5,06 mar. 2023,Lo e comorado varias veces.,0,0
CDCZI2P,5,18 feb. 2023,Buena compra.,0,0
CDCZI2P,5,13 feb. 2023,"Excelentememte bien, no se rompen y si se mojan no absorben el agua y por lo tanto no se rompen. Gracias!!.",0,0
CDCZI2P,5,07 feb. 2023,De buena calidad.,0,0
CDCZI2P,5,05 feb. 2023,"Excelente duran bastante, hay que tener cuidado en no pisarlos ni jalarlos con el otro pie, se pueden reutilizar varias veces.",0,0
CDCZI2P,5,04 feb. 2023,Muy buen producto y el precio accesoble.,0,0
CDCZI2P,5,01 feb. 2023,Vienen completos de muy buena calidad lo compraría otra vez.,0,0
CDCZI2P,5,01 dic. 2022,"Lo compre ya que por salud de todos no me gusta que entren bacterias, microbios y cosas que vengan de la calle y cumplió con su función, son de buen material, cubre perfectamente el pie y no se cae y se ajusta perfectamente a cualquier pie, me agrado bastante, y me gusta porque son desechables y puedo cuidar a mi familia y a mis visitas no tengo que pedirles que se quiten los zapatos y nosotros los usamos y me siento más segura de que no hay contaminantes en mi casa.",0,0
CDCZI2P,5,27 nov. 2022,"Son muy resistentes y de un tamaño promedio. Las cuales bien las puede usar un niño hasta un adulto. Me han servido mucho para varias ocasiones la calidad es muy buena y resisten perfectamente el uso por varias horas, se ajusran muy bien ya que en la parte de arriba tienen elástico lo que se sujeta perfectamente.",0,0
CDCZI2P,4,13 mar. 2023,"Sirve para lo que es, desechables.",0,0
CDCZI2P,3,23 jun. 2023,"Son de plástico, suda el pie, y el elástico no siempre aguanta la jornada.",0,0
CDCZI2P,1,24 feb. 2023,"No eran lo que yo esperaba , tal vez fue mi error de no leer que son de plastico, para el ambiente medico no sirve y de verdad no se para que puedan servir , al ser de plastico sura el zapato y por ende el pie , incomodos , si los necesitas para quirofano o clinica no es una buena opcion !.",0,0
6BDHDDP9M,5,07 jun. 2023,"Aun no las uso, pero vienen bien empacadas, separadas por color (eso no lo esperaba y me encantó) lo voy a usar para actividades sensoriales para mi bebé.",0,2
6BDHDDP9M,5,03 jun. 2023,Buen producto a buen precio.,1,1
6BDHDDP9M,5,26 feb. 2023,"Excelente compra, trae suficiente producto, quede sorprendido.",0,1
6BDHDDP9M,5,03 sep. 2023,Excelente para mis arreglos de mesa.,1,0
6BDHDDP9M,5,24 ago. 2023,Son 6 bolsas con colores surtidos vibrantes de buena calidad.,1,0
6BDHDDP9M,5,23 sep. 2023,"Lo mejor de todo es que llega separado los colores, muy recomendable.",0,0
6BDHDDP9M,5,17 sep. 2023,Exelente.,0,0
6BDHDDP9M,5,14 sep. 2023,Me encantan sus colores son brillantes.,0,0
6BDHDDP9M,5,10 sep. 2023,Excelente producto.,0,0
6BDHDDP9M,5,03 sep. 2023,"Super, las uso para pistola de juguete y muy bien.",0,0
6BDHDDP9M,5,29 ago. 2023,"Excelente, trae muchísimas y a excelente precio.",0,0
6BDHDDP9M,5,29 ago. 2023,Muy bien producto yuy buenos colores.,0,0
6BDHDDP9M,5,29 jul. 2023,"Excelentes para pistolas que no son automáticas, ya que se necesitan un poco más grandes como estas.",0,0
6BDHDDP9M,5,10 jul. 2023,"Las utilizo xa mis plantas y al parecer les cayó genial, los colores están lindos.",0,0
6BDHDDP9M,5,17 jun. 2023,Excelente quedaron muy en lo que lo utilize.,0,0
6BDHDDP9M,5,24 abr. 2023,A simple vista se ven muy poquitas bolitas pero es impresionante cómo crecen con el agua qué ya no sé qué hacer con tantas jeje. Vienen separadas en bolsitas por colores. Es una excelente compra!!.,0,0
6BDHDDP9M,5,09 ene. 2023,Super bien! vienen separadas por colores.,0,0
6BDHDDP9M,4,02 may. 2023,Están muy padres.,0,0
6BDHDDP9M,4,15 mar. 2023,"Se ven muy bonitos los tonos, vienen en paquetitos separados por colores negro, azul, amarillo, verde, transparente, rosa, y no recuerdo cuales otros, quedan translúcidos al hidratarse. Se vuelven a encoger al deshidratarse.",0,0
6BDHDDP9M,4,31 ene. 2023,Bueno solamente que son bolitas pequeñas yo esperaba que fueran un poco más grandes pero excelente colores.,0,0
6BDHDDP9M,3,04 may. 2023,10 de cada 100 orbes salen un poco más pequeños. Me atrevería a decir que el 10% de los orbes no crecerán a su tamaño indicado.,0,0
6BDHDDP9M,2,21 ago. 2023,Decepcionada de verdad. Son taaan pequeñas. No llenan ningun florero 🤨.,0,0
6BDHDDP9M,1,07 sep. 2023,It killed my cut flowers in 2 hours. Beware!.,0,0
1EAPCD,5,18 jul. 2023,Las compre para adornar una fuente tipo cascada con piedra natural y la verdad se ven muy bien. Las recomiendo mucho.,1,1
1EAPCD,5,08 jul. 2023,"Es muy buen producto las hojas son pequeñas se ve super natural ,las recomiendo 🙂.",1,0
1EAPCD,5,14 ago. 2023,Bueno.,0,0
1EAPCD,5,08 ago. 2023,"Muy bonito, buena calidad.",0,0
1EAPCD,5,22 jul. 2023,Excelente producto 10/10.,0,0
1EAPCD,5,20 jul. 2023,Super 👌.,0,0
1EAPCD,5,20 jul. 2023,Están muy bonitas se ven naturales. Me encantaron.,0,0
1EAPCD,5,18 jul. 2023,Trae todo para instalarlas bien y se ven bonitas y naturales 🫶🏼.,0,0
1EAPCD,5,14 jun. 2023,Excelente.,0,0
1EAPCD,5,14 jun. 2023,"Me gustaron mucho son de buen tamaño, de calidad y se ven bonitas.",0,0
1EAPCD,5,13 jun. 2023,Excelente buen producto.,0,0
1EAPCD,5,11 jun. 2023,Es un producto de calidad por el precio que pagas. Muy llamativo como decoración atte. Villalobos.,0,0
1EAPCD,5,03 jun. 2023,Son pequeñas las hojas pero funcionales al combinarlas. Se enredan un poco al sacarlas del empaque pero sirven para decorar. Huelen un poco extraño al sacarlas del empaque pero después se quita el aroma como a petroleo. Recomendables.,0,0
1EAPCD,5,13 abr. 2023,Buen producto en relación calidad-precio.,0,0
1EAPCD,5,18 jul. 2023,Es perfecto las hojas están chicas me pareció muy bien por qué no se ve exageradas las hojas la verdad si las volvería a pedir.,1,0
1EAPCD,4,17 sep. 2023,"Porl el precio está bien,fue una buena compra.",0,0
1EAPCD,4,06 sep. 2023,Me gustaron mucho aunque me hubieran gustado más grandes las hojas.,0,0
1EAPCD,4,10 ago. 2023,"Están muy bonitas el largo perfecto volveré a comprar 3 más ,solo una observación si las hicieran jaspiadas estarían super.",0,0
1EAPCD,4,03 ago. 2023,"Me pareció bueno, aunque muy delgadas las guías, pocas hojas.",0,0
1EAPCD,3,09 ago. 2023,Bien aunque no es igual a la foto.,0,1
1EAPCD,3,18 sep. 2023,Demasiadas pequeñas las hojas no son de tamaño real.,0,0
FDDCCDNPEH,5,08 sep. 2023,Muy bonitos.,0,1
FDDCCDNPEH,5,29 ago. 2023,"Hermosas, me encantaron, aunque la tela es un poco delgada se ve de buena calidad, el estampado es bellísimo, los colores hermosos, los cierres funcionan perfecto. Y lo mejor es que vienen 4 fundas con diferentes estampados. Si lo recomiendo.",0,1
FDDCCDNPEH,5,16 ago. 2023,👌.,0,1
FDDCCDNPEH,5,24 sep. 2023,Excelente calidad.,0,0
FDDCCDNPEH,4,06 sep. 2023,Aunque la tela es delgada se compensa porque el estampado luce mucho y las fundas se ven lindas.,0,1
FDDCCDNPEH,4,18 sep. 2023,"Igual que los de la foto, muy bonitos y de buen material me hubiese gustado que fueran de doble vista.",0,0
FDDCCDNPEH,3,20 sep. 2023,"El estampado bonito, la tela parece de sabana.",0,0
1MTCDRCV,5,24 may. 2023,"No es vidrio, es acrílico y pesan muy poco. Ideal para pegar en los muros.",0,0
1MTCDRCV,5,07 abr. 2023,El producto es muy bueno. Solo detalles con las medidas pero con ajustes acá soliciono la situación sin problema. En cuanto a estética y materiales llena la expectativa.,0,0
1MTCDRCV,4,06 sep. 2023,"Es más grande que el tamaño carta de largo, y de ancho es más corto. Y viene con una mica como protección en vez de vidrio.",0,0
1MTCDRCV,3,20 feb. 2023,"Si es tamaño carta pero no es exacta la medida, tuve que recortar a lo largo mis diplomas. El marco es más largo en altura y en ancho es más estrecho. El vidrio es más bien acrílico.",0,0
1MTCDRCV,2,30 jun. 2023,"No es tamaño carta, es más largo y menos ancho que una hoja tamaño carta.",0,0
1MTCDRCV,2,26 feb. 2023,"Es buen producto, solo que no es vidrio, es acrílico delgado.",0,0
1MTCDRCV,1,22 mar. 2023,"Pesima calidad, ofrecen marco con vidrio, tuve que devolverlos porque eran de plastico en ves de vidrio. Hice una nueva compra pensando que era un error, y volvieron con el plastico en ves de vidrio. Realmente lamentable y engañoso.",0,2
RDDBBNYRF,5,02 nov. 2021,"Me gusta el tamaño del reloj, es practico para colocarlo en cualquier sitio. Es facil de llevar a cualquier parte, ademas combina con mis muebles y no es tan estorboso. La calidad del material que manejan es bastante bueno, es resistente y atractivo a la vista. Me gustaron las funciones bluetooth que tienen, asi puedo escuchar musica con el desde mi celular. El sonido de alarmas en verdad ayuda a despertarme.",0,10
RDDBBNYRF,5,07 mar. 2022,"El producto en cuestión cumple bastante bien con su función, para empezar tiene un diseño bastante compacto y su color hace que se note de forma muy elegante, por su pequeño tamaño se puede ajustar en cualquier sitio ya sea una mesa de noche con poco espacio. Me sorprende bastante que con tan poco tamaño sus bocinas sean muy potentes y con una calidad bastante increíble, sin duda estoy tranquilo que la alarma me despertará por la mañana, sin mencionar que también disfruto bastante poner música con la conexión bluetooth. La batería es de las cosas que más me ha gustado, pues dura bastante horas casi de forma exagerada e igual la carga es bastante rápida.",0,5
RDDBBNYRF,5,05 nov. 2021,El volumen de las bocinas es bastante bueno en comparación del tamaño del despertador. Se conectó muy bien a mi teléfono sin pasmarse. La calidad del audio es muy buena. Me gustó que también se puede sintonisar la radio. Fue fácil de usar. La batería dura un montón aún usándola como bosina. Los materiales con los que está echo están muy bien ensamblados y se sienten firmes al tacto. Además el diseñó se ve elegante y combina muy bien con la habitación.,0,5
RDDBBNYRF,5,09 nov. 2021,"Me gusta mucho ya que es pequeño y elegante,con el acabado espejo se ve genial,tiene varias funciones y usos,hora, temperatura,radio fm, conexión bluetooth,tarjeta y auxiliar,en mi caso lo que más uso es la conexión bluetooth y radio fm,para mí es fácil de utilizar las funciones,no tuve ningún problema para sincronizar con mi smartphone,el sonido de las bocinas es bueno y suenan bien las canciones,la calidad del material se siente bien.",0,4
RDDBBNYRF,5,03 nov. 2021,"El reloj es muy grande para su tamaño, el color de las horas es blanco, pero se ve de gran calidad. Además de la hora, nos indica el clima y los grados centígrados en los que se encuentra el día. Las bocinas integradas son de gran volumen, la conexión bluetooth es excelente y en ningún momento se desconecta al estar reproduciendo la música desde tu dispositivo. Buen tamaño, fácil de instalar y operar, para nada complicado de usar.",0,4
RDDBBNYRF,5,07 mar. 2022,"Me gusta! excelente diseño de verdad que se ve mucho la luz hasta en el dia, el diseño asi como de espejo hace que se vea espectacular, por otro lado que sea una bocina hace que tenga una funcion mas, ademas que trae radio y entrada micro sd asi que facilmente no necesitas tu celular si quieres usar musica, el sonido es bueno, aunque no sea su fuerte, es recargable y le dura bastantito la bateriam a mi me encanto completamente, se ve muy profesional minimalista, muy simple, ya teniendolo en tu mano o en tu estanteria te hace querer comprar otro.",0,3
RDDBBNYRF,5,11 nov. 2021,"Esta muy bonito y trae muy buenas funciones verdad me sorprendió la calidad del sonido para su tamaño suena muy, muy bien y la batería es muy duradera apesar que constanteme aparece la hora, la temperatura y el porcentaje de batería. Es muy fácil de configurar mi telefono detecto automaticamente el bluetooth y eso me pareció muy bien. Además el fm detecta muy buenas estaciones. Me gusto mucho el diseño y la elegancia que le da la pantalla tipo espejo y el tamaño es perfecto.",0,2
RDDBBNYRF,5,04 nov. 2021,"El mejor despertador que e tenido. , por más sueño que uno tenga se despierta. La función de radio es muy buena agarra muchísimas estaciones sin necesidad d conectarle otra cosa extra. El bluetooth se enlaza muy rápido y tiene una amplia cobertura, el sonido es bueno y el material de buena calidad. La batería le dura bastante y se carga muy rápidamene, sin duda fue una muy buena inversión.",0,2
RDDBBNYRF,5,23 ago. 2023,,1,1
RDDBBNYRF,5,27 may. 2023,"Tamaño físico muy práctico, tiene buena calidad en el sonido y el tamaño del número muy cómodo para verlo a distancia.",1,1
RDDBBNYRF,5,05 feb. 2022,"Esta muy chimba el reloj, como siempre los alcohones cazamos ofertones.",0,1
RDDBBNYRF,5,02 ene. 2022,"Me ha gustado el producto bastante, muy facil de configurar y de utilizar.",0,1
RDDBBNYRF,5,23 dic. 2021,Excelente bocina reloj despertador.,0,1
RDDBBNYRF,5,23 dic. 2021,"Excelente, muchas gracias. Es un artículo muy práctico y útil.",0,1
RDDBBNYRF,5,11 nov. 2021,"Este dispositivo está muy completo. Es reloj depertador, radio fm y bocina con conexion bluetooth. Llevo un par de semanas utilizandolo y me ha funcionado bien. La batería dura varias horas de uso continuo en uso como bocina pero si la usas únicamente como reloj despertador la bateria dura varios días.",0,1
RDDBBNYRF,5,11 nov. 2021,"El despertador es bonito, me gusta que tiene un diseño pequeño y moderno por su pantalla tipo espejo. La bocina tiene buen sonido y me gusta que se puede utilizar por varios medios; bluetooth, radio fm y tarjeta micro sd. Así que por mi parte me gustó el despertador.",0,1
RDDBBNYRF,5,05 nov. 2021,"Es muy completo el reloj. Cuenta con una bocina, la cual se puede conectar al celular a traves de bluetooth o en modo radio, el reloj luce elegante y tiene buena iluminación, se ve muy bien en el dia y en la noche, va cambindo y te dice la hora, la temperatura y el porcentaje de bateria que le queda, me gusto mucho para mi cuarto.",0,1
RDDBBNYRF,5,02 nov. 2021,"La bocina suena muy bien a pesar de que es pequeña tiene buen volumen y es versatil, acepta bluetooth, micro sd, fm, am y lo mejor que tiene alarma.",0,1
RDDBBNYRF,5,01 nov. 2021,"Estéticamente es un reloj muy bonito, quedará bien en cualquier mesita de noche moderna. Realiza las funciones que se especifica; con sus dos alarmas fáciles de activar y desactivar. La visibilidad de los dígitos es excelente en cualquier ambiente luminoso, el sonido es bastante bueno y me gusta tener la alternativa de saltar las canciones cuando escucho música vía bluetooth.",0,1
RDDBBNYRF,5,30 oct. 2021,"Facil de sincronizar y con buen sonido, tambien muestra la temperatura, la hora se configura facilmente y el brillo es perfecto para la noche pues no lastima y durante el dia se puede ver correctamente en la claridas. La pantalla se ve muy elegante, tiene buenos acabados y los materiales son de calidad.",0,1
RDDBBNYRF,5,07 nov. 2021,"Es muy bonito de diseo y pequeño por lo cual es facil ponerlo en una mesa, cuenta con la posibilidad de poner dos alarmas y reproduce musica por bluetooth, en general es un buen despertador y una buena bocina. Recargable y de buen diseño.",0,1
RDDBBNYRF,5,31 ago. 2023,,1,0
RDDBBNYRF,5,14 ago. 2023,"Me sorprendió por el precio, tiene muy buen sonido y es fácil de usar. Comprare otro.",1,0
RDDBBNYRF,5,24 sep. 2023,"La pila si dura algo , el único detalle el cargador se vatalla demasiado corto.",0,0
RDDBBNYRF,5,20 sep. 2023,"Super recomendada, si se termina la pila aun asi suena la alarma.",0,0
RDDBBNYRF,5,19 sep. 2023,Muy buen producto. Me agrado.,0,0
RDDBBNYRF,5,18 sep. 2023,Muy buen producto relación calidad precio.,0,0
RDDBBNYRF,5,17 sep. 2023,"El producto es bueno, la carga es rápida y me puedo despertar escuchando música.",0,0
RDDBBNYRF,5,13 sep. 2023,"Excelente producto cumple con su función,es pequeño pero excelente.",0,0
RDDBBNYRF,5,11 sep. 2023,Muy apropiado para dichas necesidades. Lo recomiendo.,0,0
RDDBBNYRF,5,08 sep. 2023,Bueno.,0,0
RDDBBNYRF,5,08 sep. 2023,"El único defecto es la batería, dura entre 8 horas.",0,0
RDDBBNYRF,5,05 sep. 2023,"Me parece genial , solo que las instrucciones no están en español y dificulta el ponerle la hora y las alarmas.",0,0
RDDBBNYRF,5,04 sep. 2023,"Me gusta, solo que la batería le dura poco. Yo la cargo un rato y dura un día aproximadamente. La apago en el día para que dure más la batería. Le falta el cuadro para poder cargar, solo tiene el cable usb.",0,0
RDDBBNYRF,5,03 sep. 2023,"Me gustaron mucho encargue 2 uno para mi trabajo y otro para mi casa, me gusta que lo puedes apagar y cuando lo prendes sigue configurado no se mueve nada y la batería le dura como 2 días sin apagarlo.",0,0
RDDBBNYRF,5,01 sep. 2023,"Muy bueno ,practico y cómodo. Muy útil.",0,0
RDDBBNYRF,5,31 ago. 2023,"Me encantan buen precio, buenas funciones, trae batería interna se va la luz y dura rato el reloj no se desprograma.",0,0
RDDBBNYRF,5,28 ago. 2023,Es complicado colocar alarmas.,0,0
