id,Calificación,Fecha,Reseña,Cantidad de imagenes,Utilidad
CBCPVD1,5,11 ago. 2023,Son unas cortinas de muy buena calidad y a un precio inmejorable. Me gusta mucho que tienen buen grado de blackout puesto que mi habitación se iluminaba mucho al amanecer y con estas cortinas puedo cubrir un poco de esa luz matutina. Tienen un buen largo y se sienten de un material resistente y de calidad.,2,1
CBCPVD1,5,09 jul. 2023,"Bonito juego de cortinas, lucen mucho al ponerlas en el cuarto, su tela es suave y resistente. Buena compra.",2,1
CBCPVD1,5,30 jul. 2023,Excelente producto.,0,1
CBCPVD1,5,20 ago. 2023,"La textura de la tela es muy suave y son gruesas. Pedí dos en color azul y oscurece muy bien. No son pesadas, tengo un cortinero delgado y resistió muy bien.",2,0
CBCPVD1,5,16 ago. 2023,"Una de las principales ventajas de las cortinas blackout es su capacidad para crear un entorno perfecto para el descanso. Su tejido de alta calidad no solo bloquea la luz solar directa, sino que también ayuda a reducir el ruido exterior y a mantener una temperatura más estable en la habitación. Esto resulta especialmente beneficioso para dormitorios y áreas de descanso, donde se busca un ambiente relajante y tranquilo. Estas cortinas también ofrecen una capa adicional de privacidad. Al bloquear la vista desde el exterior, permiten que te sientas más cómodo en tus espacios personales sin preocuparte por miradas indiscretas.",2,0
CBCPVD1,5,13 jul. 2023,"Tiene muy buena calidad la tela, las costuras se ven resistentes y en verdad tapa la luz del sol por el momento no he tenido problemas y las argollas son de medida estandar.",2,0
CBCPVD1,5,11 jul. 2023,"Las cortinas blackout tamaño 132x214cm y color gris oscuro merecen una calificación de 5 estrellas. Estas cortinas no solo añaden un toque elegante a cualquier habitación, sino que también cumplen su función principal de bloquear la luz de manera efectiva. Su tejido de alta calidad ofrece una opacidad total, creando un ambiente ideal para el descanso y el sueño. Además, su tono gris oscuro es versátil y se adapta a diferentes estilos de decoración. La instalación es rápida y sencilla, gracias a sus ojales resistentes que permiten colgarlas sin complicaciones. Además, su tamaño estándar se ajusta perfectamente a la mayoría de las ventanas. Estas cortinas no solo proporcionan privacidad, sino que también ayudan a reducir el ruido exterior, mejorando así la calidad de vida en el hogar.",2,0
CBCPVD1,5,02 sep. 2023,Me gusto que tiene buen color y grosor. Creo que son una muy buena opción por el precio. Fácil de planchar. Se ven muy bien colgadas. Bloquea casi al 100 la entrada de luz. La utilicé en mi cuarto y se ve geneal.,1,0
CBCPVD1,5,20 ago. 2023,"Excelente, 100 % recomendada.",1,0
CBCPVD1,5,12 ago. 2023,"Muy padre, luce muy bien y cubre perfectamente el sol, cuenta con su listón para amarrarla. Me encanto.",1,0
CBCPVD1,5,12 ago. 2023,Hermosa en verdad hermosa.,1,0
CBCPVD1,5,10 ago. 2023,Excelente calidad muy bonitas cortinas lucen muy bien me encantaron.,1,0
CBCPVD1,5,10 ago. 2023,"Buenas cortinas excelente producto, sin térmicas lo que ayuda con el calor; me encanto la calidad y el color es precioso, las recomiendo!!.",1,0
CBCPVD1,5,05 ago. 2023,Es el tono azul obscuro aún que en realidad es azul rey pero se ve bonito.,1,0
CBCPVD1,5,04 ago. 2023,"Me encantaron!! están super bien hechos, tienen buena calidad, son muy bonitos y cumplen con su función, me gustaron mucho, los recomiendo!! los compraría de nuevo.",1,0
CBCPVD1,5,24 sep. 2023,Excelentes.,0,0
CBCPVD1,5,23 sep. 2023,Excelente.,0,0
CBCPVD1,5,22 sep. 2023,Está hermoso el color es un color vivo pensé que sería un color opaco pero no y solo viene una cortina con su cordón.,0,0
CBCPVD1,5,22 sep. 2023,"Me quedé dormida y se me hizo tarde, por lo tanto le doy 5 estrellas. Excelente producto, no me di cuenta cuándo amaneció y tampoco se sentía calor en mi cuarto. Las recomiendo :).",0,0
CBCPVD1,5,22 sep. 2023,Excelente !!.,0,0
CBCPVD1,5,19 sep. 2023,"Muy buen producto, voy a comprar para el otro cuarto.",0,0
CBCPVD1,5,19 sep. 2023,Muyyyy bueno. Cubre muy bien la luz del dia. Sin duda volvere a comprarlo.,0,0
CBCPVD1,5,18 sep. 2023,"Excelente producto, buen material y oscurece bastante la habitación, y está en buen precio.",0,0
CBCPVD1,5,14 sep. 2023,"Muy bonita y grandes, son suaves y filtran bien la luz.",0,0
CBCPVD1,5,14 sep. 2023,Buen producto.,0,0
CBCPVD1,5,14 sep. 2023,Esta hermosa y traía un listo para amarrarlas de regalo.,0,0
CBCPVD1,5,13 sep. 2023,Mantiene fresca y elimina la iluminación si es lo que requieres.,0,0
CBCPVD1,5,13 sep. 2023,Muy bueno en cuanto a precio y calidadsi obscura bien sufro de migraña.,0,0
CBCPVD1,5,12 sep. 2023,Muy buen producto.,0,0
CBCPVD1,5,11 sep. 2023,Excelente.,0,0
CBCPVD1,5,11 sep. 2023,Realmente son muy bonitas ☺️ me sorprendió mucho la calidad.,0,0
CBCPVD1,5,11 sep. 2023,Muy buena calidad.,0,0
CBCPVD1,5,11 sep. 2023,Es perfectaaaaa!!!!! no pasa la luz. Y el precio está de miiiiil 👌👌.,0,0
CBCPVD1,5,11 sep. 2023,Muy bonitas y de buena calidad.,0,0
CBCPVD1,5,11 sep. 2023,"Muy buena calidad, la tela es suave y su corte muy bien hecho.",0,0
CBCPVD1,5,09 sep. 2023,"Todo muy bien, aun que son delgadas si son totalmente blackoutt, muy bonitas.",0,0
CBCPVD1,5,06 sep. 2023,Super bien y si cubren la luz solar.,0,0
CBCPVD1,5,06 sep. 2023,Me gusto excelente 👍🏻 producto 😉.,0,0
CBCPVD1,5,06 sep. 2023,Mi producto me pareció excelente.,0,0
CBCPVD1,5,04 sep. 2023,Excelente.,0,0
CBCPVD1,5,02 sep. 2023,Me encantaron están gruesas están bien.,0,0
CBCPVD1,5,01 sep. 2023,Excelente producto.,0,0
CBCPVD1,5,30 ago. 2023,👍.,0,0
CBCPVD1,5,30 ago. 2023,Me gustaron 👌.,0,0
CBCPVD1,5,29 ago. 2023,Aparentemente se ven delgadas pero al ponerlas cumple con lo que promete. Mantiene el fresco y no entra luz están padrisimas.,0,0
CBCPVD1,5,26 ago. 2023,No deja pasar para nada los rayos del sol muy buena la recomiendo.,0,0
CBCPVD1,5,19 ago. 2023,"Buen producto, no pasa la luz la volveré a comprar.",0,0
CBCPVD1,5,18 ago. 2023,Me encantó. La recomiendo.,0,0
CBCPVD1,5,18 ago. 2023,"Muy bueno y la verdad no deja pasar la luz, lo recomiendo.",0,0
CBCPVD1,5,13 ago. 2023,"Están diseñadas con un tejido especial que bloquea la mayoría de la luz solar, lo que las hace ideales para dormitorios, salas de cine en casa o cualquier lugar donde desees oscurecer completamente el ambiente. Además de su función de oscurecimiento, estas cortinas también ofrecen beneficios en términos de privacidad y aislamiento térmico, ayudando a mantener la temperatura de la habitación y reducir el ruido exterior. Su amplia variedad de colores y estilos las convierte en una opción versátil para la decoración de interiores. Prácticas, funcionales y estéticamente atractivas.",0,0
CBCPVD1,5,11 ago. 2023,"Me encantaron estas cortinas, son realmente fabulosas, la tela es muy buena, además de que me ayuda muchísimo a cubrir perfectamente las ventanas de mi habitación, son realmente fabulosas, de muy buena calidad, mucho mejores que otras que he comprado anteriormente, me encantaron estas cortinas, son hermosas.",0,0
CBCPVD1,5,10 ago. 2023,Excelente producto 👌.,0,0
CBCPVD1,5,09 ago. 2023,"Excelente, la tela , el acabado y cubre muy bien la luz.",0,0
CBCPVD1,5,09 ago. 2023,"Muy buen producto, al precio k es si vale la pena comprarlo, no transparentea y la tela es gruesa y suave.",0,0
CBCPVD1,5,09 ago. 2023,"Son de buena calidad, cumple con lo prometido.",0,0
CBCPVD1,5,09 ago. 2023,"Esta cortina es muy útil para bloquear la entrada de luz, es fácil de instalar, la tela es resistente, durable y de buena calidad.",0,0
CBCPVD1,5,08 ago. 2023,Muy buen producto.,0,0
CBCPVD1,5,08 ago. 2023,Bastante bueno y muy fácil de colocar.,0,0
CBCPVD1,5,07 ago. 2023,Cortina de muy buen material y realmente si tapa la luz.,0,0
CBCPVD1,5,06 ago. 2023,"En lo personal el color se ve algo distinto a la foto, sin embargo cumple con su función, realmente no deja pasar la luz del sol atravez de la cortina, lo cual me gusto bastante y el material no es tan pesado pero es resistente.",0,0
CBCPVD1,5,06 ago. 2023,La tela está muy bonita es suave y no pasa la luz muy recomendable.,0,0
CBCPVD1,5,26 jul. 2023,"Me encantaron, es mejor de lo que pensé.",0,0
CBCPVD1,5,24 jul. 2023,"Excelente calidad, pocas veces me sorprendo de lo bueno que son los productos adquiridos en mercado libre, super calidad de cortinas.",0,0
CBCPVD1,5,15 jul. 2023,Son térmicas así que ya no tendrás mucho calor y son gruesas así que no entr la luz del sol.,0,0
CBCPVD1,4,15 sep. 2023,Muy bueno cubre muy bien.,0,0
CBCPVD1,4,31 ago. 2023,"Muy bonita, no se trasluce la luz.",0,0
CBCPVD1,4,29 ago. 2023,"Está bonita, resistente y el color bonito. Deberían de cambiar el anuncio y no poner cortinas sino cortina ya que es solo una, que si bien lo dice en el detalle, es fácil irse con la idea de que es el par al leer: cortinas.",0,0
CBCPVD1,4,16 ago. 2023,"No son al 100 blackout, si pasa la luz, pero por el precio y calidad está bien.",0,0
CBCPVD1,3,31 ago. 2023,Las cortinas estaban disparejas.,0,0
CBCPVD1,2,02 sep. 2023,Me parecen muy buenas pero lo que no me gusta que solo sea una cortina no me fije al leer y tuve que encargar otra.,0,0
CBCPVD1,1,19 sep. 2023,"Solo venía una cortina , no es el par , obviamente inservible para mi ventana , deberían especificar eso.",0,0
1TPABH2D,5,13 dic. 2022,"Me encantaron es muy importante las opiniones x que yo soy de las personas que se fijan en las opiniones antes de comprar, las recomiendo ❤️.",0,6
1TPABH2D,5,02 abr. 2022,"Muy bonitas y suficientes para decorar tu espacio favorito, de hecho, más de uno!!. Las hojitas son un poquito delicadas así que trátalas como si fueran de verdad y listo!!.",0,7
1TPABH2D,5,04 ago. 2022,"Cumplen su función, se ven bien, son de buena calidad. Sólo hay que tener un poco de cuidado al desenredar porque pueden caerse algunas hojitas. Lo volvería a comprar.",0,2
1TPABH2D,5,04 feb. 2022,"Si se busca una decoracion minimalista, este producto es ideal. Logre darle el aspecto que buscaba a mi oficina.",0,1
1TPABH2D,5,05 abr. 2022,"Buena calidad, en general me hubieran gustado más grandes las hojitas pero están muy bien. Soportan el clima muy bien.",0,1
1TPABH2D,5,20 ago. 2021,El artículo es de buena calidad y me encantó muchísimo como se ve en la pared detrás del perchero que tengo.,0,1
1TPABH2D,5,04 sep. 2023,,1,0
1TPABH2D,5,30 ago. 2023,Súper buenas para decorar.,1,0
1TPABH2D,5,27 ago. 2023,Es muy bonito estan perfectas.,1,0
1TPABH2D,5,06 may. 2023,Mi producto me pareció increíble sin duda una buena compra y a un buen precio 😉. Excelente lo recomiendo.,1,0
1TPABH2D,5,25 sep. 2023,Muy realistas pediré más.,0,0
1TPABH2D,5,20 sep. 2023,Soy muy artificiales pero se ven bonitas para adornar.,0,0
1TPABH2D,5,10 sep. 2023,Está muy bonito.,0,0
1TPABH2D,5,07 sep. 2023,Bueno.,0,0
1TPABH2D,5,06 sep. 2023,Cumple con la descripción.,0,0
1TPABH2D,5,01 sep. 2023,Me gustó mucho 😃.,0,0
1TPABH2D,5,31 ago. 2023,"Cumple con lo mencionado, buena calidad. Pediré 2 paquetes más.",0,0
1TPABH2D,5,29 ago. 2023,Excelente producto.,0,0
1TPABH2D,5,26 ago. 2023,Excelente.,0,0
1TPABH2D,5,25 ago. 2023,Se ven bonitas ya puestas.,0,0
1TPABH2D,5,25 ago. 2023,Buena relación precio calidad.,0,0
1TPABH2D,5,24 ago. 2023,Está buenísima por el precio es una re planta hasta creyeron que era de verdad la colgué arriba y deje caer así toda la planta quedó re linda mi casa es mucho para el precio que uno lo paga y parece de verdad así que estoy muy contenta muchas gracias.,0,0
1TPABH2D,5,24 ago. 2023,Me gustaron mucho se ven muy naturales.,0,0
1TPABH2D,5,23 ago. 2023,Hermoso.,0,0
1TPABH2D,5,16 ago. 2023,Muy buena decoración.,0,0
1TPABH2D,5,14 ago. 2023,Me agradaron mucho.,0,0
1TPABH2D,5,13 ago. 2023,Están muy bonitas super padres.,0,0
1TPABH2D,5,11 ago. 2023,Muy buenas. Bonito color y material.,0,0
1TPABH2D,5,10 ago. 2023,Excelente.,0,0
1TPABH2D,5,06 ago. 2023,Muy buenos.,0,0
1TPABH2D,5,02 ago. 2023,Buen tamaño y fácil para adornar.,0,0
1TPABH2D,5,01 ago. 2023,"Están largas y resistentes, color realista, buena calidad.",0,0
1TPABH2D,5,26 jul. 2023,Se caen un poco las hojas pero bonitas.,0,0
1TPABH2D,5,25 jul. 2023,"Excelente productos, me gustaron mucho, todo bien, recomendados.",0,0
1TPABH2D,5,24 jul. 2023,Por el precio es buen producto.,0,0
1TPABH2D,5,15 jul. 2023,"Excelente producto, buen material.",0,0
1TPABH2D,5,11 jul. 2023,"Muy buen producto, lo compre en diciembre del 2022 y estamos en julio de 2023 y sigue estando como nuevo!!.",0,0
1TPABH2D,5,08 jul. 2023,Tal cual como la foto.,0,0
1TPABH2D,5,02 jul. 2023,Excelente.,0,0
1TPABH2D,5,01 jul. 2023,"Muy buen producto, he decorado varias partes de mis casa, lucen muy bien.",0,0
1TPABH2D,5,17 jun. 2023,Excelente.,0,0
1TPABH2D,5,13 jun. 2023,Excelente producto auxiliar en la decoración de las fiestas. Recomendable al 100%.,0,0
1TPABH2D,5,12 jun. 2023,"Muy bonitas, lucen muy bien.",0,0
1TPABH2D,5,11 jun. 2023,Estan muy bien.,0,0
1TPABH2D,5,07 jun. 2023,Excelente.,0,0
1TPABH2D,5,06 jun. 2023,Me gusta mucho decore mi cuarto y se ve super genial.,0,0
1TPABH2D,5,31 may. 2023,Muy bien producto.,0,0
1TPABH2D,5,24 may. 2023,Es sencillo pero luce bien.,0,0
1TPABH2D,5,23 may. 2023,Muy lindas me gustaron mucho!!.,0,0
1TPABH2D,5,22 may. 2023,Muy bueno.,0,0
1TPABH2D,5,19 may. 2023,"Muy bonitas, son esquisitas, me gustaron mucho.",0,0
1TPABH2D,5,17 may. 2023,"Muy bonito rinde bastante! al colocarlo ha sido duradero, recomiendo que al sacarlo de su empaque se haga con cuidado para evitar que se jalen las hojitas.",0,0
1TPABH2D,5,17 may. 2023,Excelente. Parecen naturales. Color y textura y volumen. Al precio súper recomendable.,0,0
1TPABH2D,5,14 may. 2023,Están bien padres estas guías se miran bien bonitas en la decoración que ise me encantaron.,0,0
1TPABH2D,5,13 may. 2023,Muy buen producto lo recomiendo.,0,0
1TPABH2D,5,10 may. 2023,De buena calidad y muy bonitas.,0,0
1TPABH2D,5,06 may. 2023,"Muy bien producto, económico.",0,0
1TPABH2D,5,02 may. 2023,Muy bonitas.,0,0
1TPABH2D,5,30 abr. 2023,"En relación al precio esta super bien, las hojas son pequeñas pero si viene en la descripción, si son 12 tiras y suprr funcionales, vienen en buen color, las recomiendo mucho hay más en el mercado y el precio nada que ver están están super padres.",0,0
1TPABH2D,5,28 abr. 2023,Me gustó mucho.,0,0
1TPABH2D,5,27 abr. 2023,Muy bonitas las recomiendo tal lo que promete.,0,0
1TPABH2D,5,25 abr. 2023,"Muy buen producto, las hojitas vienen ligeramente mas tupidas de lo que pensé.",0,0
1TPABH2D,5,18 abr. 2023,"Hermosas de verdad, la entrada de mi hogar está espectacular.",0,0
1TPABH2D,5,15 abr. 2023,Excelente muy bonito.,0,0
1TPABH2D,5,10 abr. 2023,Excelente.,0,0
1TPABH2D,5,08 abr. 2023,Muy buenos.,0,0
1TPABH2D,5,06 abr. 2023,Me gusto mucho.,0,0
1TPABH2D,5,05 abr. 2023,Excelente de muy buena calidad.,0,0
1TPABH2D,5,03 abr. 2023,Muy bueno.,0,0
1TPABH2D,5,01 abr. 2023,Bonito.,0,0
1TPABH2D,5,01 abr. 2023,"Muy buen producto, es lo que esperaba.",0,0
1TPABH2D,5,28 mar. 2023,Está muy bien hecho por el precio. Volvería a comprar.,0,0
1TPABH2D,5,25 mar. 2023,Exelente producto me encanto.,0,0
1TPABH2D,5,14 mar. 2023,Viene buen follaje en cada tira y son manejables.,0,0
1TPABH2D,5,14 mar. 2023,Exelente producto.,0,0
1TPABH2D,5,06 mar. 2023,"Me gusto mucho el producto, tal cual la imagen, las hojas un poco delicadas pero si vienen bien ordenadas las guirnaldas para que no se enreden.",0,0
1TPABH2D,5,03 mar. 2023,Super bonito adorno.,0,0
1TPABH2D,5,22 feb. 2023,Padrisimas y a buen precio.,0,0
1TPABH2D,5,09 feb. 2023,Bonito.,0,0
1TPABH2D,5,31 ene. 2023,Cumple con todo lo especificado en la descripción del producto.,0,0
1TPABH2D,5,05 ene. 2023,"Me gustaron realmente es lo que esperaba se ven muy bien para decorar, son un poco delicadas se tiene que tratar con cuidado , en tamaño de las hojas son pequeñas pero bien echas.",0,0
1TPABH2D,5,05 ene. 2023,"Estan un poco delgadas, pero ya colgadas se ven lindas.",0,0
1TPABH2D,5,04 ene. 2023,"Están muy bonitos,,los quiero para decorar mi casa y también sirven para adornos d cumpleaños, gracias muy bonitos d verdad,los recomiendo,.",0,0
1TPABH2D,5,04 ene. 2023,"Bien, un poco frágiles pero bien.",0,0
1TPABH2D,5,02 ene. 2023,"Me encantaron, se ven muy muy bonitas, yo las puse con luces led y se ven increíbles, son fáciles de desenredar en caso de que las enredes por accidente.",0,0
1TPABH2D,5,01 ene. 2023,Muy bueno.,0,0
1TPABH2D,5,31 dic. 2022,"Me encantaron, es tal cual la imagen, son de buena calidad. 100% satisfecha con mi compra.",0,0
1TPABH2D,5,28 dic. 2022,Muy bonitas hojas y color de me gustó gracias.,0,0
1TPABH2D,5,17 dic. 2022,"Excelente 👌🏻 muy bonitas y de excelente calidad, me encantaron ❤️.",0,0
1TPABH2D,5,27 nov. 2022,Muy bonitas algo delgadas pero algo bien.,0,0
1TPABH2D,5,26 nov. 2022,Son muy bonitas y resistentes.,0,0
1TPABH2D,5,10 nov. 2022,Mi productome parecióprecioso.,0,0
1TPABH2D,5,04 nov. 2022,Todo bien si la volveria a comprar.,0,0
1TPABH2D,5,02 nov. 2022,"Muy buenas tieas, las tiras están muy bonitas, me encanta mi proyecto con ellas.",0,0
1TPABH2D,5,22 oct. 2022,"Las tiras son abundantes, dan buena vista la verdad, me encantaron, además el largo de las tiras es bastante bueno.",0,0
1TPABH2D,5,21 oct. 2022,Muy bien el producto a buen precio.,0,0
1TPABH2D,5,08 oct. 2022,Eran para mi espisa le encanto muy frondoss y muy bonitas.,0,0
1TPABH2D,5,08 oct. 2022,"Justo lo que pedimos, muy bonito.",0,0
1TPABH2D,5,20 sep. 2022,"Excelente, de buena calidad. Muy bonitas cumplen con la funcion que yo necesitaba. Las conviene con flores y quedaron muy padres sin duda volveré a comprar otras.",0,0
1TPABH2D,5,20 sep. 2022,Están muy bonita y se pueden colocar de muchas maneras.,0,0
1TPABH2D,5,08 sep. 2022,Muy bueno se ve super bonito exelente calidad.,0,0
1TPABH2D,5,06 sep. 2022,Se ven muy bien las recomiendo. Saludos.,0,0
1TPABH2D,5,29 ago. 2022,Buena vista. En lo que se ocupó tuvo buena presentación.,0,0
1TPABH2D,5,29 ago. 2022,Muy lindas la verdad me gustaron mucho.,0,0
1TPABH2D,5,29 ago. 2022,"Muy bonitas, el material es de buena calidad.",0,0
1TPABH2D,5,29 ago. 2022,"Se ven bien, están parejitas y todas del mismo color. No se rompen fácilmente y decoran bonito. Si se necesitan varias para que quede tupido el decorado.",0,0
1TPABH2D,5,24 ago. 2022,Muy naturales ! me encantó!. Volvería a comprar.,0,0
1TPABH2D,5,22 ago. 2022,Muy lindas y son grande las hojas.,0,0
1TPABH2D,5,18 ago. 2022,Muy buena gracias lo quw necesitaba todo al 100.,0,0
1TPABH2D,5,05 ago. 2022,Me gusto pude decorar lo que tenia planeado me encanto el color solo que son muy delgadas tienen pocas hojas.,0,0
1TPABH2D,5,02 ago. 2022,"Estan increibles , las utilice oara decorar mi habitacion y les da un mood totalmente diferente , muy satisfecha con mi compra.",0,0
1TPABH2D,5,26 jul. 2022,"Tal y cual las fotos, buen precio.",0,0
1TPABH2D,5,21 jul. 2022,Más que hermosas super varatas y cada tira trae mucha hoja exelente producto y si lo compraría otra vez recomiendo este producto.,0,0
1TPABH2D,5,19 jul. 2022,Excelente producto me gusto mucho.,0,0
1TPABH2D,5,19 jul. 2022,"Muy bonitas y son muy livianas, excelente para decorar interiores.",0,0
1TPABH2D,5,18 jul. 2022,Excelente y de muy buena calidad lo recomiendo mucho.,0,0
1TPABH2D,5,18 jul. 2022,Solo que no megusto que huele muy mal al abrir.,0,0
1TPABH2D,5,17 jul. 2022,Excelente. Me fue muy util pues la puse para tapar una puerta y se ve muy bonita.,0,0
1TPABH2D,5,14 jul. 2022,Me pareció excelente es lo que esperaba.,0,0
1TPABH2D,5,06 jul. 2022,"Las hojas son de un tamaño menor pero es lo que yo buscaba, y se debe tener cuidado con las hojas porque si se usa fuerza se podrían desprender.",0,0
1TPABH2D,5,30 jun. 2022,Excelentes me gusro el diseño es diferente al común.,0,0
1TPABH2D,5,26 jun. 2022,Excelente muy bien de buena calidad ??.,0,0
1TPABH2D,5,18 jun. 2022,"De muy nueva calidad, como se aprecia en la fotografía. Gracias!.",0,0
1TPABH2D,5,17 jun. 2022,"Excelente por el precio, sin escasas las hojas en cada tira, son 12 y el precio es excelente.",0,0
1TPABH2D,5,17 jun. 2022,"Muy buen producto, cumple con las espectativas.",0,0
1TPABH2D,5,10 jun. 2022,"Usarás con sutileza no son para uso rudo, pero está muy bonitos.",0,0
1TPABH2D,5,08 jun. 2022,"Me encanto ,me fueron funcionales.",0,0
1TPABH2D,5,06 jun. 2022,Me parece muy bueno para adornar para un evento o reso.,0,0
1TPABH2D,5,27 may. 2022,"Me agrado el producto, fue lo que esperaba y me fue de mucha utilidad.",0,0
1TPABH2D,5,22 may. 2022,Están muy bonitas a buen precio.,0,0
1TPABH2D,5,22 may. 2022,Está n sencillas pero muy bonitas.,0,0
1TPABH2D,5,18 may. 2022,"Muy buen material, bonito, económico y compacto.",0,0
1TPABH2D,5,14 may. 2022,Se ven muy reales están hermosas.,0,0
1TPABH2D,5,09 may. 2022,"Excelente producto y muy practico, lo puse en un terrario y se ve muy bien.",0,0
1TPABH2D,5,02 may. 2022,Todo muy biem con la enntrega y producto.,0,0
1TPABH2D,5,06 abr. 2022,Muy bonitas y buena calidad. Super recomendadas.,0,0
1TPABH2D,5,17 mar. 2022,Me gustaron mucho muy buen material se ven muy bien para el arreglo de un aro.,0,0
1TPABH2D,5,10 mar. 2022,"Se ven hermosas, son pequeñas depende para que las utilizas pero se ven muy bien.",0,0
1TPABH2D,5,25 feb. 2022,"Muy bien, me gustaron si son tal cual se ven en la imagen.",0,0
1TPABH2D,5,21 feb. 2022,"Excelente, buena calidad, dura bastante a la interperie.",0,0
1TPABH2D,5,01 feb. 2022,"Las hojas son mas pequeñas de lo que oensaba pero todo de buena calidad, se cen hermosas.",0,0
1TPABH2D,5,27 ene. 2022,Súper lindo esperaba menos calidad me encantó y lo recomiendo.,0,0
1TPABH2D,5,23 ene. 2022,Muy resistentes de buena calidad me encantaron estan padrsimas.,0,0
1TPABH2D,5,26 ago. 2021,Estan muy padres es lo q buscaba.,0,0
1TPABH2D,5,07 nov. 2022,A todos les gustaron se ven hermosas y muy naturales tendre que pedir más mi familia quiere varios jueguitos de estas plantas gracias mercado libre.,0,0
1TPABH2D,5,08 jul. 2022,"Feliz por la compra, me gustaron mucho y son resistentes. Se ven hermosas en mi espacio. Recomiendo ampliamente.",0,0
1TPABH2D,5,04 jul. 2022,"¡increíblemente hermosas!. No entiendo quien le pondría 1 sola estrella. Están perfectas, incluso pediré nuevamente otras.",0,0
1TPABH2D,5,14 abr. 2022,Exelente decoración muy bien para el precio las hojas un poco pequeñas pero muy buen producto.,0,0
1TPABH2D,4,26 abr. 2023,Sencillo pero sirve bien para decorar.,1,0
1TPABH2D,4,13 sep. 2023,Buenas plantas artificiales.,0,0
1TPABH2D,4,06 sep. 2023,Mi decoración quedó ok.,0,0
1TPABH2D,4,31 ago. 2023,"Muy bien, pero 1 tira venía más corta que todas.",0,0
1TPABH2D,4,23 ago. 2023,Bonito color verde fuerte.,0,0
1TPABH2D,4,04 ago. 2023,Buen producto solo que las hojas venían muy frágiles.,0,0
1TPABH2D,4,13 jul. 2023,"Muy lindas, el único detalle es que tienen un olor feo, después de dejarla unas horas fuerte del empaque se le quito, pero si era muy desagradable.",0,0
1TPABH2D,4,20 jun. 2023,"Un poco chicas las hojas, pero por el bajo precio, es justo lo que paga uno.",0,0
1TPABH2D,4,16 jun. 2023,Las utilice para una decoración y se ven bonitas.,0,0
1TPABH2D,4,15 mar. 2023,Muy lindas y muy útiles muy buena compra muy resistentes las recomiendo ampliamente.,0,0
1TPABH2D,4,04 feb. 2023,Buen producto.,0,0
1TPABH2D,4,22 nov. 2022,Buena compra.,0,0
1TPABH2D,4,20 sep. 2022,"Bueno están muy bonitas solo que hay un detalle de que las hojas son muy pequeñas, pero de ahí si me gustó.",0,0
1TPABH2D,4,07 sep. 2022,"Son largas y delgadas , pero se acomodan perfecto para decorar me. Gustaron!.",0,0
1TPABH2D,4,09 ago. 2022,Están bien aún que están muy separadas las hojas una de otra.,0,0
1TPABH2D,4,08 ago. 2022,Se ve bien. Calidad por precio.,0,0
1TPABH2D,4,11 jul. 2022,"Calidad 8 de 10, bonitas en follaje.",0,0
1TPABH2D,4,10 jul. 2022,"Me gustaron mucho, en la imagen se ven más frondosas pero cumplen con el objetivo, muy buen producto.",0,0
1TPABH2D,4,27 jun. 2022,Bien estan bien de acorde al precio.,0,0
1TPABH2D,4,07 may. 2022,"Las recomiendo, son identicas que en la foto.",0,0
1TPABH2D,4,30 mar. 2022,"Es bueno, solo un poco pequeñas la hojas pero me funcionó.",0,0
1TPABH2D,3,14 sep. 2021,"No es el tamaño de las hojas, en la imagen dice 7*8 y miden 3. 5*4 cm, además mide 2. 1 m de largo, no 2. 3. Ojo ahí.",0,31
1TPABH2D,3,29 jul. 2023,Ok.,0,0
1TPABH2D,3,01 jul. 2023,Muy pequeño.,0,0
1TPABH2D,3,19 may. 2023,Las hacia más tupidas pero en relación al precio es justo.,0,0
1TPABH2D,3,26 ago. 2022,Pensé que venían más tupidas de ojas pero si están bonitas.,0,0
1TPABH2D,3,03 ago. 2022,Perfecto solo que yo me equivoqué quería hiedra.,0,0
1TPABH2D,3,04 jul. 2022,No me puedo quejar del precio pero son algo sencillas.,0,0
1TPABH2D,3,31 ene. 2022,"No es lo que esperaba, pero me servirá, gracias !!.",0,0
1TPABH2D,2,09 sep. 2023,No lo recomiendo esta muy abierto y no funciona para un muro verde.,0,0
1TPABH2D,2,17 abr. 2023,Están chidas pero las hojas están chiquitas.,0,0
1TPABH2D,2,03 feb. 2023,No me gustó mucho.,0,0
1TPABH2D,2,21 feb. 2022,Es lo q se pidió pero esta muy sencilla.,0,0
1TPABH2D,1,13 mar. 2022,"Es totalmente falso que las hojas miden 7 cms apenas y alcanzan los 3 cms mienten en su publicación y eso que pregunte antes de pedir las medidas de la hoja y me aseguraron que eso median, regresare el producto.",0,22
1TPABH2D,1,18 ago. 2022,Las ponen muy bonitaa y te engañan el producto no es lo que te muestran.,0,1
1TPABH2D,1,13 sep. 2022,Yo creí comprar la oferta qué no rebasaba de $150. Resulta estan cobrando muchos intereses estas tiras costo de $1500estoy inconforme.,0,0
1TPABH2D,1,07 mar. 2022,Están muy lindas. Volveré a comprar.,0,0
CDMHM3C4U,5,07 sep. 2023,Están exelentes muy bonitos mejor de lo que pensé.,0,0
CDMHM3C4U,5,05 sep. 2023,Excelente! gracias.,0,0
